web-scraper-order,web-scraper-start-url,user,date,review
,klook.com/id/hotels/detail/235639-sofitel-singapore-sentosa-resort--spa-sg-clean,Praveena Preety,Diulas: 29 Apr 2021,"Adalah pengalaman staycation yang damai dan tenteram. Tempat tidur sangat nyaman, memiliki tidur terbaik. Sarapan juga benar-benar enak. Menyukai gagasan burung merak berkeliaran di sekitar resor juga. Pasti terasa jauh dari hiruk pikuk kehidupan kota. Akan kembali lagi!"
,klook.com/id/hotels/detail/235639-sofitel-singapore-sentosa-resort--spa-sg-clean,Vanessa,Diulas: 29 Apr 2021,"Pergi untuk Staycation Tak Terbatas yang full board dan benar-benar menikmati fakta bahwa kami tidak perlu menghabiskan waktu memikirkan di mana harus makan. Kami berhasil bersantai di kolam renang selama slot waktu yang kami pesan, meminjam beberapa sepeda yang sangat bagus untuk dibawa keluar untuk bersepeda, dan menikmati kue ulang tahun di tim. Ini mungkin tidak relevan tetapi tekanan airnya bagus, Anda bisa mandi air panas setelah seharian di pantai. Kamar-kamarnya juga diberi jarak dengan baik dan tenang. Layanan secara keseluruhan tidak luar biasa apakah pra-menginap / selama / pasca-menginap. Mengirim 2 email sebelum menginap yang tidak pernah menjawab dan harus menelepon pada akhirnya. Di malam hari, kami terjebak menunggu di kamar kami dan akhirnya terlambat untuk makan malam karena pengering rambut tidak mau mati dan butuh 3 panggilan dan 20+ menit yang baik bagi seseorang untuk datang untuk memperbaikinya (itu salah satu dari pengering rambut yang menempel di dinding yang harus Anda tekan untuk digunakan sehingga sepertinya ada sesuatu yang macet). Kami diberitahu bahwa kami boleh meninggalkan ruangan, tetapi itu akan menjadi bahaya kebakaran yang sangat besar, jadi kami menunggu. Tidak ada yang memiliki sikap buruk tetapi seluruh pengalaman dan layanan tidak bersih. Makanan di The Cliff enak (Makan Siang dan Makan Malam), dan kami sarapan di Kwee Zeen. Jika Anda bukan penggemar burung dan burung merak, Anda mungkin ingin memilih untuk makan di dalam ruangan: D Makan siang pada hari check-in - Ini berhasil dengan baik, kami bisa makan siang sementara kamar kami bersiap-siap. Secara keseluruhan, saya akan merekomendasikan tinggal, ini adalah liburan yang menyenangkan, meskipun layanan dapat dilakukan dengan beberapa merapikan."
,klook.com/id/hotels/detail/235639-sofitel-singapore-sentosa-resort--spa-sg-clean,Tara,Diulas: 28 Apr 2021,"Cinta cinta cinta hotel ini. Layanan, kamar, dan kolam renangnya luar biasa! Akan senang untuk kembali lagi."
,klook.com/id/hotels/detail/235639-sofitel-singapore-sentosa-resort--spa-sg-clean,Qiao Bin Joelynn,Diulas: 28 Apr 2021,"Kedua kalinya kesini, suka banget sama suasana Sofitel Sentosa. Check-in hanya memakan waktu 15 menit. Makanan yang disajikan di Infinite Couple Experience standar. Keramahan yang luar biasa dan layanan yang disediakan oleh semua staf hotel"
,klook.com/id/hotels/detail/235639-sofitel-singapore-sentosa-resort--spa-sg-clean,Zi San,Diulas: 27 Apr 2021,"Jika Anda mencari pelarian semalam, di suatu tempat yang jauh dari keramaian dan hiruk pikuk, ini akan menjadi sempurna. Jangan mengharapkan sesuatu yang luar biasa (kecuali burung merak tentu saja), karena ini semua tentang pesona lama nostalgia. Jangan merencanakan hal lain atau keluar dari batas, nikmati saja getarannya yang lambat dan Anda akan menenangkan jiwa Anda. Dari segi makanan: makan siang babi Claypot Cina adalah yang terbaik, bakuteh hambar; makan malam baramundi utama adalah anak laki-laki di sisi membingungkan rasa bijaksana, ayam utama bekerja sangat baik dengan jumlah berlebihan daun bawang, tiramisu besar, sorot harus-order cheesy bayi salad hidangan; sarapan hari berikutnya secara keseluruhan sedikit mengecewakan meskipun aliran bebas, terutama nasi lemak yang lembek. Tidak ada kolam renang anak-anak jadi bawalah pelampung Anda, apalagi jika Anda mencoba kolam renang dewasa yang indah."
,klook.com/id/hotels/detail/235639-sofitel-singapore-sentosa-resort--spa-sg-clean,Shuyang,Diulas: 27 Apr 2021,"paket yang sangat baik. Makan siang dan makan malam sangat enak. Hotel memiliki nuansa Staycation, bagus untuk liburan singkat"
,klook.com/id/hotels/detail/235639-sofitel-singapore-sentosa-resort--spa-sg-clean,aravind,Diulas: 27 Apr 2021,Tempat yang bagus untuk bersantai terutama selama masa-masa sulit ini! mengambil paket yang sudah termasuk sarapan siang dan makan malam. makanannya enak! merak berlari kemana-mana untuk ops foto yang bagus! Pasti akan kembali lagi! kamar juga besar.
,klook.com/id/hotels/detail/235639-sofitel-singapore-sentosa-resort--spa-sg-clean,Pei yia,Diulas: 26 Apr 2021,"Kecewa karena hotel pasti kewalahan dengan jumlah tamu. Sebelum check-in, saya memberi tahu meja depan bahwa ini adalah ulang tahun putra saya yang berusia 3 tahun sehingga setiap gerakan yang baik akan dihargai. Tidak ada yang terjadi selama kami menginap 3 hari 2 malam. Tidak ada layanan sama sekali, kami makan dua kali di tebing tetapi layanan di bawah standar yang kami terus-menerus harus meminta layanan. Saya melihat tamu lain yang merayakan ulang tahun anak-anak mereka di hotel dan seorang influencer mengirim kue deco n ke kamar tetapi kami tidak mendapat apa-apa. Sub-standar seperti itu sama sekali tidak dapat diterima"
,klook.com/id/hotels/detail/235639-sofitel-singapore-sentosa-resort--spa-sg-clean,Zhen Yee Ellie,Diulas: 26 Apr 2021,Sarapan adalah bencana ketika mereka menugaskan kami tempat duduk di luar ruangan. burung-burung beterbangan membantu diri mereka sendiri untuk mendapatkan makanan yang dapat saya toleransi (karena kami berada di sekitar tanaman hijau) tetapi saya tidak dapat mentolerir nyamuk! 2 dari kami dengan 2 anak kami dengan mudah memiliki 20 gigitan besar meskipun kami mencoba untuk bergegas melalui sarapan kami. serius bahkan lebih buruk daripada resor batam dalam aspek ini. kamar dan segala sesuatu yang lain baik-baik saja maka tidak memberikan tinggal satu bintang. pasti tidak akan kembali kecuali mereka memperbaiki masalah nyamuk.
,klook.com/id/hotels/detail/235639-sofitel-singapore-sentosa-resort--spa-sg-clean,Irene,Diulas: 26 Apr 2021,"Saya menginap 3 hari 2 malam di hari kerja dengan Sofitel Sentosa secara keseluruhan menyenangkan jika Anda tidak suka keramaian. Namun, lokasinya tidak dekat dengan atraksi, jadi perlu bepergian untuk kegiatan dan makanan. Kamar hotel bersih tapi dekorasi dan finishingnya kuno. Pasti butuh reno besar. Karpet di sepanjang koridor kamar berdebu dan kotor. Pengering rambut yang disediakan di kamar tidak begitu kuat. Saya minum teh saat Lebaran. Itu menyenangkan tetapi restoran mengizinkan pemolesan lantai ketika tamu ada. Jadi itu agak bising dan merusak suasana tenang yang saya bayar. Saya juga pergi ke tebing untuk makan malam. Makanannya enak dan stafnya sangat membantu dan sabar dengan pesanan saya. Saya pasti akan kembali lagi ke tebing."
,klook.com/id/hotels/detail/235639-sofitel-singapore-sentosa-resort--spa-sg-clean,Chu Ming,Diulas: 25 Apr 2021,"Suka lentera merah besar di lobi dan musik orkestra Cina, itu benar-benar mengangkat suasana CNY. Kamar luas dengan bak mandi. Sarapan yang fantastis dengan pilihan Cina dan Barat."
,klook.com/id/hotels/detail/235639-sofitel-singapore-sentosa-resort--spa-sg-clean,Te Ting,Diulas: 25 Apr 2021,"Kamar yang nyaman dan staf yang ramah. Hotel ini menyediakan layanan bus antar-jemput ke Harbourfront yang menurut saya sangat nyaman. Secara keseluruhan, saya cukup menikmati masa tinggal saya."
,klook.com/id/hotels/detail/235639-sofitel-singapore-sentosa-resort--spa-sg-clean,Irlada,Diulas: 25 Apr 2021,Ruangan itu berderit bersih dan kami memiliki waktu santai di kolam renang. Secara keseluruhan pengalaman menginap yang luar biasa!
,klook.com/id/hotels/detail/235639-sofitel-singapore-sentosa-resort--spa-sg-clean,Jamuna Rani,Diulas: 25 Apr 2021,Hotel dan makanannya bagus hanya proses pemesanan spa yang buruk
,klook.com/id/hotels/detail/235639-sofitel-singapore-sentosa-resort--spa-sg-clean,Felicia,Diulas: 25 Apr 2021,Pelayanan staf cukup baik. Kamarnya agak tua.
,klook.com/id/hotels/detail/235639-sofitel-singapore-sentosa-resort--spa-sg-clean,ANG,Diulas: 25 Apr 2021,"Pengalaman resor yang benar-benar santai dan luar biasa dan dengan menyiapkan semua makanan, Anda bahkan tidak perlu memikirkan di mana harus makan"
,klook.com/id/hotels/detail/235639-sofitel-singapore-sentosa-resort--spa-sg-clean,Sharon,Diulas: 24 Apr 2021,Luar biasa. Kami memiliki staycation paling santai &amp; indah. Layanan melebihi harapan kami.
,klook.com/id/hotels/detail/235639-sofitel-singapore-sentosa-resort--spa-sg-clean,Rebecca Young Cuiang,Diulas: 24 Apr 2021,"Proses check in cepat dan lancar, kami datang lebih awal untuk makan siang dan selesai lebih awal, dan meja depan membantu mengatur check-in lebih awal. Kamar sangat bagus meskipun sedikit kuno tetapi masih memiliki pesonanya. Ada beberapa bangunan perancah ketika kami check in, suara keras konstan yang dapat didengar dari dalam kamar kami dan kami tidak bisa menikmati kedamaian kami (ironisnya, bagian kamar kami adalah sayap perdamaian). TV sudah tua dan bukan TV pintar. Makan malam di The Cliff sangat bagus, suasana yang menyenangkan. Pelayan sangat penuh perhatian dan cepat dengan layanan, kami bersenang-senang makan. Kolam renang cukup ramai dengan anak-anak dan orang-orang yang berjemur, kami tidak dapat menemukan tempat yang bagus dan memutuskan untuk menuju ke Pantai Tanjong yang sangat mudah diakses dari area kolam, jaraknya cukup dekat. Secara keseluruhan masih pengalaman menginap yang menyenangkan dan kami menikmati ketenangan resor."
,klook.com/id/hotels/detail/235639-sofitel-singapore-sentosa-resort--spa-sg-clean,Jasmine,Diulas: 24 Apr 2021,"Tempat yang bagus untuk menginap karena santai, banyak pilihan untuk bersantap, kamar bersih, dan lingkungan! Terima kasih KLOOK untuk penawaran hebatnya!"
,klook.com/id/hotels/detail/235639-sofitel-singapore-sentosa-resort--spa-sg-clean,Joyce,Diulas: 24 Apr 2021,Terletak tepat di antara Pantai Tanjong dan Pantai Palawan :) akses mudah ke trem juga untuk berkeliling Pulau Sentosa. Memiliki staycation yang menyenangkan di sini!
,klook.com/id/hotels/detail/235639-sofitel-singapore-sentosa-resort--spa-sg-clean,Natasha,Diulas: 23 Apr 2021,"Dengan alasan yang sangat indah, benar-benar merasa seperti kami berada di luar negeri! Area kolam cantik dan santai, meskipun bagian dalam kolam tampak agak tua / kotor. Makanan secara keseluruhan cukup bagus (terutama di tebing). Sarapan akan lebih baik jika setiap pesanan lebih kecil sehingga kami dapat memesan lebih banyak variasi. Secara keseluruhan ruangan itu nyaman dan nyaman."
,klook.com/id/hotels/detail/235639-sofitel-singapore-sentosa-resort--spa-sg-clean,cheow soon albert,Diulas: 23 Apr 2021,Tempat yang bagus untuk bersantai dan bersantai .. paket bagus terutama dengan semua makanan termasuk .. makanan lebih dari cukup dan pilihan bagus. Makanan Italia sangat luar biasa?
,klook.com/id/hotels/detail/235639-sofitel-singapore-sentosa-resort--spa-sg-clean,HANG CHENG,Diulas: 23 Apr 2021,"1. saya diyakinkan oleh tim klook bahwa semua aktivitas dalam voucher akan diberikan pada saat check-in (Tidak perlu pengaturan di pihak saya). Tetapi akhirnya, slot pijat TIDAK tersedia pada hari check-in. Saya diberitahu oleh SoSpa bahwa saya perlu memesan slot sendiri 7 hari sebelum check-in atau menelepon untuk memeriksa tanggal yang tersedia sebelum mengatur kamar hotel! ini sangat mengecewakan!!! apa gunanya mendapatkan paket, ketika Spa tidak tersedia untuk staycation? Apa gunanya mendapatkan paket ketika tidak ada instruksi yang diberikan kepada pelanggan tentang pengaturan sendiri pada kegiatan yang disebutkan di atas?? fakta yang paling mengecewakan adalah: saya bertanya kepada klook CS 3 KALI sebelum / sesudah memesan paket ini tentang pengaturan makan malam dan spa. CS bilang semua kegiatan sudah diatur. Tak bisa bicara! 2. kamar terlihat &amp; terasa bersih, tapi sangat terganggu dengan bantal yang disediakan. penyangga bantal sama baiknya dengan tidur di kasur langsung (tipis n rata). 3. makanan di tebing enak, ruang sarapan agak sibuk ketika kami mampir sehingga meja agak berantakan di sekitar kami."
,klook.com/id/hotels/detail/235639-sofitel-singapore-sentosa-resort--spa-sg-clean,Claire,Diulas: 23 Apr 2021,"Kami telah beberapa kali menginap di berbagai hotel tetapi mungkin tidak akan menginap dengan Sofitel Sentosa lagi. Pengalaman yang cukup biasa-biasa saja/tidak menyenangkan sejak awal - check-in sangat menyiksa ~ 1 jam menunggu berdiri, meskipun setidaknya ada 4 konter check-in dan hanya 3 pihak di depan kami dalam antrian. Proses check-in sendiri tidak efisien, dengan staf loket harus bolak-balik ke kantor berkali-kali. Kami mengambil makanan kami di Kwee Zeen, The Cliff dan The Garden - ini hanya makan kami di The Garden yang mengesankan dan cukup mengesankan; dua lainnya rata-rata di terbaik. Umumnya sebagian besar staf tampak sangat lelah dan hampir tidak senang bekerja. Pada titik harga ini dan untuk hotel yang mengklaim memiliki standar &quot;mewah&quot;, Anda dapat dengan mudah menemukan kesepakatan menginap yang lebih baik di tempat lain."
,klook.com/id/hotels/detail/235639-sofitel-singapore-sentosa-resort--spa-sg-clean,Saleem,Diulas: 23 Apr 2021,"ini adalah tempat yang indah untuk menginap, sarapannya luar biasa!"
,klook.com/id/hotels/detail/235639-sofitel-singapore-sentosa-resort--spa-sg-clean,Zhenhao Kevin,Diulas: 23 Apr 2021,Pengalaman sangat bagus! Istirahat yang baik dari kehidupan kota yang sibuk dan semua staf yang menyenangkan dan bermanfaat. Ruangan itu besar dan itu adalah tempat menginap yang bagus!
,klook.com/id/hotels/detail/235639-sofitel-singapore-sentosa-resort--spa-sg-clean,Ronel,Diulas: 22 Apr 2021,"Tempat ini penuh dengan getaran resor. Namun mengingat sejarah hotel, dapat dimengerti bahwa perabotan kamar sudah tua dengan tanda-tanda keausan. Staf hotel sebagian besar ramah dan membantu kecuali beberapa staf pria di Le Bar. Mereka acuh tak acuh ketika kami mencoba mengangkat tangan untuk memesan."
,klook.com/id/hotels/detail/235639-sofitel-singapore-sentosa-resort--spa-sg-clean,Lai Ping,Diulas: 22 Apr 2021,Pengalaman yang bagus. Hotel ini dekat dengan pantai. Itu juga tim untuk membawa Anda ke berbagai tempat.
,klook.com/id/hotels/detail/235639-sofitel-singapore-sentosa-resort--spa-sg-clean,Vivian,Diulas: 22 Apr 2021,"Proses check in dan out cepat dan efisien, staf sangat membantu. Kualitas makanan di meja Sarapan bagus , dekorasi di kamar ditata dengan indah . Pengalaman yang sangat menyenangkan"
,klook.com/id/hotels/detail/235639-sofitel-singapore-sentosa-resort--spa-sg-clean,Ivonne,Diulas: 22 Apr 2021,"Sangat resor merasa. Alasan yang luas. Kamar terlihat tua, tetapi terawat dengan baik"
,klook.com/id/hotels/detail/235639-sofitel-singapore-sentosa-resort--spa-sg-clean,Christel Hsueh Lien,Diulas: 22 Apr 2021,"Pengalaman itu secara keseluruhan sangat bagus. Layanan sangat baik setiap tempat kami pergi. Puncaknya adalah makan malam kami di The Cliff. Antipasti, hidangan utama, dan hidangan penutup luar biasa."
,klook.com/id/hotels/detail/235639-sofitel-singapore-sentosa-resort--spa-sg-clean,Ruby,Diulas: 21 Apr 2021,Repot check-in dan kamar besar dan nyaman. Kebersihan dapat ditingkatkan. Kualitas makanan sangat baik di berbagai restoran. Terima kasih!
,klook.com/id/hotels/detail/235639-sofitel-singapore-sentosa-resort--spa-sg-clean,Su Xin,Diulas: 21 Apr 2021,"Menginap dari sel hingga kamis. Sayangnya tidak bisa mendapatkan perpanjangan waktu check out. Semua baik-baik saja kecuali layanan bfast cukup lambat, harus menunggu beberapa saat untuk mendapatkan perhatian untuk memesan makanan, mungkin itu adalah hunian penuh."
,klook.com/id/hotels/detail/235639-sofitel-singapore-sentosa-resort--spa-sg-clean,Yanling,Diulas: 21 Apr 2021,Layanan kelas dunia benar-benar terasa seperti Bali! Kolam renang juga tenang dan tidak ramai sama sekali. Berbagai pilihan tempat makan di hotel dan sekitarnya
,klook.com/id/hotels/detail/235639-sofitel-singapore-sentosa-resort--spa-sg-clean,Yoke Kwan,Diulas: 21 Apr 2021,"Kamar yang bagus dan luas. Makanan di Kwee Zeen dan The Cliff sangat enak. Lokasinya dekat dengan Pantai Tanjong, memungkinkan liburan cepat ke ebac. Punya waktu yang indah di sini."
,klook.com/id/hotels/detail/235639-sofitel-singapore-sentosa-resort--spa-sg-clean,Jen,Diulas: 21 Apr 2021,"Tempat menginap yang indah jauh dari keramaian dan hiruk pikuk kota. Pasti nilai yang besar untuk 2 orang dengan 1 jam pijat di So Spa, 3 menu makan malam di The Cliff dan sarapan di Kwee Zeen termasuk dalam paket. Disarankan untuk memesan 2 malam menginap jika anggaran Anda memungkinkan Perlengkapan amenitas di kamar adalah isyarat yang manis. Itu terdiri dari pembersih tangan mini dan tisu pembersih.<Dinner @ The Cliff> Antipasti 1. BURRATA &amp; HEIRLOOM CHERRY TOMATO (benar-benar nikmat. Bahan-bahannya saling melengkapi) 2. BABY GEMS SALAD (deskripsi tidak terdengar menarik dan tidak terlihat sangat menggugah selera tetapi rasanya luar biasa nikmat) Hidangan utama: 1. GARGANELLI ALLA BOLOGNESE (rasa dan aroma keju sedikit menyengat) 2. POLLO AL DIAVOLA (ini adalah porsi kecil yang disajikan dalam wajan. Beraroma tapi tidak terlalu empuk) Makanan penutup: 1. DARK CHOCOLATE CHERRY CAKE (ini enak) 2. SICILIAN CANNOLI (Saya tidak akan memesan ini lagi. Bukan jenis makanan penutup saya) Layanan oleh Jason Ee sangat baik. Perhatikan bahwa meskipun pakaiannya dinyatakan sebagai pakaian kasual, ada tamu yang mengenakan celana pendek dan sandal.<Breakfast @ Kwee Zeen> Otah dari set nasi lemak sangat enak. Sayap ayam terlalu keras untuk selera saya. Jus wortel segar dan muesli bircher pasti membuat hari saya menyenangkan!"
,klook.com/id/hotels/detail/235639-sofitel-singapore-sentosa-resort--spa-sg-clean,JELEINE,Diulas: 20 Apr 2021,Hotel tampaknya sedikit tanggal dan tidak terawat dengan sangat baik. Secara keseluruhan paket full board sepadan dengan harganya karena kami menikmati makanan terutama di tebing.
,klook.com/id/hotels/detail/235639-sofitel-singapore-sentosa-resort--spa-sg-clean,Xiang Ning,Diulas: 20 Apr 2021,Kamar tua tapi bersih. Mengambil beberapa permintaan untuk mendapatkan handuk segar tetapi waktu tunggu yang dapat diterima?
,klook.com/id/hotels/detail/235639-sofitel-singapore-sentosa-resort--spa-sg-clean,Merlissa,Diulas: 20 Apr 2021,"Tempatnya tidak terlalu nyaman tapi untungnya ada shuttle bus dari vivo. Fasilitas dan pemandangannya sangat bagus, hanya saja bisa lebih dijaga (banyak daun yang tidak tersapu)."
,klook.com/id/hotels/detail/235639-sofitel-singapore-sentosa-resort--spa-sg-clean,Sindy,Diulas: 20 Apr 2021,"Kedua kalinya datang menginap di Sofitel Singapore untuk merayakan ulang tahun. Mendapat hotel untuk melakukan sedikit dekorasi untuk perayaan. Waktu yang luar biasa seperti biasa! Sangat menikmati kamar. Makan siang &amp; makan malam oke, tidak banyak variasi. Tapi sarapannya enak! Pasti akan kembali lagi! ! !"
,klook.com/id/hotels/detail/235639-sofitel-singapore-sentosa-resort--spa-sg-clean,Elizabeth Yun Hao,Diulas: 20 Apr 2021,Itu adalah saat yang santai. Perangkat teh tinggi benar-benar enak. Kami bersantai di tepi kolam renang yang tidak terlalu ramai. Menggunakan gym juga. Sarapan sangat baik dekat dengan kolam renang. Secara keseluruhan pengalaman yang bagus. Ruangan itu juga nyaman.
,klook.com/id/hotels/detail/235639-sofitel-singapore-sentosa-resort--spa-sg-clean,Lynette,Diulas: 19 Apr 2021,Pengalaman menginap yang santai dan menyenangkan Kamarnya indah Nilai bagus Layanannya samar tergantung pada pekerja penuh waktu dan atau pekerja paruh waktu yang berpengalaman Secara keseluruhan pengalaman menginap yang baik dengan teman-teman
,klook.com/id/hotels/detail/235639-sofitel-singapore-sentosa-resort--spa-sg-clean,Jerlynn Xue Lin,Diulas: 19 Apr 2021,"Itu adalah liburan yang baik dan pengalaman yang luar biasa. Ingatlah untuk memesan slot spa sebelumnya, mereka akan secara otomatis mengalokasikan Anda slot waktu."
,klook.com/id/hotels/detail/235639-sofitel-singapore-sentosa-resort--spa-sg-clean,Jayden,Diulas: 19 Apr 2021,"check-in membutuhkan sedikit waktu, harus membuat orang terhuyung-huyung untuk efisiensi yang lebih baik. Kamarnya bagus, luas dan dengan bak mandi. Kolam renangnya bagus dengan banyak kursi berjemur."
,klook.com/id/hotels/detail/235639-sofitel-singapore-sentosa-resort--spa-sg-clean,Chua,Diulas: 19 Apr 2021,Ini adalah pengalaman yang menyenangkan dengan 3 kali makan termasuk. Kami berenang untuk berenang dan berjalan-jalan di sekitar pulau
,klook.com/id/hotels/detail/235639-sofitel-singapore-sentosa-resort--spa-sg-clean,Hui Min,Diulas: 19 Apr 2021,"Kamar yang bagus dan layanan yang bagus! Kolam renang sebagian besar memiliki kedalaman 2,5 m sehingga tidak ada banyak tempat bagi Anda untuk berdiri. Makan siang itu menyenangkan. Makanan pembuka dan penutup untuk makan malam di The Cliff sangat enak! ! ! [\u1f44d][\u1f3fc] Listriknya biasa saja. Memiliki 4 set sarapan berbeda dan semuanya benar-benar hanya mehhh. Bahkan tidak bisa mendapatkan wafel dengan benar (setidaknya membuatnya hangat?) rasanya seperti ditinggalkan selama berjam-jam."
,klook.com/id/hotels/detail/235639-sofitel-singapore-sentosa-resort--spa-sg-clean,Mui Chin Linda,Diulas: 19 Apr 2021,"Kami benar-benar menikmati kami tinggal. Proses check in agak ramai pada jam 3 sore, tetapi selain itu staf layanan cepat dan hebat! Suka area kolam renang hotel (pesan slot melalui pramutamu - paling tidak ramai sebelum jam 5 sore) dan semua makanan kami, terutama di Tebing. Pasti akan kembali lagi dalam sekejap untuk istirahat dari kota!"
,klook.com/id/hotels/detail/235639-sofitel-singapore-sentosa-resort--spa-sg-clean,Zhiqing,Diulas: 19 Apr 2021,"Pergi untuk keluarga Staycay akhir pekan sebelumnya. Secara keseluruhan, ini adalah pengalaman menginap yang menyenangkan tetapi resor ini memiliki beberapa fasilitas kumuh dan kamar akan membutuhkan beberapa peningkatan. Kelebihan: 1. Lokasi tenang dengan beberapa tanaman hijau yang indah 2. Dekat pantai melalui tangga 3. Sepeda gratis untuk penggunaan tamu 4. Variasi dalam pilihan sarapan Kontra: 1. Tidak bisa mendapatkan 3 kamar berdampingan seperti yang diminta sebelumnya :( 2 Layanan keseluruhan bisa lebih baik 3. Beberapa kamar cukup kumuh 4. Bus antar-jemput hanya bisa feri ke stasiun HarbourFront (akan lebih bagus jika mereka bisa berhenti di tempat-tempat wisata utama di pulau itu)"
,klook.com/id/hotels/detail/235639-sofitel-singapore-sentosa-resort--spa-sg-clean,Yili,Diulas: 19 Apr 2021,"Kami mendapat paket yang datang dengan semua 3 kali makan dan kami tidak menyesal. Makanan di The Cliff sangat enak sehingga setelah makan siang, kami tidak bisa menunggu untuk makan malam. Ruangan itu sangat menyambut dan bahkan ranjang bayi nyaman. Si kecil kami tidak kesulitan tidur dan sepertinya sangat menyukai ranjang bayi. Staycation pertama kami sejak bayi lahir dan staf membuatnya sangat lancar dan bebas khawatir. Staf yang ramah dan menampung bayi. Layanan hebat dan nilai uang yang luar biasa! (Memposting gambar makanan dari The Cliff)"
,klook.com/id/hotels/detail/235639-sofitel-singapore-sentosa-resort--spa-sg-clean,Zhen Lin Eneida,Diulas: 18 Apr 2021,Staycay damai yang indah. Brunch dapat memberi makan 3 hingga 4 orang!
,klook.com/id/hotels/detail/235639-sofitel-singapore-sentosa-resort--spa-sg-clean,ZH,Diulas: 18 Apr 2021,"Bersenang-senang jauh dari kota. Benar-benar merasa seperti berada di luar negeri di sebuah resor. Lingkungannya luar biasa, kolam renangnya santai dan semua langkah-langkah menjaga jarak aman diterapkan. Jangan lupa untuk memesan slot check-in Anda beberapa hari sebelum kedatangan (dikirim ke email Anda) bersama dengan slot pool. Makanan juga sangat bagus. Pasti merekomendasikan!"
,klook.com/id/hotels/detail/235639-sofitel-singapore-sentosa-resort--spa-sg-clean,Su,Diulas: 18 Apr 2021,Resor ini mempesona dan sangat indah. Layanan ini benar-benar luar biasa juga. Pasti akan kembali untuk lebih banyak retret liburan?
,klook.com/id/hotels/detail/235639-sofitel-singapore-sentosa-resort--spa-sg-clean,Lay Chiat Agnes,Diulas: 18 Apr 2021,"Saya suka suasana, tenang, eksklusif dan layanan pribadi. Akan tinggal di sini lagi pasti. Beberapa poin untuk perbaikan: kamar kecil umum di dekat restoran memiliki wastafel yang perlu diganti. Untuk hotel kelas satu, fiturnya agak ketinggalan zaman. Wallpaper di kamar terkelupas dan tempat sabun di kamar mandi terkelupas dan perlu diganti. Poin plus yang pasti pergi ke The Cliff, restoran Italia untuk makanan, layanan dan suasana. Luar biasa!"
,klook.com/id/hotels/detail/235639-sofitel-singapore-sentosa-resort--spa-sg-clean,Rachel,Diulas: 18 Apr 2021,Kami membeli paket pengalaman Infinite. Kami tiba pada 17 April dan hujan deras dan banjir. Parkir mobil tidak tertutup dan jauh dari lobi utama. Tidak ada parkir valet juga. Kami basah kuyup karena berjalan dari tempat parkir terbuka. Staf lobi masih tidak mengizinkan kami masuk ke lobi tanpa masuk dengan aman terlebih dahulu dan kami harus meminta handuk untuk mengeringkan diri terlebih dahulu. Tidak ada yang mengangkat panggilan untuk tata graha ketika kami meminta air kemasan. kami menelepon lagi pada hari berikutnya dan staf mengatakan akan mengirim tetapi masih tidak ada air setelah 2 jam. Makanan di Cliff enak tapi sarapannya buruk. Bacon keras dan bubur sebanding dengan makanan rumah sakit. Meminta saus tomat yang tidak pernah datang. Keseluruhan pengalaman bintang 1 untuk hotel bintang 5. Ruang untuk perbaikan silakan.
,klook.com/id/hotels/detail/235639-sofitel-singapore-sentosa-resort--spa-sg-clean,Yih Fang,Diulas: 18 Apr 2021,"Kesepakatan itu layak. Sarapan agak mengecewakan karena makanannya tidak terasa seperti baru disiapkan, tapi masih bagus untuk diantarkan ke kamar secara gratis. Kamar dan fasilitasnya sangat bagus, kami terutama menyukai bersantai di tepi kolam renang!"
