Boon Leng,Reviewed: 17 May 2021,5.05.0Superb,,"I love the amazing artworks all over the hotel and overall service was also excellent. We arrived early and was pleasantly surprised with an early check in. I requested for an hour extension for check out and it was also extended to me. Very grateful. The hotel is clean and lovely, the location is amazing and exclusive. I don’t like the hand sculpture in my room, it’s too scary and I don’t dare to go to the toilet in the middle of the night because of it. I didn’t like the pillows because they were too soft and I only found out about the pillow menu on check out day. We used our dining voucher that came with the package for lunch at the kitchen table. The crab pizza can do with more crab meat, we can hardly find any. The wagyu burger was disappointing...not much seasoning and the patty was dry. However, breakfast was nice, especially the laksa! Overall, I love my stay, hopefully to do another staycay with my family again.",Translate Review To English
Mingjun Marcus,Reviewed: 17 May 2021,5.05.0Superb,,Beautiful room and amazing service from all staff at W hotel! W hotel is also located at Sentosa Cove area with restaurants and cafes nearby. The marina right in front of the hotel makes you feel as if you’re overseas!,
Koi Man,Reviewed: 17 May 2021,5.05.0Superb,,an amazing room with a modern vibe far away from the city. makes it feel like we are out of the country.,Translate Review To English
stephanie,Reviewed: 16 May 2021,5.05.0Superb,,pool is good and staff provided good service. relaxing.,Translate Review To English
Manoj,Reviewed: 14 May 2021,3.05.0Good,,"The pool is amazing and really great for the kids because in addition to the main pool there is a decent size paddling pool which is really shallow so provides a lot of safety for the younger ones. My main issue was with the room. It does not compare to the one in Hong Kong and it looks dated and quite tacky. However, the room was a decent size and it also had a nice view. Service in the restaurant and bar could be improved. Food running out during the breakfast service and some mixers such as tomato juice not being available. Overall not a bad place but it’s not cheap so would expect much better for this price.",Translate Review To English
Joanna,Reviewed: 13 May 2021,5.05.0Superb,,Will definitely be back again! One of my fav hotels in SG!,
Samuel,Reviewed: 13 May 2021,3.05.0Good,,"W hotel was wonderful. The post-booking support from Klook was disappointing. I wished Klook had put in effort to help me with an unforeseen problem that I encountered post-booking. They merely quoted the merchant’s terms and conditions. Did not even link me up with the hotel. To other customers who may require flexibility with the worsening covid19 situation, please note that this package is non transferrable or cancellable. Consider booking or liaising directly with the hotel instead of a third party like Klook.",
Jia Yeow,Reviewed: 13 May 2021,4.05.0Great,,"Very clean hotel. But do note Wonderful room is the one that face the road, not even the pool view.I thought of getting sea view. I managed to top up for a better room as I want a balcony. They give bottle water every where. Love the sound system in the room. TV choices can be improved. Breakfast is okie but the paid buffet dinner can be improved. crab not fresh and small. Wanton noodle can skip. their cakes are nice thou.",Translate Review To English
Marie Ann Isabelle,Reviewed: 12 May 2021,5.05.0Superb,,"Thank you for the birthday and anniversary surprises, W Hotel! We really enjoyed our 2 nights staycation. Excellent service and hotel ambiance! We love this hotel and would definitely come back!",Translate Review To English
Marie Ann Isabelle,Reviewed: 12 May 2021,5.05.0Superb,,"What a beautiful resort!!! Perfect staycation to celebrate our birthdays, Mother’s Day and wedding anniversary. Luxury hotel means luxury service and ambiance. The whole family enjoyed our stay!!! Would definitely come back.",Translate Review To English
Yijun,Reviewed: 12 May 2021,5.05.0Superb,,"A good experience in W, with good service and quality room. But the color of the room, personally, cannot accept.",Translate Review To English
Jianing,Reviewed: 11 May 2021,5.05.0Superb,,"this time we opt for marvelous experience and is indeed marvelous ! Early check in at 12, late check out at 3, comes with breakfast for 2... and I have jacuzzi tub in the room! And .... I found a new liking- the egg chair !!! The bedsheet is so comfortable on the super comfy bed.. the bathroom is so well equipped with 3 types of bathing method.. I love their davines shower collection that smells so nice .. and couple with JDV mirror and hairdryer... totally like! Always love the quietness of the surroundings at W and the way how their rooms are so creatively lit up. All their stuff has interesting names too!",
TeckKuan,Reviewed: 11 May 2021,5.05.0Superb,,"W Singapore has been the hotel of our choice over the longest time ever since the first time my wife stayed there in 2015 at their Marvellous Suite. Food quality has been the factor that most hotels would overlook but not for our stay at W Singapore. The food is consistently of the highest and freshest quality, whether it's their buffet breakfast, ala-carte lunch or dinner options. The experience is constantly a WOW for my family and I. Thank you W Singapore for the experience every single time we visit and we definitely will head back again.",
Mervin,Reviewed: 10 May 2021,1.05.0Below Average,,"Stay was average, the fact that it didn’t feel like a 5 star experience despite the inflated price. The downfall was the customer service, I paid extra $180+ for upgrade to accommodate the third person in the room, but was not given late check out. There were several times housekeeping staff entered the room when we did not answer to their knocking and ringing. The receptionist girl was so unfriendly and unapproachable.",Translate Review To English
ZhiWei,Reviewed: 10 May 2021,5.05.0Superb,,"Friendly staff service, clean room, fast service and respond. Comfortable stay.",Translate Review To English
Lucas,Reviewed: 10 May 2021,5.05.0Superb,,Very nice staff! Had an amazing stay at W Hotel. The room was clean and really cosy.,
GOH,Reviewed: 10 May 2021,5.05.0Superb,,"clean n big room....no gym , reserve to go pool n resturant. staff are helpful. overall experience v good. will visit again if room has good discounts.",Translate Review To English
Wai Man,Reviewed: 10 May 2021,4.05.0Great,,"We are so glad to have this weekend getaway to explore the east side of Sentosa. The hotel is so nice to help us celebrate our wedding anniversary with nice decorations and complimentary cake. The pool is the highlight to my stay. Though we were given late checkout, the 2D1N passed so fast before us. We had the package with 3-course dinner and all-you-can-eat breakfast but nothing is especially impressive.",
Janelle,Reviewed: 10 May 2021,5.05.0Superb,,"Easy to book and make amendments to my booking of the use of swimming pool, gym, spa, breakfast and etc. Not much crowd so it was a quiet and pleasant stay. Good service as well:)",
Sheng Hui,Reviewed: 10 May 2021,5.05.0Superb,,Good amenities and service. Ambience is nice too. Food is great as well.,Translate Review To English
Liyun,Reviewed: 9 May 2021,1.05.0Below Average,,"Well I bought a voucher package (2D1N stay with afternoon tea and breakfast) on 9 May 2021. I would expect that I will be able to enjoy the afternoon tea on 9 May itself. But NOPE. It was fully booked and it wasnt indicated on the voucher that I have to make a reservation. Do the hotel really expect people to stay on 9 May and enjoy the afternoon tea on other days? What a disaster to celebrate Mother Day for my mother. I suggested to exchange the afternoon tea for dining credit but the staff has to check. (20minutes has passed while writing this review but still no update. Yes I have high expectaction) To be fair, the staff did offer to let me checkout later on 10 May to enjoy the afternoon tea but I have other schedules planned and it cannot be rescheduled. Hope this review can remind people to book their whatever tea or spa that is in the package in advance to avoid disappointment. Giving a 1 star because I am extremely unhappy and the fact that I paid extra money for the afternoon tea but did not get enjoy it. I will just treat it as ????.",Translate Review To English
sean,Reviewed: 9 May 2021,5.05.0Superb,,"???????????????with elite member upgrade,we manage to get a away room in the away spa . Breakfast and dinner already included ?I use the 75 dollar food credit for dinner with 20 % elite member discount, very worth it . Sea bass and w signature chill crab pizza is very good ??",Translate Review To English
Sharon,Reviewed: 8 May 2021,5.05.0Superb,,I was celebrating a birthday during this staycation and W did up a simple balloon decor and a tiny chocolate cake which was delicious! Thanks to the team at W! We had an amazing stay. Highly recommend this place to families with kids.,
Zhuo,Reviewed: 8 May 2021,3.05.0Good,,"We had $75 credit at Kitchen Table, the chef was very generous to give us a big pizza although we only ordered a kids pizza. However, was quite disappointed with the food there. They have a very big swimming pool and we enjoyed very much for the 2hrs booking slot.",
D,Reviewed: 8 May 2021,4.05.0Great,,"great service and clean hotel. experience is great, except there is somethng to watch out about the use of food voucher, we r not aware or not inforned it cannot be used for room service, hence end up paid more...",Translate Review To English
Geok Neo Stephanie,Reviewed: 8 May 2021,5.05.0Superb,,"Fantastic staycation. We got an upgrade to a bigger room with living area and long balcony. Pool was amazing, even though there were quite a lot of people. The food at The Kitchen Table was only average, so avoid it for dinner and go to Skirt or the many restaurants just outside the hotel.",
francis,Reviewed: 6 May 2021,5.05.0Superb,,Good nice view... Good service staff Nice swimming pool and gym. spa facilities was also very gd,Translate Review To English
CHER GIM,Reviewed: 6 May 2021,4.05.0Great,,"Staff didn't seem as friendly as pre-covid days, or it could be that we booked using a voucher instead of directly from W website. A lot of new and inexperienced staff in the pool area and check-in, but there were also older staff who were quite to do service recovery. Pleasant stay. Quite crowded. One has to book breakfast and pool visits the day before.",Translate Review To English
Ruth,Reviewed: 5 May 2021,2.05.0Below Average,,"I checked out of W hotel this morning and I have deducted 3 stars from my review because of 3 incidents. At check in I was told that I would have to pay more because I requested twin bed. I was shocked as extra fee was not mentioned when I booked the hotel room without breakfast. I was flustered and opened klook app to look for details of my booking. I didn't want to share a king size bed with my sister. The staff quickly went into a room and promptly came out to announce that her supervisor had waived the fee. I feel that W Hotel is not honest in its advertisment - ""twin bed upon request"" means customer can asks for a twin bed instead of king size bed, extra fee should have been specified. In current time of Covid where many people are suffering from mental stress, a staycation should be a pleasant experience. In the evening, I discovered a patch of stain that could be dried blood on my duvet and I quickly rang housekeeping to change it. The next morning at breakfast, I ordered al la cart instead of buffet because I wanted a light breakfast. I picked W Hotel signature french toast and I was taken aback when I saw what's on the nice red plate. It was just One slice of thick toast sprinkled with some cream, tiny blueberries and small slices of strawberries. Perhaps I was served an al la cart buffet portion for $22 before GST. It was not air flown from Paris but made in-house. The 2 stars I gave are for the nice hotel ambience and pool experience as well as for the service by the male staff on the ground floor manning the Trace Together and temperature checks and the concierge.",Translate Review To English
Bee Tee,Reviewed: 4 May 2021,5.05.0Superb,,"booked second night without breakfast included. as the breakfast offers a good spread of choices, it is recommended to book with breakfast included. The spa facilities is nice.",Translate Review To English
Bee Tee,Reviewed: 4 May 2021,5.05.0Superb,,"Good size hotel room. Spacious bath area. Very clean. Good gesture to decorate room with balloons and provide Birthday cake. Breakfast has good spread of choices. the beds is overused, It is sunken in the centre and not comfortable to sleep on.",Translate Review To English
Jann Jan Li,Reviewed: 3 May 2021,5.05.0Superb,,Great service and pool. Kids love the pool and slide. Nice that they hv double beds for family of 4. Beds are a tad too soft.,
Min Qi,Reviewed: 3 May 2021,5.05.0Superb,,Amazing experience. Fantastic room and we even got a birthday cake. Thank you team W,Translate Review To English
Jia Cheng Damian,Reviewed: 1 May 2021,5.05.0Superb,,"Visited on Labour Day weekend. Smooth check-in process. Lots of families but I suppose it is due to the weekend. For some reason, Skirt is fully booked for the Sat evening I checked in. You will need to reserve a spot to use the pool between 9am and 7pm. Each slot is 2 hours. Outside of these hours, you can use the pool any time. If you are visiting the beach, you can also get a pass which gives you free entry to the beaches along Sentosa.",Translate Review To English
Elma,Reviewed: 1 May 2021,5.05.0Superb,,Excellent service provided by all the staff.Thanks for the great experience W Hotel.??????,
Yee Ming,Reviewed: 30 Apr 2021,1.05.0Below Average,,"Extremely unpleasant experience upon check that completely destroyed our holiday mood. Booked on klook which gave the option of choosing a king sized bed or 2 beds (and we even called beforehand to ensure we would get 2 beds and they agreed). However, upon check-in the staff (an Indian man who claimed to be a manager) refused to give us 2 double beds and even insisted we pay 60 dollars extra even though there was only 2 people staying in the room. This was extremely unreasonable and unprofessional since 60 dollars was an extra person charge. Very disappointed with the poor service of a supposedly 6 star hotel. They also agreed on 3pm late checkout in the call but during check-in he said 1pm was the latest checkout?!!",Translate Review To English
Ang,Reviewed: 30 Apr 2021,5.05.0Superb,,"The hotel is worth the ratings, their lobby is so cozy and even the rooms, the bed is so comfortable. Really glad that I have chose this hotel for my staycation. Will definitely come back again !!",Translate Review To English
Lim,Reviewed: 29 Apr 2021,5.05.0Superb,,"A great getaway from work. Wonderful facilities such as gym, swimming pool, sauna, jacuzzi, steam room etc. Breakfast was great too, lots of selection.",Translate Review To English
QIANYI ERIN,Reviewed: 29 Apr 2021,5.05.0Superb,,Nice hotel. The room is spacious with a nice view. Breakfast selection (ala-carte buffet due to covid restriction) is good with a wide variety to choose from.,Translate Review To English
Melanie,Reviewed: 28 Apr 2021,4.05.0Great,,Thoroughly enjoyed my stay at W Hotel Sentosa - location was very peaceful; staff were very efficient and quick to address any concerns and inform on new social distancing procedures (booking of slots for swimming pool access and breakfast buffet); room was very spacious for 2 persons and generally clean although we did find a cutip under the bed; food at The Kitchen Table was part of the package and was really amazing as well.,Translate Review To English
Juan Fiu Louis,Reviewed: 28 Apr 2021,4.05.0Great,,"Good and enjoyable experience, with nice breakfast. Variety for dinner selection and quality of meals can be improved.",
Joanne Joo Yong,Reviewed: 28 Apr 2021,5.05.0Superb,,"We arrived at W Singapore and did a pre-check-in at 9.30am. We had a great time exploring Sentosa on our bicycles while waiting for our room to be ready. A bummer was we did not receive the mobile notification informing that our room was ready for check-in earlier. We had booked a one night stay to celebrate our wedding anniversary and were pleasantly surprised to see the 'LOVE' balloons welcoming us when we checked in. Our Wonderful Room was clean and comfortable with the added luxury of a nice relaxing bath-tub. We included the 3 course dinner and 'All You Can Eat' awesome breakfast in our room package. The crew at The Kitchen Table was attentive and polite. We had to top up between $5 to $20 per dish from our dinner set menu. We enjoyed the quality good food but the W Burger patty was quite dry, Satay, Crispy Squid and Wagyu Hor Fun was tasty. We very much appreciated a 2 hour late check-out and went home happy & rejuvenated from our short stay cay at W Sentosa with their Express Check-out service! Thank you W Singapore !",Translate Review To English
,Reviewed: 28 Apr 2021,5.05.0Superb,,"Great service. Wonderful pool. The food in the hotel is delicious. Had the chilli crab. The crab wasn't cracked so had to ask for it to be cracked. It was finger licking good. Lovely room. Spacious and clean. Breakfast was nice. Hanafi served us. He recommended the smoothie which was good. Hanafi was friendly, helpful and prompt in his serving. Great experience. Will definitely come back again.",Translate Review To English
Rin,Reviewed: 27 Apr 2021,5.05.0Superb,,Love the hospitality! Pros: Facilities are well accessible. Cons: Quality of breakfast at The Kitchen Table could be better,Translate Review To English
LAU,Reviewed: 27 Apr 2021,5.05.0Superb,,"Booking through Klook and using the SDV is a breeze. Was able to check in at 1pm. Check in was very fast and we were issued our room key within 10min. The room was very clean and cosy. Only mineral water is free (many bottles provided). All other things are chargeable. The surrounding area is very beautiful, with the boats at the Marina, many hip restaurants, clean water in the cove teeming with fishes and jelly fish. We even saw a big wild turtle in the cove. The restaurant at Quayside Isle are all reasonably priced. Hosted some friends there. The only setback is the hot weather and lack of sea breeze even late into the evening.",
Siew Ling Edlyn,Reviewed: 27 Apr 2021,5.05.0Superb,,"We had a great stay! The pool was by far the best we’ve ever experienced. So big, the water temperature was great. I liked the ala carte buffet breakfast because the selection was more exciting than a standard continental breakfast, which included local delights and “millennial food” like avo smash and granola yoghurt nut muesli mixes. I loved the gym; fully stocked with the best brand. Had a challenging workout when I set the machines to exercise programmes. If I had to pick out something I didn’t like, I’ll have to say that upkeep was not 10/10. Maybe 8-9/10. It didn’t have a sparkling clean feel, and the carpets did feel like they needed a bit of a refresher. But really no harm done because I’m just nitpicking. The other thing, which is much harder to change, is the decor of the place. Wasn’t my thing; the flowery decor and flowers in jars. It was an aesthetic I couldn’t really appreciate. The flowers at the edges of the mirrors in the bathroom creeped me out because they looked like flaking parts of the mirror or like unclean residue. Maybe it’s just me. But all in all, fantastic stay! Other than nitpicking, nothing to complain about.",
Tiong Beng,Reviewed: 26 Apr 2021,5.05.0Superb,,We had a good and relaxing time at W Sentosa. We had the wonderful twin room and it was nice and spacious. I had been to other W hotel outside Singapore and the W Sentosa did not disappointed. It maintain same high standard in quality and luxury ambience. Highly recommended for a staycation there.,
Fritzie,Reviewed: 26 Apr 2021,5.05.0Superb,,"Amazing experience and great value for money! Loved the decor of the room, and the service was top notch. Pool was amazing and not too crowded. Breakfast was decent - dim sum could have been improved. Overall great stay and out-of-SG feels!",Translate Review To English
Wai Fong,Reviewed: 25 Apr 2021,4.05.0Great,,Stay and ambience is one of the best I had. Only downfall was the showers did not have hot water and the air con control was faulty for my room.,Translate Review To English
Natasha,Reviewed: 23 Apr 2021,5.05.0Superb,,"My husband and I thoroughly enjoyed our stay here! From the spacious room (the bathtub has a view of the TV), to the pool (complete with fun slide), to the jacuzzi/sauna/steam room area (what a pleasant surprise!) to the amazing breakfast. Service was great throughout. Highly recommended and will definitely return if given the chance to!",Translate Review To English
Ong,Reviewed: 23 Apr 2021,4.05.0Great,,"Room is big and spacious, bathtub is fabulous, all accessories are good quality, fridge is also cold unlike most other hotels where fridge is only at chilling temperature.",
Karen,Reviewed: 20 Apr 2021,5.05.0Superb,,environment is clean and quiet. service is excellent food is great,Translate Review To English
Jason,Reviewed: 20 Apr 2021,5.05.0Superb,,"We enjoyed our stay at W Singapore so much!!! The hospitality was good as the front desk has responded to my email timely and arranged for my special request which is so lovely to me. Room was very comfy, facilities all good, hair dryer is better than my home one ^^ Swimming pool is exactly as best as described, great time for family bonding & photogenic one! No doubt a five star well deserve for W Singapore! Claps!",
Shi Ting Samantha,Reviewed: 20 Apr 2021,5.05.0Superb,,Love this hotel so much! Service was great and the staff provided us a complimentary cake and some decorations in the room for our anniversary celebration. Dined at the Kitchen Bar and it was great. Will definitely be back again!,Translate Review To English
Wita Claudia,Reviewed: 20 Apr 2021,4.05.0Great,,Great amenities and services by the W team to make sure my special occasion turn out well. Highly recommended for people looking to find a staycation in a fun and well decorated hotel room. The dessert was great but the mains in the 3-course set dinner was so-so.,Translate Review To English
Norman,Reviewed: 20 Apr 2021,5.05.0Superb,,Very good deal on Klook in an impressive hotel. Will be back,Translate Review To English
Irene,Reviewed: 20 Apr 2021,5.05.0Superb,,"wonderful experience. nice pool, beautiful room and services was excellent. food is good as well. love it and will visit again",Translate Review To English
Zhen xuan,Reviewed: 19 Apr 2021,5.05.0Superb,,"What I wonderful hotel, will visit one more time. Big family swimmming pools",
Jeevagajendran,Reviewed: 19 Apr 2021,5.05.0Superb,,"Extremely friendly and helpful staff and beautiful location.views were great, Room was very clean and bed was very comfortable. Delightful stay",Translate Review To English
Wong,Reviewed: 19 Apr 2021,2.05.0Below Average,,"Had a pretty good impression of W Singapore via a friend’s experience but apparently it differs from actual experience. I booked a room with twin bed but during check in, the staff insisted that he can only provide us a king bed. I explained to him that when I booked it was because of the twin bed selection. He argued that I have to pay an extra $60 for the twin bed. Only after I showed the Klook voucher that show the selection for twin he decided to provide us the room that we actually booked. Wasn’t exactly friendly, looks like he was pretty annoyed. Facilities and room is ok, the toilet floor will be all wet after bath despite closing the shower door.",
Shi Ying,Reviewed: 18 Apr 2021,4.05.0Great,,Had a pleasant stay at W hotel to celebrate my fiancé’s birthday. Hotel room was pretty and clean with a very comfortable bed and bathtub! Would have preferred for the room to be more well-lit (room still feels dark when the curtains are drawn). Service provided by hotel staff was excellent although they missed out in bringing us the birthday cake which I have requested before the trip.,Translate Review To English
Wen Qi,Reviewed: 18 Apr 2021,5.05.0Superb,,"The room was clean and spacious. It was my sister’s birthday, and we were pleased with the surprise cake and balloons prepared by W hotel. Breakfast was such a spread, we love the mee siam and avocado toast!! Will definitely be back :)",Translate Review To English
BAIFENG,Reviewed: 18 Apr 2021,5.05.0Superb,,"Great experience. Good room service and nice ambience Excellent property and very convenient to Sentosa. Front desk staff is extremely efficient, pleasant and helpful. Property is clean and has a fantastic old time charm.",Translate Review To English
Ernawaty,Reviewed: 18 Apr 2021,5.05.0Superb,,"Very good stay at W Sentosa Cove. The staff at Breakfast at The Kitchen Table was very friendly and polite. Service is good. Check in/out also fast and easy. Gym, spa, pool are nice, clean and not crowded. Pity that it was raining when I was there. Overall is very good.",Translate Review To English
Rebecca,Reviewed: 17 Apr 2021,5.05.0Superb,,"Service was excellent except for this lady we encountered when we went for our free breakfast at The Kitchen Table. She asked my husband for our room number but he wasn’t paying notice and didn’t answer her. She looked up at him and frowned and was very curt throughout. Otherwise, I would definitely come back. It was an amazing experience.",
