web-scraper-order,web-scraper-start-url,user,date,review
,klook.com/id/hotels/detail/235639-sofitel-singapore-sentosa-resort--spa-sg-clean,Venessa,Diulas: 24 Mar 2021,"Layanan hebat diterima dari semua staf layanan di hotel. Ibuku dan aku menikmati diri kita sendiri dengan Sofitel Sentosa. Tuan Jason dari The Cliff sangat memperhatikan kebutuhan makan kami (Makan Siang &amp; Makan Malam) Dia pantas dipuji! Paket yang saya pilih bernilai setiap sen, mungkin kesepakatan terbaik yang pernah ada! Ini jelas merupakan tempat bagi kita yang ingin melarikan diri untuk staycation yang tenang! Kamarnya baik-baik saja dan mungkin perlu perbaikan segera karena beberapa area terlihat mulai usang. (pintu berkarat, ornamen kabinet hilang atau rusak dll) Well, overall masih good stay. Sarapan juga nikmat!! Mudah-mudahan, mereka memperpanjang jam operasi renang mereka hingga jam 9 malam karena mereka memiliki kolam yang bagus!"
,klook.com/id/hotels/detail/235639-sofitel-singapore-sentosa-resort--spa-sg-clean,Hui Zhen,Diulas: 24 Mar 2021,Layak - sepeda gunung di hotel sangat bagus untuk jalur imbiah
,klook.com/id/hotels/detail/235639-sofitel-singapore-sentosa-resort--spa-sg-clean,Ru En Luanne,Diulas: 24 Mar 2021,"Dibeli sebagai hadiah, penerima berkomentar bahwa sepertinya ada kekurangan staf pada waktu makan. Kalau tidak, pengalaman itu bagus?"
,klook.com/id/hotels/detail/235639-sofitel-singapore-sentosa-resort--spa-sg-clean,Foo,Diulas: 23 Mar 2021,"Menikmati! Cukup dingin untuk pengalaman pertama kali! Suka makanan yang disediakan juga! Kamarnya cukup bagus dan dingin, akan senang untuk kembali suatu hari nanti!"
,klook.com/id/hotels/detail/235639-sofitel-singapore-sentosa-resort--spa-sg-clean,POH PING,Diulas: 23 Mar 2021,"Kamar saya dialokasikan bukan dari blok yang baru direnovasi tetapi bersih. Paket ini termasuk 3 kali makan jadi saya pikir itu sepadan dengan harganya. Namun, saya mendapat banyak gigitan nyamuk saat makan dan duduk di luar restoran. Ada penjemputan gratis dari Harbourfront MRT, perlu menelepon atau mencari pintu keluar untuk titik penjemputan. Check out kamar membutuhkan waktu lebih lama di lobi."
,klook.com/id/hotels/detail/235639-sofitel-singapore-sentosa-resort--spa-sg-clean,Ru En Luanne,Diulas: 22 Mar 2021,Dibeli sebagai hadiah dan penerima sangat senang dengan layanannya. Dia juga menyebutkan itu adalah staycation yang sangat damai.
,klook.com/id/hotels/detail/235639-sofitel-singapore-sentosa-resort--spa-sg-clean,Victoria Huey Yi,Diulas: 22 Mar 2021,hotel yang sangat bagus. Tebing menawarkan santapan Italia yang sangat bagus. Tapi air kolamnya kurang bersih
,klook.com/id/hotels/detail/235639-sofitel-singapore-sentosa-resort--spa-sg-clean,Yi Wen Wendy,Diulas: 22 Mar 2021,Pengalaman luar biasa dengan suami saya di retret ini. Pijat spa juga bagus
,klook.com/id/hotels/detail/235639-sofitel-singapore-sentosa-resort--spa-sg-clean,Joyee,Diulas: 22 Mar 2021,"Paket nilai-untuk-uang yang lengkap! Termasuk sarapan, makan siang, dan makan malam - semua makanannya lezat, terutama makan malam di The Cliff. Kamar yang nyaman, bersih dan sangat layak. Hotel itu sendiri bisa lebih baik dipertahankan tetapi tidak ada yang mempengaruhi perjalanan. Kolam renangnya ternyata sangat dalam, menurutku!"
,klook.com/id/hotels/detail/235639-sofitel-singapore-sentosa-resort--spa-sg-clean,Nelson,Diulas: 22 Mar 2021,Membeli paket makan siang. Pengalaman yang menyenangkan dan santai! Merasa terisolasi dari kota! Tempat tidurnya sangat nyaman dan membuat saya merasa seperti sedang tidur di atas awan!
,klook.com/id/hotels/detail/235639-sofitel-singapore-sentosa-resort--spa-sg-clean,Melissa,Diulas: 21 Mar 2021,"Secara keseluruhan nilai hotel yang oke untuk uang. Layanan perlu ditingkatkan, staf tidak terlatih dengan baik. Kamar hotel bersih tapi area di luar kamar bisa sangat kotor. Sarapan memiliki beberapa pilihan dengan makan di tempat terbuka. Lupakan fasilitas spa karena tidak begitu bersih."
,klook.com/id/hotels/detail/235639-sofitel-singapore-sentosa-resort--spa-sg-clean,JUN YANG,Diulas: 20 Mar 2021,proses check in lambat dan lama .. di kamar makan dan sarapan sangat baik . kurangnya tenaga untuk mendukung layanan satu sentuhan ...
,klook.com/id/hotels/detail/235639-sofitel-singapore-sentosa-resort--spa-sg-clean,Tze Ching Violet,Diulas: 19 Mar 2021,"Hotel yang bagus dengan fasilitas yang bagus, semuanya bagus kecuali check-in yang sangat lama. Akan senang untuk mengunjungi lagi"
,klook.com/id/hotels/detail/235639-sofitel-singapore-sentosa-resort--spa-sg-clean,Chee Ho,Diulas: 18 Mar 2021,Perjalanan yang indah dan anak-anak sangat menikmati. Makanan di restoran Clif sangat enak. Sarapan juga bagus.
,klook.com/id/hotels/detail/235639-sofitel-singapore-sentosa-resort--spa-sg-clean,MEI LING,Diulas: 17 Mar 2021,tinggal sangat bagus! staf penuh perhatian dan cepat. kami akan segera kembali. Menyarankan
,klook.com/id/hotels/detail/235639-sofitel-singapore-sentosa-resort--spa-sg-clean,yit lee,Diulas: 17 Mar 2021,Secara keseluruhan bagus! makanannya enak dan kolam renangnya bagus. Saya merasa seperti tinggal di resor di Thailand.
,klook.com/id/hotels/detail/235639-sofitel-singapore-sentosa-resort--spa-sg-clean,Nursyazwani,Diulas: 16 Mar 2021,"Terasa seperti Anda tidak di Singapura, merasa seperti Anda berada di Bali Nusa Dua, lingkungan yang sangat santai. Perabotan kamar terlihat agak tua. Bau handuk dan sprei tidak segar, baunya lama sekali di lemari. Bantal &amp; tempat tidur empuk. Makanan di Kwee Zeen bisa lebih baik, memesan naan ayam mentega dan udang telur asin tetapi rasanya mengerikan. Memesan laksa mereka juga, sangat encer. Jika tidak, layanan dari meja depan sangat baik, pujian untuk Staf bernama Natasha, sangat profesional."
,klook.com/id/hotels/detail/235639-sofitel-singapore-sentosa-resort--spa-sg-clean,Eugene,Diulas: 16 Mar 2021,Ada cukup banyak pilihan untuk sarapan yang termasuk dalam paket kami. Kami lebih memilih set bubur/dim sum atau laksa daripada set sarapan ala Amerika. Suka kolam renang yang sangat luas dan santai. Secara keseluruhan hotel adalah pilihan yang luar biasa untuk menjauh dari kota. Akan merekomendasikan tinggal di hari kerja daripada akhir pekan untuk menghindari keramaian?
,klook.com/id/hotels/detail/235639-sofitel-singapore-sentosa-resort--spa-sg-clean,Susanna,Diulas: 16 Mar 2021,"Hotel yang sangat bagus yang memberikan perasaan resor-y. Banyak sudut di hotel adalah tempat yang bagus untuk mengambil foto. Layanan juga luar biasa. Cocok untuk pasangan, tetapi kami bersama anak kami yang berusia 4 tahun dan dia menikmati setiap momen menginap di Sofitel Sentosa. Terima kasih :)"
,klook.com/id/hotels/detail/235639-sofitel-singapore-sentosa-resort--spa-sg-clean,Geok Kwang,Diulas: 16 Mar 2021,"Pertama kali menginap di Sofitel Sentosa. Antrian check-in lambat karena hanya ada 2 staf meja depan. Meskipun lambat, tetapi stafnya ramah. Kami memiliki 2 kamar di Tranquility Wing yang bersih tetapi kolam di lantai dasar kotor &amp; sepertinya tidak ada perawatan. Paket kami terdiri dari sarapan di Kwee Zeen, makan siang &amp; makan malam di The Cliff (restoran Italia). Sayangnya, The Cliff memiliki menu makanan yang terbatas. Mintalah duduk di luar jika Anda makan malam karena pemandangan matahari terbenamnya indah. Perjalanan alam melalui jalur hutan (di samping kolam renang utama) membawa Anda ke Pantai Tanjong. Sangat nyaman untuk naik transportasi gratis dari hotel ke bagian lain Sentosa. Secara keseluruhan tinggal itu menyenangkan."
,klook.com/id/hotels/detail/235639-sofitel-singapore-sentosa-resort--spa-sg-clean,Siqi,Diulas: 16 Mar 2021,layanan hebat dan keramahan yang kami miliki. itu adalah tempat resor n sangat santai untuk memiliki liburan yang baik! sangat dianjurkan !
,klook.com/id/hotels/detail/235639-sofitel-singapore-sentosa-resort--spa-sg-clean,Cheryl,Diulas: 15 Mar 2021,Kamar besar dan nyaman. Layanan sangat sempurna. Tempat yang tenang dan santai untuk menghilangkan stres.
,klook.com/id/hotels/detail/235639-sofitel-singapore-sentosa-resort--spa-sg-clean,Yuin Foon,Diulas: 15 Mar 2021,"Sebuah staycation yang benar-benar terasa seperti jauh dari rumah dengan tanaman hijau dan laut di sekelilingnya. Restoran Cliff menawarkan pemandangan matahari terbenam dan menyajikan masakan Italia yang lezat. Kolam besar yang bagus untuk bersantai dan menonton burung merak berkeliaran dengan bebas. Pantai Tanjong berlokasi strategis (130+ langkah menuruni bukit). Secara keseluruhan, sangat menyenangkan."
,klook.com/id/hotels/detail/235639-sofitel-singapore-sentosa-resort--spa-sg-clean,Weiyu,Diulas: 15 Mar 2021,"Secara keseluruhan pengalaman menginap yang baik. Sarapan yang layak. Kamar dan hotelnya bagus, bagus dan luas. Layanan juga sebagian besar cepat. Satu-satunya hal adalah bahwa pemesanan kolam itu sulit dan kolam itu sebenarnya cukup kotor. Merak dan merak banyak sekali! Itu membuatnya menyenangkan bagi anak-anak."
,klook.com/id/hotels/detail/235639-sofitel-singapore-sentosa-resort--spa-sg-clean,KENG SIEN,Diulas: 14 Mar 2021,Pengalaman keseluruhan bagus. Tempat yang bagus untuk bersantai di tepi kolam renang dan bersantai.
,klook.com/id/hotels/detail/235639-sofitel-singapore-sentosa-resort--spa-sg-clean,kasturi,Diulas: 14 Mar 2021,layanan yang sangat sangat buruk. kamarnya indah tapi layanan kamar counter n sangat sangat buruk
,klook.com/id/hotels/detail/235639-sofitel-singapore-sentosa-resort--spa-sg-clean,Yu Ling Edwina,Diulas: 13 Mar 2021,"Fasilitas bagus, kamar bersih, desain cantik!!! Makanan ala carte di Kwee Zeen di bawah rata-rata. Tapi sarapannya enak!"
,klook.com/id/hotels/detail/235639-sofitel-singapore-sentosa-resort--spa-sg-clean,Li San Sharon,Diulas: 13 Mar 2021,"Sofitel Sentosa adalah hotel yang indah untuk menginap minimal 2 malam! Pekarangan hotel & sekitarnya mirip dengan resor di Thailand & Bali ... membuat Anda merasa begitu damai dan menyatu dengan alam. Sarapannya enak terutama Laksa khas mereka, Dim sum & set sarapan sehat. Terima kasih kepada Clive yang merekomendasikan kombinasi yang indah. Kami sangat menikmati kunjungan kami!"
,klook.com/id/hotels/detail/235639-sofitel-singapore-sentosa-resort--spa-sg-clean,Hea Young,Diulas: 13 Mar 2021,Itu baik-baik saja. Saya tidak akan merekomendasikan hal ini kepada orang lain meskipun.
,klook.com/id/hotels/detail/235639-sofitel-singapore-sentosa-resort--spa-sg-clean,Michelle,Diulas: 13 Mar 2021,Kamar lebih besar dari hotel biasa dan makanannya enak! Itu pasti terasa jauh dari Singapura
,klook.com/id/hotels/detail/235639-sofitel-singapore-sentosa-resort--spa-sg-clean,Hock Leng,Diulas: 12 Mar 2021,Tempat tidur yang nyaman dan kamar yang luas. Kami menikmati makan siang dan makan malam yang lezat dan lezat di The Cliff. Sangat puas dengan makanan di sana. Terima kasih kepada para Koki.
,klook.com/id/hotels/detail/235639-sofitel-singapore-sentosa-resort--spa-sg-clean,Beng Loo,Diulas: 12 Mar 2021,Kamar sedikit tanggal. tapi masih bagus di 1 untuk 1. menikmati sarapan. sebagian besar kolam terlalu dalam .. area terbatas untuk kesenangan keluarga.
,klook.com/id/hotels/detail/235639-sofitel-singapore-sentosa-resort--spa-sg-clean,jared,Diulas: 11 Mar 2021,Suka menginap di Sofitel. Itu benar-benar memberikan perasaan di luar negeri dan staf semuanya ramah dan membantu. Akan mempertimbangkan untuk kembali lagi?
,klook.com/id/hotels/detail/235639-sofitel-singapore-sentosa-resort--spa-sg-clean,Mee Fong,Diulas: 11 Mar 2021,Mencintai ketenangan di sekitar. Kamarnya luas dan bersih. Pergi untuk makan malam di The Cliff - makanan dan layanan yang baik. Berharap untuk kembali lagi.
,klook.com/id/hotels/detail/235639-sofitel-singapore-sentosa-resort--spa-sg-clean,Fiona Ya Qing,Diulas: 11 Mar 2021,"Banyak kami membeli promo 1-1 jadi kami memiliki 2 malam menginap! Suasananya luar biasa, tidak terasa seperti kami berada di Singapura. Tapi layanan jujur bisa menjadi jauh lebih baik. Tidak membalas email saya, harus menelepon mereka dua kali untuk datang dan memeriksa tv kamar saya, lemari es hampir tidak dingin. Mencoba sarapan ala Amerika dan Canto, keduanya tidak enak. Check-out terlambat juga tidak diperbolehkan."
,klook.com/id/hotels/detail/235639-sofitel-singapore-sentosa-resort--spa-sg-clean,Amelia Shu Qin,Diulas: 11 Mar 2021,"Makanannya enak, dan resor ini memberikan suasana yang sangat santai. Kolam renangnya cukup panjang tetapi airnya terasa lucu dan tidak tampak bersih (barang-barang mengambang di sekitar) sehingga sulit untuk berenang di dalamnya. Lift sedikit bergemuruh. Tapi secara keseluruhan pengalaman menginap yang menyenangkan dan santai, bagus untuk liburan tanpa gangguan bersama orang yang Anda cintai."
,klook.com/id/hotels/detail/235639-sofitel-singapore-sentosa-resort--spa-sg-clean,Meiqing,Diulas: 11 Mar 2021,"itu adalah pengalaman menginap yang luar biasa , makanan enak , liburan singkat yang menyenangkan !"
,klook.com/id/hotels/detail/235639-sofitel-singapore-sentosa-resort--spa-sg-clean,Pei Jin May,Diulas: 11 Mar 2021,"Proses check in lambat pada saat kami menginap semalam, karenanya sedikit membuat frustrasi. tapi makanan dan menginapnya sangat santai. secara keseluruhan pengalaman yang sangat tenang."
,klook.com/id/hotels/detail/235639-sofitel-singapore-sentosa-resort--spa-sg-clean,GEEK SENG,Diulas: 10 Mar 2021,"Resornya bagus, perubahan besar dari kota Singapura. Sarapan yang disediakan oleh hotel memiliki hit dan miss. Bagian yang mengganggu dari kami tinggal adalah pemeliharaan sistem alarm kebakaran di mana bel memiliki pengujian intermiten. Kolam renang sepertinya sudah lama tidak terawat. Bagian ini tampak aneh untuk hotel bintang 5 yang disebut-sebut mengingat tarif yang dikenakannya. The Cliff menyajikan pasta dan pizza yang enak."
,klook.com/id/hotels/detail/235639-sofitel-singapore-sentosa-resort--spa-sg-clean,Nur Ashikin,Diulas: 9 Mar 2021,"Ditunjukkan dalam dokumen pra kedatangan bahwa saya akan tiba pada 11am-12pm. Namun, ketika saya sampai di sana pada 12:30, kamar tidak tersedia. Ruangan itu juga tidak memenuhi standar 5 *. Tirai memiliki noda, penerimaan informasi dan mereka mengatakan mereka akan mengirim rumah tangga untuk mengganti tirai daripada mengganti kamar. Ada media hub bluetooth saat terhubung tidak ada musik yang diputar dan saat dicek ke teknisi katanya bluetooth tidak berfungsi di sembarang ruangan. Mengapa memiliki tombol Bluetooth yang dapat Anda sambungkan tetapi tidak berfungsi. Tidak ada Spotify atau Netflix yang dapat diputar di TV. Hiburan yang tersedia di tv terhubung ke radio dan tidak semua saluran dapat diputar. Kami harus mencoba masing-masing saluran untuk menguji apakah radio berfungsi, ketika diperiksa dengan teknisi dia hanya mengatakan &quot;Begitu saja&quot; Bantalnya juga bau. Perawatan hotel secara keseluruhan tidak memenuhi standar."
,klook.com/id/hotels/detail/235639-sofitel-singapore-sentosa-resort--spa-sg-clean,Rahim,Diulas: 9 Mar 2021,"Dapatkan untuk kesepakatan yang bagus. 1 untuk 1. Antrian check in panjang. Tidak menghibur permintaan hari ulang tahun pelengkap istri yang diatur ketika hotel lain memberikan kue gratis dan dekorasi terbaik. Disebut 3 hari sebelumnya untuk ranjang bayi dan tidak tersedia saat check in. Jadi ya tidak senang saat check in. Selain itu, ini adalah tempat menginap keluarga yang menyenangkan dengan anak kecil. Kamar, layanan staf, dan fasilitas adalah yang terbaik. Mereka juga menyediakan penggunaan sepeda berkualitas secara gratis. Dan ada tangga langsung turun ke pantai. &#39;Bellboys&#39; kebanyakan adalah paman di usia 50-an. Mereka dapat melakukan pekerjaan dengan layanan yang sangat baik tetapi saya pikir Anda semua membutuhkan 1 orang muda yang kuat untuk membantu dengan barang bawaan yang berat. Check out cepat tetapi mereka tidak akan menghibur untuk check out terlambat. Akan memberikan 5 bintang jika bukan karena pengalaman check-in yang buruk."
,klook.com/id/hotels/detail/235639-sofitel-singapore-sentosa-resort--spa-sg-clean,Mathilda,Diulas: 8 Mar 2021,"Pengalaman hebat, makanan yang disajikan juga enak."
,klook.com/id/hotels/detail/235639-sofitel-singapore-sentosa-resort--spa-sg-clean,Charlene,Diulas: 8 Mar 2021,"Ada antrian pendek saat check-in tetapi antrian bergerak cepat. Pergi untuk makan siang (sebagai bagian dari paket) sambil menunggu kamar siap. Makan siang dan makan malam harus digunakan sebelum Anda check-in atau selama Anda menginap. Makanan di The Cliff enak tapi sedikit asin. Untuk sarapan Anda bisa memilih lebih dari 1 set tidak seperti kebanyakan hotel di luar sana. Berhasil memesan kolam renang dan slot di sini berada dalam blok 2 jam. Kolam renangnya besar tetapi perhatikan bahwa itu cukup dalam (2,5 m). Bus antar-jemput tersedia ke sana kemari mrt Harbourfront dan jika Anda berkendara, tersedia tempat parkir gratis di lokasi."
,klook.com/id/hotels/detail/235639-sofitel-singapore-sentosa-resort--spa-sg-clean,Zoe Rui Ling,Diulas: 8 Mar 2021,Dipesan selama flash deal oleh Klook dan itu sepadan dengan harga yang dibayarkan. Hotel sedang sibuk tetapi masih harus menikmati kolam renang dan sarapan memiliki pilihan yang layak. Sudah memesan untuk kembali dengan teman-teman kita bulan depan!
,klook.com/id/hotels/detail/235639-sofitel-singapore-sentosa-resort--spa-sg-clean,Khai Shing,Diulas: 8 Mar 2021,"Tempat itu indah, seperti resor/villa. Dari kolam renang, Anda dapat mengakses pantai dan fasilitas Sentosa dengan mudah (terdekat adalah pantai Tanjong dan Pantai Palawan). Khawatir bahwa porsi makanan mungkin kecil pada awalnya tapi itu tidak masalah (Anda akan terlalu kenyang!) dan layanannya adalah yang terbaik! Akan pergi lagi"
,klook.com/id/hotels/detail/235639-sofitel-singapore-sentosa-resort--spa-sg-clean,Angela,Diulas: 7 Mar 2021,"Pengalaman yang menyenangkan. Cek di itu prompt dan layanan baik. Kamarnya bersih dan luas. Cintai tanaman hijau yang tersedia di dalam kompleks, terutama banyak kolam. Menenangkan dan santai."
,klook.com/id/hotels/detail/235639-sofitel-singapore-sentosa-resort--spa-sg-clean,Jacqueline Jie Ying,Diulas: 7 Mar 2021,Itu adalah pengalaman hebat dan rasanya seperti saya di bali. Pelayanannya oke kecuali check-in yang lambat. Makanan di tebing agak asin.
,klook.com/id/hotels/detail/235639-sofitel-singapore-sentosa-resort--spa-sg-clean,Hazel,Diulas: 7 Mar 2021,"Hotel ini terletak di ujung Sentosa dan memiliki nuansa Bali. Layanan bus antar-jemput datang dengan interval 30 menit untuk menjemput tamu ke hotel. Staf hotel sebagian besar sangat ramah dan membuat kami menginap di hotel sangat menyenangkan. Karena itu adalah hari ulang tahun pasangan saya, hotel dan restoran tebing menyediakan hari ulang tahun gratis. Selanjutnya, Ryan di The Cliff Restaurant bekerja ekstra untuk mendekorasi meja dan memberi kami 2 mocktail gratis. Kami sangat terkejut sebagai hasilnya. Kolam renangnya cukup luas tetapi anak-anak harus berhati-hati karena kedalamannya 2,5 m di sisi lain. Sarapan di Kwee Zen sangat enak. Secara keseluruhan, kami bersenang-senang dan berharap untuk tinggal lagi segera."
,klook.com/id/hotels/detail/235639-sofitel-singapore-sentosa-resort--spa-sg-clean,Nuno,Diulas: 7 Mar 2021,"Kamarnya bagus, hotelnya benar-benar terasa seperti resor. Pilihan makanan enak dan kolam renangnya bagus untuk orang dewasa dan keluarga dengan anak-anak?"
,klook.com/id/hotels/detail/235639-sofitel-singapore-sentosa-resort--spa-sg-clean,HWEE MIANG,Diulas: 7 Mar 2021,"Retreat to Spa Sanctuary adalah paket yang sangat layak untuk diambil! Perjalanan liburan yang menyenangkan dari kota, hampir tidak ada yang perlu dikhawatirkan karena makan malam dan sarapan sudah termasuk dalam paket. Makan malam di Cliff adalah WOW, dengan pemandangan luar biasa dari tempat duduk dan makanan enak. Porsi dan variasi sarapan juga bagus. Pijat seluruh tubuh 1 jam di So Spa untuk 2 orang membuat paket semakin lengkap. Sekedar pengingat untuk memastikan Anda memesan lebih awal (mungkin segera setelah Anda memesan paket ini) di kolam renang Anda, spa (pijat) dan fasilitas apa pun dalam rencana, jadi untuk mendapatkan slot waktu ideal Anda. Untungnya makan malam kami di Cliff sudah dipesan sebelumnya oleh Klook dan kami sangat menghargainya."
,klook.com/id/hotels/detail/235639-sofitel-singapore-sentosa-resort--spa-sg-clean,Glenda,Diulas: 7 Mar 2021,Keseluruhan tinggal hanya memuaskan karena layanan di berbagai titik kontak dapat lebih ditingkatkan. Mereka menyediakan pembersih tangan gratis dan tisu basah. Paket kami termasuk 3 kali makan dan makanannya enak. Ruangan itu bersih dan nyaman kecuali bantal yang terlalu lembut. Cek itu cepat dan bebas rewel.
,klook.com/id/hotels/detail/235639-sofitel-singapore-sentosa-resort--spa-sg-clean,Aaron,Diulas: 6 Mar 2021,Pengalaman yang sangat bagus ketika pergi pada hari kerja. Kolam renang cukup besar untuk berenang dan banyak sofa daybed untuk bersantai. Makanannya juga enak meskipun menu makan siang dan makan malamnya sama
,klook.com/id/hotels/detail/235639-sofitel-singapore-sentosa-resort--spa-sg-clean,Tin Hong,Diulas: 6 Mar 2021,Itu adalah pengalaman menginap yang sangat memuaskan dan santai untuk satu malam lengkap dengan makanan enak dan kamar yang nyaman. Langkah-langkah keamanan juga diberlakukan di fasilitas untuk memastikan tidak ada kepadatan yang berlebihan.
,klook.com/id/hotels/detail/235639-sofitel-singapore-sentosa-resort--spa-sg-clean,Li Ling Angeline,Diulas: 6 Mar 2021,"Penawaran paket yang bagus sudah termasuk makan siang, makan malam, dan sarapan. Kontra - Menu makan siang dan makan malam sama, kecuali menu makan malam menawarkan tambahan pilihan makanan penutup."
,klook.com/id/hotels/detail/235639-sofitel-singapore-sentosa-resort--spa-sg-clean,peiqi,Diulas: 6 Mar 2021,"Layanan terburuk yang pernah saya alami di hotel mewah. Saya merayakan ulang tahun dan menghubungi hotel untuk membuat beberapa pengaturan melalui email dan nomor kontak kami - tidak ada tanggapan. Diindikasikan bahwa saya merayakan ulang tahun pada formulir pendaftaran pra kedatangan saya dan sekali lagi - diabaikan dan tidak ada tanggapan. Saya menulis kepada mereka empat kali melalui email secara total tentang permintaan saya, meninggalkan mereka umpan balik tentang pengalaman negatif saya setelah saya tinggal, sudah lebih dari dua minggu dan coba tebak - tidak ada tanggapan. Jelas sofitel sentosa tidak peduli dengan pelanggannya, dan email dan nomor kontak mereka tidak berfungsi sama sekali. Saya suka kamar dan makanan saya di tebing, mengecewakan bahwa layanan mereka menyeret seluruh pengalaman pelanggan ke bawah."
,klook.com/id/hotels/detail/235639-sofitel-singapore-sentosa-resort--spa-sg-clean,Marcus,Diulas: 5 Mar 2021,Pengalaman hebat dan paket ini pasti bernilai saat termasuk sarapan ala carte dan makan malam yang luar biasa. Pengalaman pijatnya bagus dan Anda bisa mencoba kolam renang dan fasilitas spa juga. Secara keseluruhan sangat berharga dan akan merekomendasikan orang untuk mendapatkan paket ini daripada hanya memesan kamar.
,klook.com/id/hotels/detail/235639-sofitel-singapore-sentosa-resort--spa-sg-clean,YI QUAN ELSON,Diulas: 5 Mar 2021,"Merayakan 1st Wedding Anniversary kami adalah peristiwa penting bagi kami. Ada banyak pilihan untuk dipilih, tetapi setelah beberapa pilihan yang cermat, kami memutuskan untuk memilih Sofitel Sentosa. Kami mencoba untuk menjaga ekspektasi awal tetap rendah, karena kami tidak ingin kecewa jika terjadi kesalahan. Tapi anak laki-laki kami sangat salah. Seluruh pengalaman meniup pikiran kami langsung dari saat kami melangkah ke hotel. Dari layanan yang sangat baik hingga kebersihan kamar dan seluruh perasaan berada di resor sangat luar biasa. Kami juga ingin secara khusus menyebutkan RYAN dari restoran The Cliff yang membuat pengalaman bersantap kami lebih berkesan dengan layanannya yang halus dan teliti sepanjang makan malam kami. Makanannya luar biasa dan hotel tidak berusaha keras untuk menyediakan makanan berkualitas luar biasa meskipun mereka datang sebagai bagian dari paket (artinya makanan itu sebenarnya FOC). Kami memiliki pengalaman yang luar biasa dan tak terlupakan dan pasti akan merekomendasikan siapa pun yang mencari hotel ini untuk mengalaminya sendiri. Kamu tidak akan kecewa."
,klook.com/id/hotels/detail/235639-sofitel-singapore-sentosa-resort--spa-sg-clean,Desiree,Diulas: 5 Mar 2021,Long Q untuk check-in pada hari Minggu jam 3 sore+. Kamar nyaman yang bagus. Kurangnya fasilitas anak-anak (misalnya perlengkapan mandi). Sarapan biasa-biasa saja. Burung merak yang indah.
,klook.com/id/hotels/detail/235639-sofitel-singapore-sentosa-resort--spa-sg-clean,phyllis hui yi,Diulas: 4 Mar 2021,Standar layanan bisa lebih baik. Email tidak dijawab dan instruksi meja depan berbeda dari instruksi petugas kolam renang. Memiliki kartu ezlink yang hilang juga selama pembersihan meskipun mereka kembali setelahnya. Tidak sepenuhnya pengalaman menginap yang menyenangkan.
,klook.com/id/hotels/detail/235639-sofitel-singapore-sentosa-resort--spa-sg-clean,Ting Yan,Diulas: 4 Mar 2021,"Antrian panjang saat check in, mungkin karena hari Minggu. Senang dengan kamar, layanan, makanan, dan keramahan. Banyak dan pasti akan membeli lagi tahun ini!"
,klook.com/id/hotels/detail/235639-sofitel-singapore-sentosa-resort--spa-sg-clean,Tan,Diulas: 4 Mar 2021,Dibeli selama kesepakatan CNY: 1 untuk 1 masa inap. Benar-benar layak! Seluruh hotel memiliki suasana resor luar negeri yang bagus dan tempat tidurnya sangat nyaman! Ingin merekomendasikan!
,klook.com/id/hotels/detail/235639-sofitel-singapore-sentosa-resort--spa-sg-clean,Hui Qi Cynthia,Diulas: 4 Mar 2021,Secara keseluruhan pengalaman yang baik dan kami menikmati kami tinggal di sana. Hanya con adalah standar makanan di 3 restoran berbeda yang kami kunjungi cukup biasa-biasa saja (kami tidak pilih-pilih) untuk restoran bintang 5.
,klook.com/id/hotels/detail/235639-sofitel-singapore-sentosa-resort--spa-sg-clean,CHLOE,Diulas: 3 Mar 2021,"Senang tinggal di sini dengan suami saya, rindu nuansa resor dan kolam renangnya besar! Lokasi yang nyaman ke tempat-tempat dengan bus sentosa gratis turun dari kolam renang."
