Yi Hui,Reviewed: 29 Sep 2021,3.05.0Good,,"The check in process is seamless, we get to choose our preferred breakfast timing where there's a time limit for each slot. Their pool is available 24h, you can access anytime with your room card. There is complimentary parking, remember to take your coupon at the reception before you travel out. They are so sweet, knowing that our stay is for our honeymoon, they decorated our room with helium & ""LOVE"" balloons, and sent us a delicious cake ?. I like that there is a pillow menu to choose the type of pillow you prefer, just call them and they'll bring it over. They have various lightings for different moods, I like the one that will constantly change like rainbow colours ?? The window at the bathtub allows us to watch the TV while soaking in the bathtub. There is a speaker in the bathroom, connected to the radio in the TV, you can adjust the volume and dance with the music while in the shower ??. Our Dinner & Breakfast is done at The Kitchen Table. For dinner, the Wok Fried Hor Fun with Grilled Waygu Beef has a very strong wok-hey taste, the gravy is different from usual as its thicker and loaded with black pepper. The Wok Fried Hokkien Mee could be better. The nearest convenient store closes at 8pm so we drove to the nearby 7-Eleven to grab a cup noodle & lava egg for supper, this combination is so good ?. The breakfast menu is similar to St. Regis as they are from the same group, but we prefer the menu & food at St Regis. Check out is easy, just drop your room card in the basket and they will email to you the charges. Thank you for decorating the room.",Translate Review To English
Xin Yi Cindy,Reviewed: 27 Sep 2021,5.05.0Superb,,"Everything was great! The breakfast selection were plenty and the dinner was delicious! Loved the pool, the room and the bathtub!",
Soo Feng,Reviewed: 25 Sep 2021,5.05.0Superb,,Beautiful views from w hotel and room is clean with bathtub.,Translate Review To English
Soo Feng,Reviewed: 25 Sep 2021,5.05.0Superb,,great rooms with 2 double beds and beautiful swimming pool with slides for thr children.,Translate Review To English
Alyssa An Qi,Reviewed: 17 Sep 2021,5.05.0Superb,,"Great customer service, and the food was aplenty. Really liked the environment at Sentosa Cove too!",Translate Review To English
Yi Ting,Reviewed: 14 Sep 2021,5.05.0Superb,,Had a wonderful time at W Sentosa. It truly feels like a getaway because of its exclusive location at sentosa cove. The pool was the main attraction. It's quite rare to see such a big hotel pool in SG. The room and toilet was very spacious as well.,
Muhammad Akbar,Reviewed: 13 Sep 2021,5.05.0Superb,,Awesome Klook and W Hotel staffs who helped us create a special weekend for us!,Translate Review To English
Katherine,Reviewed: 13 Sep 2021,5.05.0Superb,,Lovely place and excellent service! A good place to recharge,
MingWei,Reviewed: 10 Sep 2021,3.05.0Good,,We went during covid period where gym cannot be used. Kinda boring there.,Translate Review To English
Yi Shan,Reviewed: 8 Sep 2021,5.05.0Superb,,"The room was great, service staff were friendly and food was fantastic! Definitely will be back and I have already recommended this to many of my friends! Check in was swift and check out was fuss-free too!",
Marvin,Reviewed: 7 Sep 2021,5.05.0Superb,,Clean and friendly staff. And I got an upgrade for my wedding anniversary.,Translate Review To English
Nur Shahidah,Reviewed: 4 Sep 2021,5.05.0Superb,,good service and best place for couples or friends to just chill,
Abdul Rahim,Reviewed: 4 Sep 2021,5.05.0Superb,,"Nice view, friendly staff, would definitely stay here again..",Translate Review To English
GUNAREVATHI,Reviewed: 3 Sep 2021,5.05.0Superb,,"Awesome Customer Service 100%. Food Was Yummylicious. Room Was So Beautiful. When For A Staycation For My Husband Birthday. Room Was Prepared With A Balloon, Birthday Card And Cake Too. My Husband And I Love The Whole Stay. The View From Our Room Was So Nice. Swimming Pool Was Splendid. Best Place To Have StayCation With Your Love Ones. Once Again Thank You.",Translate Review To English
Ilias,Reviewed: 2 Sep 2021,4.05.0Great,,"Super friendly staff, hotel room was spacious and clean. Only bad thing is no smart TV to watch netflix.",Translate Review To English
MUHAMMAD FAUZAN,Reviewed: 2 Sep 2021,5.05.0Superb,,W hotel a best hotel to have your staycay at. Will definitely book again. The only regret I have is that I only book for 1 night. ????????????????????,Translate Review To English
Jay,Reviewed: 1 Sep 2021,5.05.0Superb,,"great fun, we could get rooms side by side. food was fantastic too",Translate Review To English
Boon Tiong Daniel,Reviewed: 1 Sep 2021,5.05.0Superb,,Big room. Clean and bright decorations. Gym machines looks new and well maintained. Staff at The Kitchen were all very pleasant and cheery. Special mention of staff Wai Meng for her excellent service.,Translate Review To English
Samuel,Reviewed: 31 Aug 2021,5.05.0Superb,,The staycation in Wonderful Room was amazing. The room is spacious and nice. The hotel staff service is superb. Would definitely stay in this hotel again. Thumbs up.,Translate Review To English
Sharon,Reviewed: 31 Aug 2021,5.05.0Superb,,"My 2nd staycation but this time due to the higher occupancy rate, the service was not as prompt as when I went in May. Nonetheless it was a great time. Love W!",
Aiden,Reviewed: 30 Aug 2021,5.05.0Superb,,super helpful staff and the room was really big and cute with a bathtub,Translate Review To English
Lee Choo Roselyn,Reviewed: 29 Aug 2021,4.05.0Great,,we didnt do much at the hotel as we are not able to book the swimming timeslots tat we wanted. but the hotel was nice enough to send my son a b'day cake plus balloons.,Translate Review To English
Inderpaul,Reviewed: 28 Aug 2021,5.05.0Superb,,Fantastic hotel and the staff were all super nice! Did a 1-night stay for my wife as it was her birthday! Will recommend this to all family and friends!,
mustafa,Reviewed: 27 Aug 2021,5.05.0Superb,,"Enjoyed our staycation immensely, was not crowded thanks to Covid, great service and a well maintained room. Would highly recommend it.",
Wei Fang,Reviewed: 26 Aug 2021,5.05.0Superb,,Great experience for my hubby birthday staycation. Staffs were helpful. Breakfast was delicious. Room is really spacious and clean and comfy. Birthday cake is provided for my hubby birthday.,Translate Review To English
Bee Tee,Reviewed: 25 Aug 2021,5.05.0Superb,,2nd time staying in this hotel. Very pleasant stay experience staff are all very warm and friendly.,Translate Review To English
Yong Tsen,Reviewed: 25 Aug 2021,5.05.0Superb,,"Not my first W hotel, but first time stay in Singapore. Some area can be better like the room, it's a bit old, and some staffs at the welcome desk try to avoid the eye contact when I approached, so not W standard. Concierge talents are great, restaurant staffs are super friendly! Overall a great experience will definitely come back again!",Translate Review To English
Patrick Lionel,Reviewed: 23 Aug 2021,4.05.0Great,,Very relax staycation however more customer experience could have been better if hotel staff can reach out more,
Alvin,Reviewed: 21 Aug 2021,4.05.0Great,,"Room was nice and the food was good. However it gets noisy when it starts to rain. Sounded like raindrop hitting against a metal and it wad quite loud, thus disturbing sleep in the middle of the night. Hope that something can be done about that.",Translate Review To English
Wei Haur,Reviewed: 19 Aug 2021,5.05.0Superb,,"The room is clean, the food is good, the staffs are very nice and friendly. Smokers: the designated smoking area is at level 2 (outside).",Translate Review To English
kristina,Reviewed: 18 Aug 2021,5.05.0Superb,,Wonderful experience for family with young kids. The crew really knew how to make the stay special for the little ones!,Translate Review To English
Regina,Reviewed: 16 Aug 2021,5.05.0Superb,,It was a great stay! Hotel with helpful staff. Room was also clean and comfortable.,
HyunSung,Reviewed: 16 Aug 2021,4.05.0Great,,"Good food and pool, relaxing environment. Water slide was quite interesting and enjoyed time there. Went for short walk around sentosa cove area at night.",Translate Review To English
Jia Chian,Reviewed: 15 Aug 2021,5.05.0Superb,,Appreciate the extra effort by the staffs for helping up the decorations of my wedding proposal together with my supplier. My wife and I had a very romantic and memorable night during the stay.,Translate Review To English
Soo Hong Roy,Reviewed: 14 Aug 2021,5.05.0Superb,,"It was a staycation to celebrate my wife birthday. The service was good, with lots of nearby eateries. After our dinner, we went to nearby convenient stall to purchase some titbit for a movie night the kids enjoy their stay for a night. We sent for a swim and the pool is clean. We will be back if there is promo from klook.",Translate Review To English
Denzel,Reviewed: 14 Aug 2021,5.05.0Superb,,The view of the pool was magical and the food from Skirt amazing.,Translate Review To English
Anne,Reviewed: 11 Aug 2021,5.05.0Superb,,"Great staycation with the family. Children can’t wait to go back again . Comfortable room and a great pool for kids to play non-stop. Breakfast selection was good as well. Staffs are helpful and friendly . Thank you to front desk staff, Marcus for the pleasant check-in experience .",
Alicja,Reviewed: 10 Aug 2021,5.05.0Superb,,"I would give it 6 stars. Amazing hotel with great service. This is my 6th staycation at it beats Shangri-La, Fullerton or Sofitel hotel Sentosa by mile. I would suggest to stay 3 nights for the ultimate staycation experience",
Julie,Reviewed: 10 Aug 2021,5.05.0Superb,,My family had a wonderful staycation at W Hotel. Checking in was fast. Room was clean. Views are good. Gym is well equipped and pool was amazing. Breakfast was delicious. Staff were friendly and helpful. Overall all very enjoyable stay.,Translate Review To English
Carlos Vicente IV,Reviewed: 10 Aug 2021,5.05.0Superb,,Had a wonderful time during my stay! The service was outstanding!,
Danella,Reviewed: 8 Aug 2021,5.05.0Superb,,Good food and nice place to stay away from the city! Enjoyed the day just relaxing ??,Translate Review To English
Wee Leong,Reviewed: 5 Aug 2021,5.05.0Superb,,Perfect stay. Certainly one of the best for the kids.,
Sandhya,Reviewed: 4 Aug 2021,5.05.0Superb,,Great accommodation and service. Even though we have to postpone our stay last min. Everything was handled perfectly. Our daughter had so much fun in the pool and at the bathtub. She loved it??????! And we loved it??????. Excellent??????????,
Jeffrey,Reviewed: 4 Aug 2021,5.05.0Superb,,"Very kind and generous hotel, they offer sufficient bottles of drinking water in the room. Stunning mood lightings in the room. Was given a room at 7th Floor (Top flr) with nice view of Yacht docks. Take a nice evening walk by the bay to Cold Storage open till 10pm / 7-Eleven open 24 hrs, its nice!",Translate Review To English
Sabrina,Reviewed: 3 Aug 2021,5.05.0Superb,,Trust me is worth it the pool is self is 24 hrs 7pm till next morning 7am no need to make reservations at all the suites are fantastic!,Translate Review To English
Celina,Reviewed: 3 Aug 2021,5.05.0Superb,,"Not the first time staying at W hotel. Lovely, clean and beautify hotel to be away from the city.",Translate Review To English
SI YUN,Reviewed: 3 Aug 2021,3.05.0Good,,Room was abit dated and service was average. Items were missing from the breakfast sets we ordered.,
MUHAMMAD FIRDAUS,Reviewed: 31 Jul 2021,4.05.0Great,,"Booked a room a month ago for a birthday celebration + staycation for one night. Checking in process was seamless and the staff attending to me was excellent (unfortunately forgot to take note of his name). The room was decorated with the birthday balloons and cake (the cake was delicious btw!), with compliments form the W management. Therefore, thank you very much for accommodating to my request and making our stay a great one. Anyway, management might want to consider the following to amplify the experience as a whole - installation of bidet in the toilet and Netflix. That's just what i think. :)",Translate Review To English
Zenia Zenobia,Reviewed: 31 Jul 2021,5.05.0Superb,,"Room was really nice, and the breakfast tasted good as well. Enjoyed my stay",
Terry,Reviewed: 30 Jul 2021,5.05.0Superb,,Just chilling during this covid period. Great staff and service! The ambience was great. Will come again!,
Sapna,Reviewed: 27 Jul 2021,5.05.0Superb,,Pleasant stay. Staff were very friendly and accomadating. Will be back again.,Translate Review To English
Sapna,Reviewed: 27 Jul 2021,5.05.0Superb,,It was a pleasant experience and the staff were very friendly. There was some misunderstanding with regards to the room and the staff handled the situation very well. Truly appreciate the cheese platter and wine bottle given for the special occasion.,Translate Review To English
JUNTING,Reviewed: 21 Jul 2021,5.05.0Superb,,The Wonderful Room was spacious and romantic for couples~ highly recommended dining at The Kitchen Table. staffs are friendly and it was a pleasant stay for us :),Translate Review To English
Rowena,Reviewed: 21 Jul 2021,5.05.0Superb,,Wonderful experience spend time with family. The room is big enough for family. I would come back again,Translate Review To English
Vanessa,Reviewed: 20 Jul 2021,5.05.0Superb,,"Absolutely love my experience at W singapore always. The package was really love which included breakfast and meal credits, worth the buy. Also there’s SRV to minus off total still. :)",
Janet,Reviewed: 16 Jul 2021,4.05.0Great,,"We’ve our anniversary staycation at W Singapore, a pleasant welcome to the room:)",Translate Review To English
Lilin,Reviewed: 16 Jul 2021,5.05.0Superb,,"Very wonderful stay with one of the best rooms and view. The pool is huge and comes with a slide. Floats are available for purchase if you like. (Big duckies, unicorns etc) The room was spacious, sufficient for a simple workout. The gym is clean and well equipped. Wok fry hor fun from the kitchen table was yummy, so was the satay with chopped pickles and the butter chicken. The portion size is generous so best to let the server recommend. Special thanks to Kieron from the front desk and Wai Meng from the Kitchen Table for taking care of us and making my birthday staycation a memorable one! ??",
Peck Cheng,Reviewed: 14 Jul 2021,5.05.0Superb,,"Beautiful pool, nice jacuzzi and well trained, helpful and professional staff. Very nice getaway",Translate Review To English
May Ling Janice,Reviewed: 13 Jul 2021,4.05.0Great,,Room is quite spacious but I feel not worth the price There r better rooms in other hotels at a better rate,
Jana Jiamin,Reviewed: 12 Jul 2021,4.05.0Great,,"Hotel is a little old, but overall still a good resort style getaway. Food served was quite a disappointment....",Translate Review To English
Andy,Reviewed: 12 Jul 2021,5.05.0Superb,,my 2nd night here. was very good just stay in room to cool.,Translate Review To English
Andy,Reviewed: 12 Jul 2021,5.05.0Superb,,"I didn't spend time using their facilities but walking passed it and the conditional in the gym was fantastic. also, the pool was nice",Translate Review To English
Jia Ning,Reviewed: 10 Jul 2021,5.05.0Superb,,Very good experience. Will definitely come back again,
Cindy,Reviewed: 9 Jul 2021,5.05.0Superb,,"Highly recommend this place. Check-in & check out was seamless. Amazing swimming pool where the kids have great fun at the slide. The ambience of the room and the yacht view was fabulous. The room was spacious. The morning breakfast served to us was excellent. Signature crab pizza was delicious. A request for a small birthday cake were surprised with W hotel balloons too. If u join as member, the kid <12 years old, will get an ice cream too. Great treat for the kid. Thank you for the wonderful getaway…:)",
Nur Amalina,Reviewed: 7 Jul 2021,5.05.0Superb,,Fantastic view fantastic room. We enjoyed our stay here very much.,
Evonne,Reviewed: 4 Jul 2021,5.05.0Superb,,"I will come again :) the room was lovely , the staff gave us commentary macaroons and cake for the birthday celebration .",Translate Review To English
Muhammad Shafiq,Reviewed: 1 Jul 2021,5.05.0Superb,,"Amazing experience, friendly staff and very nice pool my toddler loved it. Thank you so much. Used our Singapore Rediscover voucher totally worth it. Will come back again. Smooth transaction with Klook.",
Natasha,Reviewed: 30 Jun 2021,5.05.0Superb,,"Beautiful atmosphere, very friendly staffs. love it!",Translate Review To English
Kheng Meng,Reviewed: 30 Jun 2021,5.05.0Superb,,pleasant stay .. clean room .. well equipped gym .. and nice pool .. many restaurants nearby too,Translate Review To English
Kheng Meng,Reviewed: 30 Jun 2021,5.05.0Superb,,Nice and clean room .. what amazed me is the Bose speaker up at ceiling ... prefect sound system. Gym and pool are well equipped...,Translate Review To English
Julie Hui Joo,Reviewed: 30 Jun 2021,2.05.0Below Average,,I am still waiting to hear back refund amount as W Hotel has already made the refund to Klook. But there’s no follow up from Klook. Can someone please respond to me ASAP?,
Yee Wen,Reviewed: 29 Jun 2021,5.05.0Superb,,Our favourite staycation so far - service and facilities were impeccable and we loved how it felt like an actual break. Check in was smooth and it was extremely easy to book our slots for breakfast/the pool.,
SHIN FUI,Reviewed: 28 Jun 2021,5.05.0Superb,,"I have prepared a birthday surprise for my boyfriend over here. He is very happy. Thank you to the hotel staff who helped me with the surprise. The service that the staff provide is fantastic, the food is delicious, and the most important thing is the room is very comfortable. We're glad to have good memories here and will come back again",Translate Review To English
Foong Ling,Reviewed: 28 Jun 2021,4.05.0Great,,Nice hotel with good service. Enjoyed our staycation very much and love the quiet and peaceful moments. Loved the walk along the broad walk and took many nice pictures.,
Wai Khuen,Reviewed: 28 Jun 2021,5.05.0Superb,,Spacious room with excellent amenities including gym and swimming pool. Hassle free check in and check out process. Great place for a family staycation.,
SU ENG CLEO,Reviewed: 28 Jun 2021,5.05.0Superb,,Awesome and Great STAY @ The Wonderful Room ???? Loved the pool very much and the whole hotel scented with a pleasant smell. Highly recommended and will stay again ??,Translate Review To English
Hai Bao,Reviewed: 27 Jun 2021,5.05.0Superb,"Wonderful Room, Room, 2 Double Beds · 2 Adults · 2 Nights",Great experience with W Singapore Sentosa Cove. Very convenient & the hotel team are very attentive.,Translate Review To English
Tang,Reviewed: 26 Jun 2021,5.05.0Superb,,"Clean, tidy, spacious, friendly staff, smooth check-in, knowledgeable. It is a good experience staying with them again and would recommend to stay again in the future.",Translate Review To English
Chee Chein,Reviewed: 26 Jun 2021,3.05.0Good,,Overall experience was good except being charged for 1 night parking at the hotel.,
Ji,Reviewed: 25 Jun 2021,5.05.0Superb,,"very good environment?good service and breakfast very nice, staff very kind and helpful.",
Chun Wang,Reviewed: 24 Jun 2021,5.05.0Superb,,"My family had a very enjoyable time at W Hotel, will definitely return for more!",Translate Review To English
Chun Wang,Reviewed: 24 Jun 2021,5.05.0Superb,,"My family had a great time at W Hotel, will definitely come back again!",Translate Review To English
Hui Min,Reviewed: 22 Jun 2021,4.05.0Great,,Nice hotel and they have prepared a nice cake for my birthday stay.,Translate Review To English
Shimin Adalene,Reviewed: 21 Jun 2021,5.05.0Superb,,"We enjoyed our staycation very much. Service was top notch and the pool wasn't crowded at all! Love the in-room dining and the breakfast at the balcony too! We got a room upgrade and an early check in! They surprised us with a cake and room decorations for our anniversary too! Really chill and romantic experience, even though our baby was with us!",Translate Review To English
Angeline Tan,Reviewed: 21 Jun 2021,5.05.0Superb,,"Enjoy the stay with friend for a birthday celebration, staff was friendly and quick check in and out. Slightly inaccessible but shuffle bus is available",
Huifang Serene,Reviewed: 21 Jun 2021,4.05.0Great,,value was definitely worth it though the food there was bleh and inconsistent from menu.,Translate Review To English
SHAOXIONG DARREN,Reviewed: 19 Jun 2021,5.05.0Superb,,Goooooooooooooooooooooooooooooooooooooooooooooooooooo!,Translate Review To English
Teo,Reviewed: 19 Jun 2021,4.05.0Great,,staff polite . but dislike dining in the room not comfortable and no additional chair provided.,Translate Review To English
Hazel,Reviewed: 16 Jun 2021,5.05.0Superb,,"We booked the Wonderful Room as that was the only room time on klook but decided to top up for the Fabulous room at check in. No regrets getting the top up as the balcony had a full view of pool plus marina area. Hotel room is clean and the bed was comfortable. It was a nice gesture for the staff to decorate the room with balloons and a complimentary cake. In addition, service was great as they sent staff to go door to door to top up amenities in the room and we saved the hassle of calling to get additional water/soap. There is also a stretch of restaurants near the hotel for a wider dining option. Overall a great experience and highly recommended!",Translate Review To English
Si Hui Sylvia,Reviewed: 14 Jun 2021,5.05.0Superb,,"Fun trip with a wonderful experience at the spa, enjoyed the swimming at the pool during the day and a night swim. Love the lights around the pool. The service was good, staff at the entrance helped us to take photo with the W sign and with prompt additional requests by dialing “0”.",Translate Review To English
Shu Ying,Reviewed: 13 Jun 2021,5.05.0Superb,,"Although just one night stay but it’s very pleasant. Their swimming pool is clean and huge. Same for hotel room, have a very good view of marina especially at night time. Very near to restaurants that sell nice food. Will definitely revisit again. Oh their service is very good. Requested to change out my breakfast coffee for another drink and it came within 30 minutes.",
Nichelle,Reviewed: 11 Jun 2021,5.05.0Superb,,Super pretty place and great service. Highly recommend,Translate Review To English
Si Hui Sylvia,Reviewed: 10 Jun 2021,5.05.0Superb,,"Enjoyable stay, hotel was clean and luxurious, at the pool there was free service to pump my large unicorn float. Will go back there again for another staycation.",
Xiao Wei,Reviewed: 5 Jun 2021,5.05.0Superb,,Awesome place for a staycay! Will definitely come back again!,Translate Review To English
Ai Khim,Reviewed: 25 May 2021,4.05.0Great,,"hotel is good. the team even help to prepare balloon and cake for my friend's birthday. really appreciate it. but I'll not recommend to dine at SKIRT restaurant. the service is really not hotel standard, and the price is not cheap.",Translate Review To English
Doreen,Reviewed: 24 May 2021,5.05.0Superb,,"In the room where there got very nice different colours of lights, the environment and atmosphere is very pretty! The swimming pools are very child-friendly, senior-friendly and adult-friendly as well!",Translate Review To English
Xueling,Reviewed: 19 May 2021,3.05.0Good,,"We went for our staycay during the phase 2 heightening alert . Dine out are prohibited. Our mood was already dampen . We request for a free upgrade to the room with pool view but was rejected . Hotel could have manage this better . With limited access to facilities gym and no dining out , the hotel could have done better by giving more dine in credits or free upgreat of rooms. Other hotels provide freebies or free upgrade . The amount we paid was the same non phase 2 period but the experience was not the same .",
Bennie,Reviewed: 19 May 2021,4.05.0Great,,No response from Klook and have to go ahead with the staycation despite the COVID 19 restriction announced on 13 May 2021. Pleasant staycation with good service from W hotel. Disappointed with Klook service,
Chiew Luan,Reviewed: 18 May 2021,5.05.0Superb,,Best decision ever to stay in W. Room was amazing and they provide 4 different types of pillows! Will definitely go back again,
JENNY,Reviewed: 18 May 2021,5.05.0Superb,,Room is excellent easy access & usage of the pool very pleasant stay,Translate Review To English
Jun Weng,Reviewed: 17 May 2021,5.05.0Superb,,"Top tier rooms and exceptional quality service :) Called reception for 2 bottles of complimentary water bottle to my room, was being offered 10 instead. Arrived almost instantly. ??",Translate Review To English
Jia Yi,Reviewed: 17 May 2021,5.05.0Superb,,It was an enjoyable 1-night stay with amazing pillows of varying firmness! Food and service at the Kitchen Table were also really good. Would definitely recommend to friends and strangers (:,Translate Review To English
