date,user,review,attraction,source
2018-10,edkswt,"saya memutuskan untuk ke area sentosa menggunakan bus ini, karena murah! di banding pakai sky train dari vivo city soalnya mahal. sebelumnya pernah naik itu dan kalau pas jam keluar uss itu sangat penuh dan sesak jadi mending pakai bus toh ntar pulangnya bisa pakai sky train juga",The Sentosa Bus,tripadvisor
2017-12,rajatripcom,Pergi kesini sudah lebih dari 5x sangat seru dan menyenangkan karena sangat bersih dan mempunyai spot indah untuk berfoto.Salah satu tempat favorit liburan,The Sentosa Bus,tripadvisor
2017-12,Putri638,cukup bermanfaat keliling-keliling naik bus ini untuk melihat-lihat area sentosa. lumayan untuk menghemat energi,The Sentosa Bus,tripadvisor
2017-05,Ika F,"Selama ini saya selalu menggunakan monorail sebagai sarana untuk berpindah tempat di sentosa. Namun saat melihat antrean monorail yang begitu panjang nya saya mencoba memilih alternatif lain menggunakan bus. Cara nya mudah hanya tinggal mencari tangga turun dari USS menuju kasino, dari situ sudah terlihat shelter bus dan tinggal antre memilihi untuk naik bus menuju Siloso Beach. Memang waktu tempuh menjadi sedikit lebih lama dibanding naik monorail, namun tidak perlu khawatir karena sepanjang perjalanan tidak akan bosan melihat deretan hotel maupun 'hutan' yang menarik.",The Sentosa Bus,tripadvisor
2017-01,shenindie,"naik bus ini dr dpn Vivo city hanya 1 SGD, lalu turun di dpn casino di Sentosa Island kita sdh bisa menjelajah pulau Sentosa. Bus yg lega & nyaman, cukup membayar dg kartu EZ link jd tdk perlu repot dg uang cash.",The Sentosa Bus,tripadvisor
2016-05,Puteri S,lumayan nih kalau bosen naik sentosa express bisa naik bis. gratis.. dan banyak jumlahnya. ada 2 jenis bis tingga lihat rutenya mau kemana.,The Sentosa Bus,tripadvisor
2015-03,yustinarini,"Sentosa Bus kami gunakan untuk menuju ke sentosa island. Biaya kurang lebih 4 SGD per orang. bayar diawal, kalau pulangnya bus gratis. yang membawa anak kecil, jika memakai stroller harus siap saat melipat dan memasukkan ke bis. karena sopir tidak suka kalau lama. lumayan, bis ini berjalan dengan kecepatan sedang, dingin dan tidak begitu ramai / sesak saat kami ada didalamnya.",The Sentosa Bus,tripadvisor
2016-01,Anna Haryati,"Dari Universal Studio, kita ambil escalator yang mengarah ke bawah tanah (CASINO). Kita jalan menuju ke samping kanan CASINO, nah tunggu deh disitu ada counter untuk menunggu BUS 1 dan BUS 2.., tinggal kita pilih saja. Bus ini yang membedakan adalah routenya. Nanti Bus ini akan membawa kita ke station diluar (deket patung merlion). Dari station diluar akan ada bus lagi yang akan membawa kita sight seeing ke wahana outdoor lainnya. semuanya totally FREE ... amazing sentosa island yach !!!",The Sentosa Bus,tripadvisor
2015-03,bang_jojo,"mencoba ke sentosa dengan yang lain, biaya lebih murah 2 SGD
ternyata jauh lebih mengasyikkan dan menyenangkan jika melewati bis..",The Sentosa Bus,tripadvisor
2015-02,fraskie,"bus ini suatu sarana kl kita mau keliling P sentosa. tarif nya 2 sgd kl ga salah inget . saya waktu itu naik bus ini saat dari casino ( di kasino deket stasiun monorail yg ke mal vivo city) mau nontong song of the sea.. cocok buat turis yg ga punya mobil. ide singapur sangat hebat, dimana orng tidak perlu pusing untuk ke objek wisata ( semua disediakan) sehingga byk turis dtng ke SG.",The Sentosa Bus,tripadvisor
2015-04,SatriaYP,"Bila anda ingin menjelajah Pulau Sentosa dengan gratis salah satunya menggunakan Bus Sentosa. Walaupun anda bisa berkeliling dengan jalan kaki atau bersepeda, menggunakan bus lebih hemat waktu karena waktu tempuh yang singkat dan dapat berhenti di beberapa titik wisata.

Bus Sentosa memiliki beberapa rute yang berbeda dan tersedia halte khusus di sepanjang perjalanan. Bus nyaman dan bersih. Namun saat musim liburan siap - siap dengan antrian yang panjang.",The Sentosa Bus,tripadvisor
2015-01,lilyain,"lumayan untuk mengitari sentosa island yg lumayan besar, bis ini gratis n rada rame antrinya terutama di malam hari",The Sentosa Bus,tripadvisor
2015-09,andri232,"The Sentosa Bus adalah bus-bus yang mengelilingi berbagai lokasi di dalam pulau Sentosa dan gratis, adalah beberapa kode bus dengan tujuan yang berbeda, kita bisa pilih sesuai dengan kebutuhan kita",The Sentosa Bus,tripadvisor
2015-09,Henry_Martana,"Jika Anda ingin melihat2 pemandangan sekeliling pulau Sentosa, namun tidak ingin capek karena harus berjalan kaki, Anda bisa menaiki sarana transportasi gratis ini, yaitu Sentosa Bus 1, Sentosa Bus 2, Sentosa Bus 3, dan Sentosa Beach Tram.

Kami naik mulai dari RW Sentosa, di mana bus berada di lantai basemen.
Bus pertama yang kami naiki adalah Bus 1, lalu kamu berhenti (turun) di Siloso Point. Kemudian berjalan kaki sedikit ke halte (di Siloso Point) untuk naik Beach Tram. Lalu naik Beach Tram dari titik awal (Siloso Point) hingga ke Tanjong Beach dan berputar balik. Lalu kami turun di Beach Station. Di sini kami membeli makanan ringan.
Lalu naik Bus 3, dari Beach Station hingga kembali lagi ke Beach Station.
Kemudian kami kembali ke RW Sentosa naik Bus 1.",The Sentosa Bus,tripadvisor
2015-02,yustinarini,"tidak terlalu buruk menggunakan bus ke sentosa island. paling murah selain opsi jalan lewat jembatan. bis tanpa kondektur, naik bisa memakai kartu yang dipakai untuk naik MRT. bisa bawa kereta dorong balita yang bisa ditekuk. harap siap2 karena sangat cepat, kalau leda lede bisa dimarahi sopirnya hehehe. pulangnya gratis alias free naik bus dari sentosa menuju stasiun MRT",The Sentosa Bus,tripadvisor
2014-11,Robertoantonio12,"Sangat menyukai bus ini karena AC nya yang dingin dan busnya yang nyaman. dan kita juga dapat berkeliling pulau sentosa gratis dengan bus ini,",The Sentosa Bus,tripadvisor
2015-08,WahyusFamily,"moda transportasi ini sebagai alternatif kereta cepat Sentosa express dalam mengelilingi Sentosa, tapi bus mempunyai nilai lebih karena dapat mengintari area yang tidak dilalui sentosa express, meski kadang harus berdesak-desakan",The Sentosa Bus,tripadvisor
2015-08,Albert_Prasetia,Bus nya memberi kemudahan. Jangkauan jarak jauh di sentosa memudahkan saya dan keluarga mengelilingi daerah pulau sentosa. Harga bus terjangkau walau lbh mahal dari naik mrt,The Sentosa Bus,tripadvisor
2014-11,Papachoky,"Keberadaan Bus ini sangat membantu, perjalanan hanya memutari Pulau Sentosa.
Untuk naik Bus ini tidak dikenai biaya, dan bus ini mengantarkan penumpang ke pemberhentian-pemberhentian wisata dan penginapan di Pulau Sentosa.",The Sentosa Bus,tripadvisor
