DELIMITER SEPARATION,web-scraper-order,web-scraper-start-url,pagination,user,date,review
120,1650540346-120,https://www.traveloka.com/id-id/hotel/singapore/resorts-world-sentosa---equarius-hotel-1000000502230?spec=22-04-2022.23-04-2022.1.1.HOTEL.1000000502230.Resorts%20World%20Sentosa%20-%20Equarius%20Hotel.2,,Kalam,4-Apr-21,"Room lights were not working. Took the technician 20mins to ge to our room to rectify the issue. While room was spacious, it was old and worn out. Needs an uplift to make it value for money. Inadequate drinking water provided. Breakfast was terrible, with extremely limited choice. Understand its covid, but setting check in at 3pm and check out at 11am is extreme. Was not worth the money paid for the staycation."
121,1650540346-121,https://www.traveloka.com/id-id/hotel/singapore/resorts-world-sentosa---equarius-hotel-1000000502230?spec=22-04-2022.23-04-2022.1.1.HOTEL.1000000502230.Resorts%20World%20Sentosa%20-%20Equarius%20Hotel.2,,Serena H.,4-Apr-21,room is great! check in wait is long though
122,1650540346-122,https://www.traveloka.com/id-id/hotel/singapore/resorts-world-sentosa---equarius-hotel-1000000502230?spec=22-04-2022.23-04-2022.1.1.HOTEL.1000000502230.Resorts%20World%20Sentosa%20-%20Equarius%20Hotel.2,,Rajagopal N. V.,3-Apr-21,I would highly recommend. Staying near to the nature.
123,1650540346-123,https://www.traveloka.com/id-id/hotel/singapore/resorts-world-sentosa---equarius-hotel-1000000502230?spec=22-04-2022.23-04-2022.1.1.HOTEL.1000000502230.Resorts%20World%20Sentosa%20-%20Equarius%20Hotel.2,,Wee L. P. D.,2-Apr-21,Manage to find time to stand still.
124,1650540346-124,https://www.traveloka.com/id-id/hotel/singapore/resorts-world-sentosa---equarius-hotel-1000000502230?spec=22-04-2022.23-04-2022.1.1.HOTEL.1000000502230.Resorts%20World%20Sentosa%20-%20Equarius%20Hotel.2,,Illi A. B. H.,1-Apr-21,"My family loved this hotel so much. Its so quiet and peaceful. The resort feels so far away from Singapore, I imagined I was on some Island Resort in another country. The pool has big mosquitoes though but it’s not surprising due to the many trees on the island. The room and toilet is big and spacious. Nice space for kids."
125,1650540346-125,https://www.traveloka.com/id-id/hotel/singapore/resorts-world-sentosa---equarius-hotel-1000000502230?spec=22-04-2022.23-04-2022.1.1.HOTEL.1000000502230.Resorts%20World%20Sentosa%20-%20Equarius%20Hotel.2,,Elisha N.,1-Apr-21,"we had an amazing stay the room was huge, the space was great and will stay here again!"
126,1650540346-126,https://www.traveloka.com/id-id/hotel/singapore/resorts-world-sentosa---equarius-hotel-1000000502230?spec=22-04-2022.23-04-2022.1.1.HOTEL.1000000502230.Resorts%20World%20Sentosa%20-%20Equarius%20Hotel.2,,Muhammad S. B. M. A.,31-Mar-21,"It’s my 3rd times stay cation there, will always top class. But this round my room was not ready. I was there at 3pm as stated to check in at 3pm. But need to wait till like 5pm for my room to be ready. But the hotel extended my check out timing. Thank you so much. Will always come back."
127,1650540346-127,https://www.traveloka.com/id-id/hotel/singapore/resorts-world-sentosa---equarius-hotel-1000000502230?spec=22-04-2022.23-04-2022.1.1.HOTEL.1000000502230.Resorts%20World%20Sentosa%20-%20Equarius%20Hotel.2,,Goh Y. l.,28-Mar-21,Cons: 1) check in took more than an hr and staff was unapologetic. 2) it’s silly to need to bring Ic to the swimming pool when there are no lockers next to the pool side. 3) there are sharp pebbles when entering the pool 4) breakfast is not at e hotel but at Hotel Micheal. There is shuttle bus to hotel Michael. Breakfast food is of mediocre standard Pros: 1) nice and big swimming pool 2) shuttle bus drivers are the most friendly among all e Equarius staff
128,1650540346-128,https://www.traveloka.com/id-id/hotel/singapore/resorts-world-sentosa---equarius-hotel-1000000502230?spec=22-04-2022.23-04-2022.1.1.HOTEL.1000000502230.Resorts%20World%20Sentosa%20-%20Equarius%20Hotel.2,,Fatin M.,26-Mar-21,"The hotel is really good stay for family gateway, the deluxe room is huge, the toilet and bathtub was amazingly huge too! I like how the toilet and shower is separated. In terms of distance wise, you would need to take a buggy from outside Hotel Michael to get to the hotel. The staff are really helpful and friendly! Despite the waiting time for check in took awhile, they make sure we are at a comfortable place waiting, no overcrowding during check in."
129,1650540346-129,https://www.traveloka.com/id-id/hotel/singapore/resorts-world-sentosa---equarius-hotel-1000000502230?spec=22-04-2022.23-04-2022.1.1.HOTEL.1000000502230.Resorts%20World%20Sentosa%20-%20Equarius%20Hotel.2,,Nur R. B. A. K.,22-Mar-21,"The staff were awesome honestly. always so friendly and professional. they have made the experience really nice for us if not for the other stuff: I just didn't expect some of the things such as parking was free but for only 1 exit. We booked 3 rooms, 1 for ourselves and 2 for our parents and in laws (they were 70-80yrs old). we drove 2 cars and cos the location was quite a distance to the beach, and our parents couldn't walk a lot, we drove in and out of the car park. all within Sentosa, jus that once you drive out of rws carpark, you have to pay for parking. the lady was nice enough to give us 1 extra ticket. but cos we go in and out a few times, we still had to pay parking. parking in rws wasn't cheap. the other thing was that every time you step out of the room to go to reception or the pool, you have to dig out for your IC when you come back in-for every single person. I understand that it's a requirement. but there's gotta be a way to make it more efficient. I had 6 bags of food in my hands when I'm alone, I had to struggle to take my IC out. if we forgot something in the car not even 5mins after coming into the room entrance, we still had to show our IC. I went for a staycay in other hotels but it wasn't like this. this was to the extent of annoying. there's gotta be a way to fix check this IC only at the entrance of hotel and that's it. breakfast - I didn't know the breakfast was not within Aquarius. we had to take a shuttle bus to go for breakfast. not far but again, if you have elderly with u, it's not very convenient. getting a swimming slot was also quite impossible. on the day of check no slots. our kids were upset cos they really wanted to swim. but you know what.. we decided to try our luck 1.5 hour before we checked out and went ahead for walk-in. the pool was not not crowded. maybe only 10 people in there. we managed to squeeze in only a 30min swim, better than nothing. the pool was beautiful and we could have spent more time there if it wasn't for the booking being full. sure, there's probably some inconsiderate people who booked but did not turn up. perhaps a waiting list would be great. another hotel we stayed in, called us when those who booked did not turn up."
131,1650540346-131,https://www.traveloka.com/id-id/hotel/singapore/resorts-world-sentosa---equarius-hotel-1000000502230?spec=22-04-2022.23-04-2022.1.1.HOTEL.1000000502230.Resorts%20World%20Sentosa%20-%20Equarius%20Hotel.2,,Angela T.,18-Mar-21,"All aspects of this stay was awesome. Despite being in a COVID situation, they provided safety checks without compromising service standards. So unlike MBS stay I had last week which was horrendous as we were treated like criminals. Well done Equarius. I’ll definitely come again!"
132,1650540346-132,https://www.traveloka.com/id-id/hotel/singapore/resorts-world-sentosa---equarius-hotel-1000000502230?spec=22-04-2022.23-04-2022.1.1.HOTEL.1000000502230.Resorts%20World%20Sentosa%20-%20Equarius%20Hotel.2,,Chan M. J.,14-Mar-21,The room was spacious and we got a very clear view of the cable cars. Will definitely visit again.
133,1650540346-133,https://www.traveloka.com/id-id/hotel/singapore/resorts-world-sentosa---equarius-hotel-1000000502230?spec=22-04-2022.23-04-2022.1.1.HOTEL.1000000502230.Resorts%20World%20Sentosa%20-%20Equarius%20Hotel.2,,Norzubaidah,14-Mar-21,"- Breakfast was not in the hotel itself. Need to travel to Hotel Michael via shuttle service. Very inconvenient as the time is until 1030am only. This information is not provided in the website/coupon. - Parking is given per night one only unlike other hotels I have stayed before. Hence, upon check in, you cannot travel out unless you don't mind paying the carpark fee tt can be expensive. - No In room dining or restaurant in the hotel itself. The food to order is from Malaysian street which is limited & not everything is halal. Ended up buying via Foodpanda. - Check out time is strictly 11am. No extension given. - Cleaniness is 3/5. The room is still smelly and balcony was dirty. Eg. have brid shit and cigg ashes around. - Do not expect any complimentary snacks/to buy snacks off the bar. There is nothing except 2 small carton of water. Best is to bring your own food/snacks! Positive Feedback: Wellplanned on the check-in as it was smooth. Good service by the Hotel Staff."
134,1650540346-134,https://www.traveloka.com/id-id/hotel/singapore/resorts-world-sentosa---equarius-hotel-1000000502230?spec=22-04-2022.23-04-2022.1.1.HOTEL.1000000502230.Resorts%20World%20Sentosa%20-%20Equarius%20Hotel.2,,Jean L. K. J. Y.,8-Mar-21,"Loved the room. Do note the check out time is 11, not 12. Bathroom was so spacious and balcony was cute. Room was clean. Especially loved the spacious bathroom that had both a shower door and toilet door + a seat to do makeup. 2 sinks too. And a bathtub. Ughhh we loved it. The bride to be is v particular about cleanliness and this passed her test and we had a rly nice time here and it was v hard to leave."
135,1650540346-135,https://www.traveloka.com/id-id/hotel/singapore/resorts-world-sentosa---equarius-hotel-1000000502230?spec=22-04-2022.23-04-2022.1.1.HOTEL.1000000502230.Resorts%20World%20Sentosa%20-%20Equarius%20Hotel.2,,Rhowena C. S. T.,7-Mar-21,"Had the best staycation ever! Service of the staffs made us feel very welcome. The room was very big, nice and comfortable! Can hear the sound of nature. Very relaxing. We wanted to take some photos in the room hence we requested for a simple decoration. We shared the photos of the room on our social media and our friends were asking about it. Thank you for taking such good care of a preggie!"
136,1650540346-136,https://www.traveloka.com/id-id/hotel/singapore/resorts-world-sentosa---equarius-hotel-1000000502230?spec=22-04-2022.23-04-2022.1.1.HOTEL.1000000502230.Resorts%20World%20Sentosa%20-%20Equarius%20Hotel.2,,Shaakirah R.,4-Mar-21,"I had an amazing experience here. A wonderful escape from reality. Customer service, hotel location and cleanliness were great! The shuttle service to the hotel comes every few mins which is super convenient. The rooms had a beautiful view of the trees and the pillows were very comfortable unlike at other hotels. I had an amazing time at the pool too. This was my 2nd time here and it definitely wouldn't be my last."
137,1650540346-137,https://www.traveloka.com/id-id/hotel/singapore/resorts-world-sentosa---equarius-hotel-1000000502230?spec=22-04-2022.23-04-2022.1.1.HOTEL.1000000502230.Resorts%20World%20Sentosa%20-%20Equarius%20Hotel.2,,Lucas L. J. H.,2-Mar-21,"Awesome staff, huge room & bathroom! Air-condition was quiet and cold. Loving the shuttle bus for our convenience as the hotel was a tad far away from the eateries. Overall would love to come back and stay. Only downside is that there’s no room service, had to order food from elsewhere."
138,1650540346-138,https://www.traveloka.com/id-id/hotel/singapore/resorts-world-sentosa---equarius-hotel-1000000502230?spec=22-04-2022.23-04-2022.1.1.HOTEL.1000000502230.Resorts%20World%20Sentosa%20-%20Equarius%20Hotel.2,,Guest-fziu2o,25-Feb-21,"Awesome service by hotel staff, Mr Simran, he was very friendly & the check-in was very fast and efficient. He showed genuine & personal care to ensure we have an enjoyable stay at Equarius Hotel. Great job, Mr Simran!"
139,1650540346-139,https://www.traveloka.com/id-id/hotel/singapore/resorts-world-sentosa---equarius-hotel-1000000502230?spec=22-04-2022.23-04-2022.1.1.HOTEL.1000000502230.Resorts%20World%20Sentosa%20-%20Equarius%20Hotel.2,,Yusmaini,21-Feb-21,"I would like to thank Gregory for fantastic service given, and accommodating our request with the fantastic room view, and the size of the room is just amazing. It was enjoyable and relaxing for me and my family. It has a very nice pool. And yes we will come back. Thank you again."
140,1650540346-140,https://www.traveloka.com/id-id/hotel/singapore/resorts-world-sentosa---equarius-hotel-1000000502230?spec=22-04-2022.23-04-2022.1.1.HOTEL.1000000502230.Resorts%20World%20Sentosa%20-%20Equarius%20Hotel.2,,Chay X.,14-Feb-21,The deluxe room was very spacious including the restroom and balcony. Love the rain shower and bathtub. Room and bedsheets were clean. Would definitely come back for a staycation.
141,1650540346-141,https://www.traveloka.com/id-id/hotel/singapore/resorts-world-sentosa---equarius-hotel-1000000502230?spec=22-04-2022.23-04-2022.1.1.HOTEL.1000000502230.Resorts%20World%20Sentosa%20-%20Equarius%20Hotel.2,,Peh X. Y.,26-Jan-21,"Great stay with awesome view at the hotel~ Love the amenities and the toilet especially, it’s super huge and there’s Tv! Bed is very comfortable too and clean overall. The breakfast is very scrumptious too"
142,1650540346-142,https://www.traveloka.com/id-id/hotel/singapore/resorts-world-sentosa---equarius-hotel-1000000502230?spec=22-04-2022.23-04-2022.1.1.HOTEL.1000000502230.Resorts%20World%20Sentosa%20-%20Equarius%20Hotel.2,,Mohamed D.,31-Dec-20,"Check in slot was secured earlier but ended up we had to wait almost an addition one and a half hour before checking in. Staff were virtually clueless and kept on insisting room was not ready. On the way to the room, 2 of the hotel barged in the lift, preventing us from exiting the lift. One of the staff was Darren. Rooms were fairly decent for the price. The last thing was we had to travel to another hotel for breakfast, which was troublesome and ridiculous."
143,1650540346-143,https://www.traveloka.com/id-id/hotel/singapore/resorts-world-sentosa---equarius-hotel-1000000502230?spec=22-04-2022.23-04-2022.1.1.HOTEL.1000000502230.Resorts%20World%20Sentosa%20-%20Equarius%20Hotel.2,,Serena L.,6-Nov-20,Spacious room and toilet! Awesome view from the balcony and they offer a nice pool too!
144,1650540346-144,https://www.traveloka.com/id-id/hotel/singapore/resorts-world-sentosa---equarius-hotel-1000000502230?spec=22-04-2022.23-04-2022.1.1.HOTEL.1000000502230.Resorts%20World%20Sentosa%20-%20Equarius%20Hotel.2,,Antonia F.,30-Dec-19,"The rooms are very very spacious, especially by Singapore standard! We got the connecting rooms with King beds on the 4th floor and it comfortably fits 4 adults and 3 kids with plenty of room to spare. The beds are super comfy, the bath amenities are lovely, the shower works perfectly, everything was clean, definitely, nothing to complain about! I especially love how the hotel did not provide drinking water in plastic bottles. They provided refillable water jugs instead, which we can easily fill with ice/cold water in the nearby ice/water machine at the end of the hall. Getting around was really easy with the free and frequent shuttle buses that took us to nearby hotels and the forum - where we can find plenty of dining and shopping options (including casinos and entrance to the Universal Studio Singapore) The hotel also provided us with complimentary monorail tickets valid for 3 days - so we can easily go back and forth to vivo city mall to do more shopping and find more dining options."
145,1650540346-145,https://www.traveloka.com/id-id/hotel/singapore/resorts-world-sentosa---equarius-hotel-1000000502230?spec=22-04-2022.23-04-2022.1.1.HOTEL.1000000502230.Resorts%20World%20Sentosa%20-%20Equarius%20Hotel.2,,efendy l.,27-Dec-19,This Hotel Located in the corner of resort world sentosa. The breakfast is good. and we can get shuttle bus to go to Universal Studio and any other attractions. I would like to stay in this hotel when I go to sentosa island.
146,1650540346-146,https://www.traveloka.com/id-id/hotel/singapore/resorts-world-sentosa---equarius-hotel-1000000502230?spec=22-04-2022.23-04-2022.1.1.HOTEL.1000000502230.Resorts%20World%20Sentosa%20-%20Equarius%20Hotel.2,,Wipawee B.,26-Dec-19,Really nice hotel. Big room and good service. Need improvement about breakfast.
147,1650540346-147,https://www.traveloka.com/id-id/hotel/singapore/resorts-world-sentosa---equarius-hotel-1000000502230?spec=22-04-2022.23-04-2022.1.1.HOTEL.1000000502230.Resorts%20World%20Sentosa%20-%20Equarius%20Hotel.2,,efendy l.,19-Dec-19,"Great place, great service. I will go back for sure"
149,1650540346-149,https://www.traveloka.com/id-id/hotel/singapore/resorts-world-sentosa---equarius-hotel-1000000502230?spec=22-04-2022.23-04-2022.1.1.HOTEL.1000000502230.Resorts%20World%20Sentosa%20-%20Equarius%20Hotel.2,,Navin H. G. A. H.,24-Nov-19,Really awesome room! Very comfortable. Staff was very friendly and helpful. Breakfast had many varieties and tasty.Worth the price!
150,1650540346-150,https://www.traveloka.com/id-id/hotel/singapore/resorts-world-sentosa---equarius-hotel-1000000502230?spec=22-04-2022.23-04-2022.1.1.HOTEL.1000000502230.Resorts%20World%20Sentosa%20-%20Equarius%20Hotel.2,,Nhat D. T.,27-Jul-19,Receptionist breakfast is not good.Terrible Attitude !
151,1650540346-151,https://www.traveloka.com/id-id/hotel/singapore/resorts-world-sentosa---equarius-hotel-1000000502230?spec=22-04-2022.23-04-2022.1.1.HOTEL.1000000502230.Resorts%20World%20Sentosa%20-%20Equarius%20Hotel.2,,Agus L. L.,8-Jul-19,The hotel room and facilities are excellent. But some of the hotel staff were a bit rude for a 5 star hotel. And I can tell they were bias to certain guest. I hope they can do better.
152,1650540346-152,https://www.traveloka.com/id-id/hotel/singapore/resorts-world-sentosa---equarius-hotel-1000000502230?spec=22-04-2022.23-04-2022.1.1.HOTEL.1000000502230.Resorts%20World%20Sentosa%20-%20Equarius%20Hotel.2,,Heru A. K.,18-May-19,"Spacious room, clean, comfortable. Location not too far from the entertainment and shopping area, walkable distance. Very warm welcome and services by the staffs."
153,1650540346-153,https://www.traveloka.com/id-id/hotel/singapore/resorts-world-sentosa---equarius-hotel-1000000502230?spec=22-04-2022.23-04-2022.1.1.HOTEL.1000000502230.Resorts%20World%20Sentosa%20-%20Equarius%20Hotel.2,,Tran Q. V.,9-Oct-18,"Great hotel, large room, super clean, great service. Everything is perfect."
154,1650540346-154,https://www.traveloka.com/id-id/hotel/singapore/resorts-world-sentosa---equarius-hotel-1000000502230?spec=22-04-2022.23-04-2022.1.1.HOTEL.1000000502230.Resorts%20World%20Sentosa%20-%20Equarius%20Hotel.2,,Vonny A. S. I.,29-Jun-18,"It was a very great experience and wonderful holiday for me and my family. We traveled with 3 kids and the kids loved the room. Very safe, comfortable, and child friendly. They have shuttle bus. Highly recommended for tourists who travel with kids."
155,1650540346-155,https://www.traveloka.com/id-id/hotel/singapore/resorts-world-sentosa---equarius-hotel-1000000502230?spec=22-04-2022.23-04-2022.1.1.HOTEL.1000000502230.Resorts%20World%20Sentosa%20-%20Equarius%20Hotel.2,,Jonny E.,16-May-18,"the best hotel in sentosa....room, staff, service was perfect."
156,1650540346-156,https://www.traveloka.com/id-id/hotel/singapore/resorts-world-sentosa---equarius-hotel-1000000502230?spec=22-04-2022.23-04-2022.1.1.HOTEL.1000000502230.Resorts%20World%20Sentosa%20-%20Equarius%20Hotel.2,,Mans Z.,24-Oct-17,Room was great. Shuttle service was a big plus.
157,1650540346-157,https://www.traveloka.com/id-id/hotel/singapore/resorts-world-sentosa---equarius-hotel-1000000502230?spec=22-04-2022.23-04-2022.1.1.HOTEL.1000000502230.Resorts%20World%20Sentosa%20-%20Equarius%20Hotel.2,,Joel C.,11-Sep-17,We have a great time in Equarius Hotel.
158,1650540346-158,https://www.traveloka.com/id-id/hotel/singapore/resorts-world-sentosa---equarius-hotel-1000000502230?spec=22-04-2022.23-04-2022.1.1.HOTEL.1000000502230.Resorts%20World%20Sentosa%20-%20Equarius%20Hotel.2,,Irvan N.,30-Mar-17,great hotel and great services
159,1650540346-159,https://www.traveloka.com/id-id/hotel/singapore/resorts-world-sentosa---equarius-hotel-1000000502230?spec=22-04-2022.23-04-2022.1.1.HOTEL.1000000502230.Resorts%20World%20Sentosa%20-%20Equarius%20Hotel.2,,Angli K.,5-Jan-17,"Clean, comfort, but check in very late..."
160,1650540346-160,https://www.traveloka.com/id-id/hotel/singapore/resorts-world-sentosa---equarius-hotel-1000000502230?spec=22-04-2022.23-04-2022.1.1.HOTEL.1000000502230.Resorts%20World%20Sentosa%20-%20Equarius%20Hotel.2,,Jose A. S.,19-Dec-16,"clean, comfort room and good service"
161,1650540346-161,https://www.traveloka.com/id-id/hotel/singapore/resorts-world-sentosa---equarius-hotel-1000000502230?spec=22-04-2022.23-04-2022.1.1.HOTEL.1000000502230.Resorts%20World%20Sentosa%20-%20Equarius%20Hotel.2,,Aragani A.,7-Dec-16,Best..probably the best in RWS area
162,1650540346-162,https://www.traveloka.com/id-id/hotel/singapore/resorts-world-sentosa---equarius-hotel-1000000502230?spec=22-04-2022.23-04-2022.1.1.HOTEL.1000000502230.Resorts%20World%20Sentosa%20-%20Equarius%20Hotel.2,,Katherin J.,29-Nov-16,My stay at Equarius was so great...i got a luxurious room because they upgraded for me... and the breakfast also good... most of all I had very good experience soon i'll go back there...
163,1650540346-163,https://www.traveloka.com/id-id/hotel/singapore/resorts-world-sentosa---equarius-hotel-1000000502230?spec=22-04-2022.23-04-2022.1.1.HOTEL.1000000502230.Resorts%20World%20Sentosa%20-%20Equarius%20Hotel.2,,Varuntita S.,20-Oct-16,Quiet tranquil best service and not far from Universal
164,1650540346-164,https://www.traveloka.com/id-id/hotel/singapore/resorts-world-sentosa---equarius-hotel-1000000502230?spec=22-04-2022.23-04-2022.1.1.HOTEL.1000000502230.Resorts%20World%20Sentosa%20-%20Equarius%20Hotel.2,,yanthi k. p.,27-May-16,"Overall this hotel is comfortable for who want to get the simple holiday, near from us, waterpark is on backside of the hotel very comfy"
165,1650540346-165,https://www.traveloka.com/id-id/hotel/singapore/resorts-world-sentosa---equarius-hotel-1000000502230?spec=22-04-2022.23-04-2022.1.1.HOTEL.1000000502230.Resorts%20World%20Sentosa%20-%20Equarius%20Hotel.2,,Eko S.,16-May-16,Great hotel for family and pleasure.
166,1650540346-166,https://www.traveloka.com/id-id/hotel/singapore/resorts-world-sentosa---equarius-hotel-1000000502230?spec=22-04-2022.23-04-2022.1.1.HOTEL.1000000502230.Resorts%20World%20Sentosa%20-%20Equarius%20Hotel.2,,Guest-17aome,1-Jan-16,Very strategic hotel. Good breakfast and clean room! Luv it!
167,1650540346-167,https://www.traveloka.com/id-id/hotel/singapore/resorts-world-sentosa---equarius-hotel-1000000502230?spec=22-04-2022.23-04-2022.1.1.HOTEL.1000000502230.Resorts%20World%20Sentosa%20-%20Equarius%20Hotel.2,,Hasan,13-Jun-15,Very nice & comfort hotel in sentosa
169,1650540346-169,https://www.traveloka.com/id-id/hotel/singapore/resorts-world-sentosa---equarius-hotel-1000000502230?spec=22-04-2022.23-04-2022.1.1.HOTEL.1000000502230.Resorts%20World%20Sentosa%20-%20Equarius%20Hotel.2,,Nalada T.,5-Nov-19,"Very good, big room, nice bathroom, clean"
174,1650540346-174,https://www.traveloka.com/id-id/hotel/singapore/resorts-world-sentosa---equarius-hotel-1000000502230?spec=22-04-2022.23-04-2022.1.1.HOTEL.1000000502230.Resorts%20World%20Sentosa%20-%20Equarius%20Hotel.2,,Puspita D.,30-Sep-17,The rooms are spacious. Bathrooms are very spacious. The bathtub is great. Around the hotel is very beautiful. All is ok.
175,1650540346-175,https://www.traveloka.com/id-id/hotel/singapore/resorts-world-sentosa---equarius-hotel-1000000502230?spec=22-04-2022.23-04-2022.1.1.HOTEL.1000000502230.Resorts%20World%20Sentosa%20-%20Equarius%20Hotel.2,,Jon J.,29-Jul-17,"Good hotel, big room, good hotel service, only restaurant service is lacking."
176,1650540346-176,https://www.traveloka.com/id-id/hotel/singapore/resorts-world-sentosa---equarius-hotel-1000000502230?spec=22-04-2022.23-04-2022.1.1.HOTEL.1000000502230.Resorts%20World%20Sentosa%20-%20Equarius%20Hotel.2,,Lim k. h.,27-Jul-17,"Very satisfied to stay at the hotel equarius, our january 2018 will be back again."
177,1650540346-177,https://www.traveloka.com/id-id/hotel/singapore/resorts-world-sentosa---equarius-hotel-1000000502230?spec=22-04-2022.23-04-2022.1.1.HOTEL.1000000502230.Resorts%20World%20Sentosa%20-%20Equarius%20Hotel.2,,iftah a.,19-May-17,"Her nice hotel is cozy and friendly, clean and there is her balcony."
178,1650540346-178,https://www.traveloka.com/id-id/hotel/singapore/resorts-world-sentosa---equarius-hotel-1000000502230?spec=22-04-2022.23-04-2022.1.1.HOTEL.1000000502230.Resorts%20World%20Sentosa%20-%20Equarius%20Hotel.2,,Stephanie,25-Apr-17,"Satisfactory, I stay with my husband and my ank (7months) for booking a deluxe hotel but replaced with deluxe suite, the service is very satisfactory check in."
179,1650540346-179,https://www.traveloka.com/id-id/hotel/singapore/resorts-world-sentosa---equarius-hotel-1000000502230?spec=22-04-2022.23-04-2022.1.1.HOTEL.1000000502230.Resorts%20World%20Sentosa%20-%20Equarius%20Hotel.2,,ANG S. L.,4-Apr-17,"We stayed 2 nights 29-31 March 2017 .. The first impression of his hotel comfortable and nice, clean. The receptionist was also friendly. Minji is also beautiful and good. We are very happy to stay at Equarius .. Our 2 days playing in the sea aquarium and universal. There is a mini van shuttle so there was no trouble and enjoy ..."
