DELIMITER SEPARATION,web-scraper-order,web-scraper-start-url,pagination,user,date,review
53,1650540346-53,https://www.traveloka.com/id-id/hotel/singapore/resorts-world-sentosa---equarius-hotel-1000000502230?spec=22-04-2022.23-04-2022.1.1.HOTEL.1000000502230.Resorts%20World%20Sentosa%20-%20Equarius%20Hotel.2,,Marsya A.,1-Jul-21,Service is superb. Staff all very friendly and helpful. Room is very clean. Spacious.
54,1650540346-54,https://www.traveloka.com/id-id/hotel/singapore/resorts-world-sentosa---equarius-hotel-1000000502230?spec=22-04-2022.23-04-2022.1.1.HOTEL.1000000502230.Resorts%20World%20Sentosa%20-%20Equarius%20Hotel.2,,Rosalind C. S. C.,30-Jun-21,"Everything except the checking in process was great! Nice clean room & very friendly staff. Though need to travel a bit to the main RWS area to have meals or attractions, shuttle or buggy service was only a short wait (within 10 min). However the check in process was very long, wasted 2 hours just waiting to register as there were only 2 counters for normal check in and 2 counters for VIP. It was very tiring wait especially with sleepy young children."
55,1650540346-55,https://www.traveloka.com/id-id/hotel/singapore/resorts-world-sentosa---equarius-hotel-1000000502230?spec=22-04-2022.23-04-2022.1.1.HOTEL.1000000502230.Resorts%20World%20Sentosa%20-%20Equarius%20Hotel.2,,Esther,30-Jun-21,"We were supposed to check out at noon with prior approval from front desk. However we were locked out of the room at 11.15am after we returned from swimming. Drenched in wet swim wear and I waited outside the room when my husband went down to front desk to seek help. It took them 15 minutes at the reception and finally someone accompanied my husband and opened the door. Left with 30 minutes to noon, we had to rush through a quick shower and packing. The staycation surely wasn't a pleasant experience. No one told us that we need to validate the room key when we requested for late check out."
56,1650540346-56,https://www.traveloka.com/id-id/hotel/singapore/resorts-world-sentosa---equarius-hotel-1000000502230?spec=22-04-2022.23-04-2022.1.1.HOTEL.1000000502230.Resorts%20World%20Sentosa%20-%20Equarius%20Hotel.2,,Audrey C.,28-Jun-21,"There was around 30-45min wait during check-in and room were not ready yet at 3pm. Waited for another 30min to get the room key. Awesome room, big and spacious which accommodates 5 of us. They forgot to setup the roll-away bed but a call to concierge before dinner and it was done when we got back. Pool is also great but only limited to 1 spot of 45min only per day. The only disappointing thing is that we couldn't book pool slot for the next day until you have utilized the slots and by the time we call concierge to book no more slots were available. Overall good experience with staffs at Equarius."
57,1650540346-57,https://www.traveloka.com/id-id/hotel/singapore/resorts-world-sentosa---equarius-hotel-1000000502230?spec=22-04-2022.23-04-2022.1.1.HOTEL.1000000502230.Resorts%20World%20Sentosa%20-%20Equarius%20Hotel.2,,Reni Y.,27-Jun-21,"Great place for staycation. Room and bathroom are large and clean. Friendly staff and excellent service. Hotel prepared lovely birthday decoration. As we came to celebrate my birthday. Appreciate it 🙏🏻 We had a good time, especially my daughters. They loved the swimming poll. Definitely will book again for our next staycation. Recommended 👍"
58,1650540346-58,https://www.traveloka.com/id-id/hotel/singapore/resorts-world-sentosa---equarius-hotel-1000000502230?spec=22-04-2022.23-04-2022.1.1.HOTEL.1000000502230.Resorts%20World%20Sentosa%20-%20Equarius%20Hotel.2,,Muhammad S. B. S.,25-Jun-21,We booked the hotel for our honeymoon and love it so much! It's so big and spacious! The toilet is awesome! The staff set up our bed and even personally sign the card to wish us on our marriage. We'll be back soon!
59,1650540346-59,https://www.traveloka.com/id-id/hotel/singapore/resorts-world-sentosa---equarius-hotel-1000000502230?spec=22-04-2022.23-04-2022.1.1.HOTEL.1000000502230.Resorts%20World%20Sentosa%20-%20Equarius%20Hotel.2,,Loh D.,25-Jun-21,"The bad: Arrived at the lobby at 2pm. Waited almost an hour to check in. Waited another 30min to get the key to 1 of our connecting rooms at 3.30pm. Waited for another 1.5hr and after 3 phone calls to collect the key for the other connecting room at 5pm! Tried booking swimming pool timing for 2nd day but the link doesn't help at all. Emailed in and finally managed to get a booking. Check out time indicated on booking is 12pm. However at check in, we were told check out time is at 11am. And they extended till 12pm upon request. On last day when I called the guest services to ask about how to check out. I was told again that my check out time is at 11am. I understand the hotel is shorthanded and needs longer time to do a good disinfection job. However, a 1.5 hour gap between getting the 2 connecting rooms ready doesn't make sense. The Good: Hotel rooms are huge. Bathrooms are huge. Beds are huge. Hotel staff arranged for some simple deco and gifted us some ice cream to celebrate my girl's birthday. Hotel staff are helpful. Swimming pool is simple but pleasant because of the crowd control. Overall a good stay if not for the long wait at check in. It's also inconvenient to travel to other parts of the island unless you drive. Otherwise you will have to take the free shuttle service, walk 5min to sentosa express."
60,1650540346-60,https://www.traveloka.com/id-id/hotel/singapore/resorts-world-sentosa---equarius-hotel-1000000502230?spec=22-04-2022.23-04-2022.1.1.HOTEL.1000000502230.Resorts%20World%20Sentosa%20-%20Equarius%20Hotel.2,,LOW W. L.,24-Jun-21,"Booked Check-in slot at 2-2.59pm, the whole check-in process took less than 15mins. I was served by Gregory, he was full of smiles and I was very pleased to be allocated a room on the 7th floor facing the watercove park. The view was spectacular, I could see the cable cars from the balcony and hear birds chirping away in the morning. Taking the shuttle bus to the Casino area was hassle-free. The swimming pool is a short walk away at the beach villa. Booking in advance is required for swimming session, since they limit the no. Of pax at the pool, it was not crowded at all. I like this hotel as it is tugged away from the crowded area at the Casino. I had a pleasant stay and will definitely choose this hotel for my next staycation at Sentosa 👍"
61,1650540346-61,https://www.traveloka.com/id-id/hotel/singapore/resorts-world-sentosa---equarius-hotel-1000000502230?spec=22-04-2022.23-04-2022.1.1.HOTEL.1000000502230.Resorts%20World%20Sentosa%20-%20Equarius%20Hotel.2,,Koo S.,24-Jun-21,"1. Check-in took a long time. 2. We have set our room as ""Do not disturb"" and went out for dinner. However we can still see the hotel staff delivered drinks and towels into our room."
62,1650540346-62,https://www.traveloka.com/id-id/hotel/singapore/resorts-world-sentosa---equarius-hotel-1000000502230?spec=22-04-2022.23-04-2022.1.1.HOTEL.1000000502230.Resorts%20World%20Sentosa%20-%20Equarius%20Hotel.2,,Sharon L.,22-Jun-21,"Overall experience was good but it would be truly awesome if we didn’t take that long to check-in. We waited for an hour from queue in the lobby to no queue. Finally someone approached us again after our countless checks with the reception whether our rooms are ready. It seems we have asked for adjoining rooms during our booking and it May not have gotten registered though their was an acknowledgment given. Housekeeping was still cleaning up the rooms. We were than put in a holding room while waiting for the rooms after another 20 mins check between reception and housekeeping. Nonetheless we appreciated the efforts. When we finally got to the rooms, one of the rooms smelled funny and I hope it was not becos we had rushed them for the housekeeping and they didn’t manage to do a thorough job. However this is our second visit to the hotel because we have like it from our first visit. Hope they can look into these improvement to make the experience truly awesome."
63,1650540346-63,https://www.traveloka.com/id-id/hotel/singapore/resorts-world-sentosa---equarius-hotel-1000000502230?spec=22-04-2022.23-04-2022.1.1.HOTEL.1000000502230.Resorts%20World%20Sentosa%20-%20Equarius%20Hotel.2,,SERENE T.,21-Jun-21,"1. Check-in took really long. Was scheduled to check-in from 2 to 3 pm. Got there at 2.10 pm, and was asked to queue (there were only 2 pax before us) but we waited more than 15 min. Tried self check-in but doesn't work. The funny thing is, the day we checked out, I saw people checking in at 12ish. I wonder why were they given such early check-in but my request was declined. Probably need to upgrade their self check-in system as well. 2. Swimming pool ""security "" has different standards. They really need to have some standards here. Besides these two hiccups, the stay was generally good and relaxing."
64,1650540346-64,https://www.traveloka.com/id-id/hotel/singapore/resorts-world-sentosa---equarius-hotel-1000000502230?spec=22-04-2022.23-04-2022.1.1.HOTEL.1000000502230.Resorts%20World%20Sentosa%20-%20Equarius%20Hotel.2,,Ho Joo H. E.,16-Jun-21,"Room was really huge. Pool was not fantastic, maybe because of all the fallen leaves and algae-plagued sun loungers. Hotel was clearly understaffed, we had to queue and wait quite a while before the only two staff in the whole reception area could attend to us, probably because the self-check-in machine could not detect lots of bookings. Understand that it’s covid season so checking in and out is crucial, however when we had to go swimming, we did not bring anything with us and we’re stranded with staff insisting that we need the physical ID or soft copy on our phones. We had checked in earlier and staff at the entrance had laptops with all our names and details, unsure why they couldn’t check their and than. Unpleasant experience for that. I would say the staff are courteous but hotel management was not good."
65,1650540346-65,https://www.traveloka.com/id-id/hotel/singapore/resorts-world-sentosa---equarius-hotel-1000000502230?spec=22-04-2022.23-04-2022.1.1.HOTEL.1000000502230.Resorts%20World%20Sentosa%20-%20Equarius%20Hotel.2,,Nur S.,9-Jun-21,Best Staycation ever. All the staff are so friendly. We were here to celebrate our honeymoon and got a complimentary ben and jerry ice cream as a treat!
66,1650540346-66,https://www.traveloka.com/id-id/hotel/singapore/resorts-world-sentosa---equarius-hotel-1000000502230?spec=22-04-2022.23-04-2022.1.1.HOTEL.1000000502230.Resorts%20World%20Sentosa%20-%20Equarius%20Hotel.2,,Rez H.,4-Jun-21,Spacious room. Great view. Friendly staff. Easy check-in. Big pool.
67,1650540346-67,https://www.traveloka.com/id-id/hotel/singapore/resorts-world-sentosa---equarius-hotel-1000000502230?spec=22-04-2022.23-04-2022.1.1.HOTEL.1000000502230.Resorts%20World%20Sentosa%20-%20Equarius%20Hotel.2,,Nami I.,3-Jun-21,Room is spacious. Good for family getaway.
68,1650540346-68,https://www.traveloka.com/id-id/hotel/singapore/resorts-world-sentosa---equarius-hotel-1000000502230?spec=22-04-2022.23-04-2022.1.1.HOTEL.1000000502230.Resorts%20World%20Sentosa%20-%20Equarius%20Hotel.2,,Banu C.,3-Jun-21,"The room was spacious and beautiful. My partner and I truly enjoyed our little getaway. Special mentions to Jaysen (apologies if I got his name wrong) who checked us in. It’s really convenient despite it being quite a distance away from the attractions, due to the frequent shuttle buses and the buggy service. Only downside was that there isn’t a bidet in the otherwise amazing room ☹️"
69,1650540346-69,https://www.traveloka.com/id-id/hotel/singapore/resorts-world-sentosa---equarius-hotel-1000000502230?spec=22-04-2022.23-04-2022.1.1.HOTEL.1000000502230.Resorts%20World%20Sentosa%20-%20Equarius%20Hotel.2,,sam,1-Jun-21,"Though check-in can be a little slow now due to covid but I understand that it is for safety purposes 👍🏼 Service was nevertheless great, room was very neat and clean upon check-in. I loved how they have a sticker to indicate that the room had been disinfected and cleaned for us to check-in on our first day. The hotel really made me feel safe with all the safety protocols imposed."
70,1650540346-70,https://www.traveloka.com/id-id/hotel/singapore/resorts-world-sentosa---equarius-hotel-1000000502230?spec=22-04-2022.23-04-2022.1.1.HOTEL.1000000502230.Resorts%20World%20Sentosa%20-%20Equarius%20Hotel.2,,Fiona L.,26-May-21,Staff were very welcoming and friendly and made our staycation enjoyable throughout. Room is clean and spacious.
71,1650540346-71,https://www.traveloka.com/id-id/hotel/singapore/resorts-world-sentosa---equarius-hotel-1000000502230?spec=22-04-2022.23-04-2022.1.1.HOTEL.1000000502230.Resorts%20World%20Sentosa%20-%20Equarius%20Hotel.2,,Koh W. S.,26-May-21,"Quite a bad experience with this hotel, 1) Have sent request to this hotel for early check in at 2pm but they were late and informed that this early check in means I can come to hotel at 2pm to wait. 2) I have booked the hotel stay and basis app, it was mentioned that the check out time is 12pm but this hotel informed that the supposed check out time is 11am but they are giving us a favour to check out at 12pm. Overall quite a bad experience with this hotel and will not stay here anymore."
72,1650540346-72,https://www.traveloka.com/id-id/hotel/singapore/resorts-world-sentosa---equarius-hotel-1000000502230?spec=22-04-2022.23-04-2022.1.1.HOTEL.1000000502230.Resorts%20World%20Sentosa%20-%20Equarius%20Hotel.2,,Geraldine H.,25-May-21,The room is very spacious and the bathtub is huge. We manage to get a slightly later check out since it’s quite quiet.
73,1650540346-73,https://www.traveloka.com/id-id/hotel/singapore/resorts-world-sentosa---equarius-hotel-1000000502230?spec=22-04-2022.23-04-2022.1.1.HOTEL.1000000502230.Resorts%20World%20Sentosa%20-%20Equarius%20Hotel.2,,Esther K. H. M.,22-May-21,"unorganized check-in process, be prepared to wait up to an hour. pool was pretty nice, but loads of mosquitos. be prepared to bring insecticide spray."
74,1650540346-74,https://www.traveloka.com/id-id/hotel/singapore/resorts-world-sentosa---equarius-hotel-1000000502230?spec=22-04-2022.23-04-2022.1.1.HOTEL.1000000502230.Resorts%20World%20Sentosa%20-%20Equarius%20Hotel.2,,Muhammad H. B. R.,21-May-21,Spacious room! The kids loved it. Friendly and helpful staff! Convenient buggy rides to RWS. Booking of swimming pool slots was a breeze. Thank you for the pleasant stay!
75,1650540346-75,https://www.traveloka.com/id-id/hotel/singapore/resorts-world-sentosa---equarius-hotel-1000000502230?spec=22-04-2022.23-04-2022.1.1.HOTEL.1000000502230.Resorts%20World%20Sentosa%20-%20Equarius%20Hotel.2,,Liang Z. M.,21-May-21,"The rooms were really good, but due to covid there were a lot of restrictions. We came as an extended family of 8 but could not go to each other’s rooms unless we were registered in each room which was way too troublesome. And breakfast was at Hotel Michael which required a buggy ride over. Sigh, it took us more than a year to finally be able to arrange this staycation together, but it was such a frustrating experience. Can’t blame the hotel, but damn Covid!"
76,1650540346-76,https://www.traveloka.com/id-id/hotel/singapore/resorts-world-sentosa---equarius-hotel-1000000502230?spec=22-04-2022.23-04-2022.1.1.HOTEL.1000000502230.Resorts%20World%20Sentosa%20-%20Equarius%20Hotel.2,,Lim A.,21-May-21,"Had my 4D3N honeymoon with my hubby at Equarius Hotel and we enjoyed our peaceful, quality time here despite the covid situation. Really love the spacious and clean deluxe room, and their bathroom is amazingly huge and pretty with a bathtub! The only downside is that the pre-packed breakfast served every morning due to the ""no dining in"" rule was really disappointing. The quality of the food was really bad, with the bacon always being overly salty, and the scrambled eggs being overcooked and mushy, the baked pastries tasted stale as well. Hope that the hotel will be able to do something about the breakfast since the prices include free hotel breakfast (which was supposed to be of quality standard before the ""no dine in"" rule. Otherwise, can opt for no breakfast during this period of time and just go for the rooms!"
77,1650540346-77,https://www.traveloka.com/id-id/hotel/singapore/resorts-world-sentosa---equarius-hotel-1000000502230?spec=22-04-2022.23-04-2022.1.1.HOTEL.1000000502230.Resorts%20World%20Sentosa%20-%20Equarius%20Hotel.2,,Teh Y. Y.,20-May-21,My stay at Equarius hotel was memorable! Check in was smooth and easy and buggy service to and fro Sentosa RWS was convenient. The room is big with a sofa and round table for dining inside. Overall it is a relaxing and comfortable stay at Equarius hotel and thanks to the service staff that made it possible!
78,1650540346-78,https://www.traveloka.com/id-id/hotel/singapore/resorts-world-sentosa---equarius-hotel-1000000502230?spec=22-04-2022.23-04-2022.1.1.HOTEL.1000000502230.Resorts%20World%20Sentosa%20-%20Equarius%20Hotel.2,,Lim H. S. A. G.,20-May-21,"Room was very clean and spacious, better than expected. The staff were rly nice as well"
79,1650540346-79,https://www.traveloka.com/id-id/hotel/singapore/resorts-world-sentosa---equarius-hotel-1000000502230?spec=22-04-2022.23-04-2022.1.1.HOTEL.1000000502230.Resorts%20World%20Sentosa%20-%20Equarius%20Hotel.2,,Matt C.,18-May-21,"Big room. Normal deco. No in-house services. Have to travel for food, entertainment etc. Nothing interesting in hotel. Have to walk a long distance from lobby to lift to rooms."
80,1650540346-80,https://www.traveloka.com/id-id/hotel/singapore/resorts-world-sentosa---equarius-hotel-1000000502230?spec=22-04-2022.23-04-2022.1.1.HOTEL.1000000502230.Resorts%20World%20Sentosa%20-%20Equarius%20Hotel.2,,Kathryn T.,15-May-21,"I really enjoyed the room, the bathroom has a huge bathtub which can fit two people comfortably. However, there are no bath salts provided, you will have to get your own. The amenities provided are 2-in-1 hand & body wash and 2-in-1 conditioning shampoo. The balcony has a great view of the cable car, beautiful especially in the evening. I spent a lot of time sitting outside to relax with some drinks. There is no room services options at all, you have to get your own food, or order via food delivery. The nearest food options are at Hotel Michael, which is a 5 minutes shuttle bus away. I gave this hotel overall unsatisfactory as the check in was not smooth and coordinated from the start. Upon booking, my requests for early check-in at 12pm was acknowledged by the hotel. I understand that it is still subject to availability but on the day itself, even when I arrived at 2:30pm, I can only check in at 3:30pm. I was given a queue number to wait for check-in. After 15-20 minutes, I was attended by Eugene which brought me to a self check-in station. I faced some issues with registration as they could not find my Booking ID, but when I eventually finished registration, I was told to wait to receive a SMS when my room is ready. The weather was really hot, I was thirsty and I just wanted to check in already. After 30-40 minutes, my room key is finally ready for collection. I asked for directions on where to collect, and was told to go to the concierge. When I went to the concierge, the staff told me to go the check-in area. (?) I had to walk around with my heavy bag for another 10 minutes because the staffs were directing me everywhere. When I finally check in, my partner which was sharing the room with me, said that I had to go down and pick him. Yet earlier, the hotel staff Eugene had informed that once I registered a room guest, I do not have to go down and pick them. They can self-check in upon arrival and be given a room key. After finally being able to check-in, I went down to pick up my partner. All these poor communication led to a very unsatisfactory check-in experience. I understand that we have to be extra vigilant during this covid period, however I did not face such frustration at other 5 stars hotels. I hope they can improve on their staff communication and check-in procedure. Besides that, I would still recommend this hotel as a great getaway due to its location."
81,1650540346-81,https://www.traveloka.com/id-id/hotel/singapore/resorts-world-sentosa---equarius-hotel-1000000502230?spec=22-04-2022.23-04-2022.1.1.HOTEL.1000000502230.Resorts%20World%20Sentosa%20-%20Equarius%20Hotel.2,,Janice L.,15-May-21,"Thank you to the team @ Equarius hotel for the great hospitality. From the moment we checked in, service was impeccable. It was little #JEO ‘s 4th birthday celebration and he had requested for a “hotel stay” (kids these days!) and so when Ms Jesslyn at the front desk knew about this, she gifted us with gifts for the little ones. #JEO was over the moon to have not 1 but 4 ice cream cups to start off his holiday! The staff were so attentive and we must applaud Ariel who was always greeting us with a smile - in spite of the mask, we knew he was always smiling from the spring in his step and the chirpiness of his voice. We met so many lovely guests too at the hotel - one of the families even gifted #JEO with his first cable car figurine as a birthday gift! We were really amazed at the sheer size of the room - 51 sq m was a great amount of space for 2 young kiddos to play and roam around! The size of the bathroom was perfect too! The only gripe we may have would be a suggestion for the hotel to include / provide bath amenities for young children / infants? You guys had a baby bath tub and a cot but didn’t have any bathing amenities for kids! This was a first I’ve encountered for a local staycation - even business hotels we’ve stayed in had amenities for children. Nonetheless, it was otherwise a very very lovely stay for us, glad we had a good time before CB- lite commences. Thank you Ms Jesslyn and your team for being ever attentive to us. Even the operator was always so delightful to talk to. From front desk to housekeeping, we had so many different encounters with the lovely hospitality team. So kudos to the management for incorporating a culture that percolates genuine happiness from the bottom up so we would enjoy our stay as guests."
82,1650540346-82,https://www.traveloka.com/id-id/hotel/singapore/resorts-world-sentosa---equarius-hotel-1000000502230?spec=22-04-2022.23-04-2022.1.1.HOTEL.1000000502230.Resorts%20World%20Sentosa%20-%20Equarius%20Hotel.2,,Megdeleine L.,14-May-21,Good service provided by the front desk and housekeeping staff. They are very polite and consistently reminded us on safety measures to abide to during the stay in their hotel. Hotel room is spacious and clean. Will definitely recommend by friends and relatives.
83,1650540346-83,https://www.traveloka.com/id-id/hotel/singapore/resorts-world-sentosa---equarius-hotel-1000000502230?spec=22-04-2022.23-04-2022.1.1.HOTEL.1000000502230.Resorts%20World%20Sentosa%20-%20Equarius%20Hotel.2,,Wendy L.,14-May-21,So far one of the best hotel i've stayed in. Would love to have another stay if I have the chance.
84,1650540346-84,https://www.traveloka.com/id-id/hotel/singapore/resorts-world-sentosa---equarius-hotel-1000000502230?spec=22-04-2022.23-04-2022.1.1.HOTEL.1000000502230.Resorts%20World%20Sentosa%20-%20Equarius%20Hotel.2,,Yvonne L.,13-May-21,Great experience with Equarius! The room is very spacious with good views 😊 The frequent shuttle bus service makes it very convenient to travel between the forum and the hotel.
85,1650540346-85,https://www.traveloka.com/id-id/hotel/singapore/resorts-world-sentosa---equarius-hotel-1000000502230?spec=22-04-2022.23-04-2022.1.1.HOTEL.1000000502230.Resorts%20World%20Sentosa%20-%20Equarius%20Hotel.2,,Wong L. S.,13-May-21,"The hotel is of high standard in terms of cleanliness and services. The place is close to natural, ideal for honey moon or stay away from the city. The package deal is value for money including dinner and breakfast. The swimming pool is so nice . We enjoyed our stay."
86,1650540346-86,https://www.traveloka.com/id-id/hotel/singapore/resorts-world-sentosa---equarius-hotel-1000000502230?spec=22-04-2022.23-04-2022.1.1.HOTEL.1000000502230.Resorts%20World%20Sentosa%20-%20Equarius%20Hotel.2,,Sim E. T.,13-May-21,Good experience. Staff friendly and patient. Free parking could have been better expanded to cover parking within all of Resorts World Sentosa
87,1650540346-87,https://www.traveloka.com/id-id/hotel/singapore/resorts-world-sentosa---equarius-hotel-1000000502230?spec=22-04-2022.23-04-2022.1.1.HOTEL.1000000502230.Resorts%20World%20Sentosa%20-%20Equarius%20Hotel.2,,Teo H. S.,13-May-21,Everything was good at the hotel. The management acknowledged to my early check in and late check out request. Only feedback is the bathtub in room 0438 keeps leaking and my bathtub can never be full.
88,1650540346-88,https://www.traveloka.com/id-id/hotel/singapore/resorts-world-sentosa---equarius-hotel-1000000502230?spec=22-04-2022.23-04-2022.1.1.HOTEL.1000000502230.Resorts%20World%20Sentosa%20-%20Equarius%20Hotel.2,,Clarence C.,11-May-21,"Pros: Rooms are really big and comfy, shuttle buses to other entertainments, the rooms are sanitized (feeling safe) Cons: Need to travel out to other entertainments, no toiletries for kids. no snacks for kids, some dust can be found on the bed headboard, bathroom tv not working, required to travel out for the free breakfast Overall: still happy with our stay with Equarius Hotel and will definitely come back again despite of the minor issues."
89,1650540346-89,https://www.traveloka.com/id-id/hotel/singapore/resorts-world-sentosa---equarius-hotel-1000000502230?spec=22-04-2022.23-04-2022.1.1.HOTEL.1000000502230.Resorts%20World%20Sentosa%20-%20Equarius%20Hotel.2,,Pok Y.,11-May-21,Friendly staffs and willing to assist whenever needed. Awesome stay and strongly recommended to friends.
