DELIMITER SEPARATION,web-scraper-order,web-scraper-start-url,pagination,user,date,review
1,1650540346-1,https://www.traveloka.com/id-id/hotel/singapore/resorts-world-sentosa---equarius-hotel-1000000502230?spec=22-04-2022.23-04-2022.1.1.HOTEL.1000000502230.Resorts%20World%20Sentosa%20-%20Equarius%20Hotel.2,,Maia S. F.,30-Mar-22,ik.imagekit.io
2,1650540346-2,https://www.traveloka.com/id-id/hotel/singapore/resorts-world-sentosa---equarius-hotel-1000000502230?spec=22-04-2022.23-04-2022.1.1.HOTEL.1000000502230.Resorts%20World%20Sentosa%20-%20Equarius%20Hotel.2,,Chew B. T.,14-Sep-21,ik.imagekit.io
3,1650540346-3,https://www.traveloka.com/id-id/hotel/singapore/resorts-world-sentosa---equarius-hotel-1000000502230?spec=22-04-2022.23-04-2022.1.1.HOTEL.1000000502230.Resorts%20World%20Sentosa%20-%20Equarius%20Hotel.2,,Ratna F. Y.,17-Jul-21,ik.imagekit.io
4,1650540346-4,https://www.traveloka.com/id-id/hotel/singapore/resorts-world-sentosa---equarius-hotel-1000000502230?spec=22-04-2022.23-04-2022.1.1.HOTEL.1000000502230.Resorts%20World%20Sentosa%20-%20Equarius%20Hotel.2,,Quek H. C.,20-Mar-21,ik.imagekit.io
5,1650540346-5,https://www.traveloka.com/id-id/hotel/singapore/resorts-world-sentosa---equarius-hotel-1000000502230?spec=22-04-2022.23-04-2022.1.1.HOTEL.1000000502230.Resorts%20World%20Sentosa%20-%20Equarius%20Hotel.2,,Stephanie,13-Dec-19,Breakfast kurang variatif. Cek in jam 15.30 sore katanya kamarnya full. Pelayan receptionist kurang ramah.
6,1650540346-6,https://www.traveloka.com/id-id/hotel/singapore/resorts-world-sentosa---equarius-hotel-1000000502230?spec=22-04-2022.23-04-2022.1.1.HOTEL.1000000502230.Resorts%20World%20Sentosa%20-%20Equarius%20Hotel.2,,Rina A. P.,1-Dec-19,ik.imagekit.io
7,1650540346-7,https://www.traveloka.com/id-id/hotel/singapore/resorts-world-sentosa---equarius-hotel-1000000502230?spec=22-04-2022.23-04-2022.1.1.HOTEL.1000000502230.Resorts%20World%20Sentosa%20-%20Equarius%20Hotel.2,,Susy,18-May-19,Cocok untuk keluarga dan bawa anak. Cuma ga gitu banyak fasilitas.
8,1650540346-8,https://www.traveloka.com/id-id/hotel/singapore/resorts-world-sentosa---equarius-hotel-1000000502230?spec=22-04-2022.23-04-2022.1.1.HOTEL.1000000502230.Resorts%20World%20Sentosa%20-%20Equarius%20Hotel.2,,Denry j.,16-Oct-18,"Hotel sangat baik, bersih, staf ramah dan sangat membantu."
9,1650540346-9,https://www.traveloka.com/id-id/hotel/singapore/resorts-world-sentosa---equarius-hotel-1000000502230?spec=22-04-2022.23-04-2022.1.1.HOTEL.1000000502230.Resorts%20World%20Sentosa%20-%20Equarius%20Hotel.2,,Indrayani G.,22-Aug-18,"Kamar luas, staf hotel betul-betul sangat membantu dan ramah."
10,1650540346-10,https://www.traveloka.com/id-id/hotel/singapore/resorts-world-sentosa---equarius-hotel-1000000502230?spec=22-04-2022.23-04-2022.1.1.HOTEL.1000000502230.Resorts%20World%20Sentosa%20-%20Equarius%20Hotel.2,,Teng V. R. H.,30-Mar-18,"Kamar hotel beserta kamar mandinya,sangat sangat luas.Pemandangan luar kamar juga indah. Staff ramah.Kebetulan anak saya berulang tahun dan kami mendapatkan cake birthday yang rasanya enak.Hanya sayang, lokasi jauh dari universal studio dan harus menggunakan free shutte bus dari resort world sentosa.Tapi overall,menyenangkan menginap di hotel ini"
11,1650540346-11,https://www.traveloka.com/id-id/hotel/singapore/resorts-world-sentosa---equarius-hotel-1000000502230?spec=22-04-2022.23-04-2022.1.1.HOTEL.1000000502230.Resorts%20World%20Sentosa%20-%20Equarius%20Hotel.2,,Joel W. S.,18-Jan-22,"While the room and bathroom are big (with super king bed), the services are rather standard and below what we expect. From the front desk to the restaurant where the breakfast is, we don't feel the hospitality standard expected for this kind of 5 star hotel. The breakfast is also below standard, with only local, western, and vegetarian sets. Seems like just to tick the box. Below average again. Certainly not worth the money."
12,1650540346-12,https://www.traveloka.com/id-id/hotel/singapore/resorts-world-sentosa---equarius-hotel-1000000502230?spec=22-04-2022.23-04-2022.1.1.HOTEL.1000000502230.Resorts%20World%20Sentosa%20-%20Equarius%20Hotel.2,,LIN J.,10-Jan-22,Check in was smooth. Room and pool were great. What is inconvenient is the long walking to the rooms just because of the ID check that needs to be performed. Easily 100 m extra per trip.
13,1650540346-13,https://www.traveloka.com/id-id/hotel/singapore/resorts-world-sentosa---equarius-hotel-1000000502230?spec=22-04-2022.23-04-2022.1.1.HOTEL.1000000502230.Resorts%20World%20Sentosa%20-%20Equarius%20Hotel.2,,Brenda H.,10-Jan-22,"I was rather frustrated by the long wait for check in. The kiosks provided were hard to use. However, everything was lovely after that. Responsive and friendly staff. My children enjoyed the staycation very much and we are definitely going back soon."
14,1650540346-14,https://www.traveloka.com/id-id/hotel/singapore/resorts-world-sentosa---equarius-hotel-1000000502230?spec=22-04-2022.23-04-2022.1.1.HOTEL.1000000502230.Resorts%20World%20Sentosa%20-%20Equarius%20Hotel.2,,Yeow H. Y. F.,10-Jan-22,"Had a fantastic stay with my family, and would definitely consider coming back again. Check-in was relatively simple, even at the self-check in machine, with the help of the staff, and the rooms are spacious and bright. Had indicated previously our preference for a high level, forest-facing room which the hotel easily accommodated, and we had a fantastic view of the cable cars amidst the rainforest. And the toilet is an experience in itself, with a great big bathtub and rain shower. Swimming pool had to be booked but was lovely and unique with resort feels as well. There's also a free shuttle bus which which brings you to the main RWS area and back, and is available till nighttime. Check out was even faster and just required returning the key cards. Do remember to approach the counter staff to get the complimentary parking coupon though. Cheers to all the staff who are always helpful, and who made our staycay even with older parents easy and pleasant."
15,1650540346-15,https://www.traveloka.com/id-id/hotel/singapore/resorts-world-sentosa---equarius-hotel-1000000502230?spec=22-04-2022.23-04-2022.1.1.HOTEL.1000000502230.Resorts%20World%20Sentosa%20-%20Equarius%20Hotel.2,,Alan c.,10-Jan-22,"A good choice for quiet retreat, not crowded. The staff are friendly and helpful to give advice to various attractions on the island. The downside is the lack of facilities such as spa and limit choice of restaurants (a bit expensive though). There is free transfer every 10 mins to RWS."
16,1650540346-16,https://www.traveloka.com/id-id/hotel/singapore/resorts-world-sentosa---equarius-hotel-1000000502230?spec=22-04-2022.23-04-2022.1.1.HOTEL.1000000502230.Resorts%20World%20Sentosa%20-%20Equarius%20Hotel.2,,Marie M.,8-Jan-22,It was cumbersome to scan safe entry at the poolside since we have already booked the slot. It doesn't make sense to us as we have already registered ourselves with the hotel. We didn't feel safe to bring our phone to the poolside and leave it unattended.
17,1650540346-17,https://www.traveloka.com/id-id/hotel/singapore/resorts-world-sentosa---equarius-hotel-1000000502230?spec=22-04-2022.23-04-2022.1.1.HOTEL.1000000502230.Resorts%20World%20Sentosa%20-%20Equarius%20Hotel.2,,Amanda L.,3-Jan-22,"It was a good experience as our requests were all met. RWS staffs are attentive and delivered their service as promised. It 's a pity that it rained for both days and did not get to enjoy the pool. But is all good with the excellent service, will definitely return again. The festive package was such a deal that includes table65 Michelin star award winning restaurant."
18,1650540346-18,https://www.traveloka.com/id-id/hotel/singapore/resorts-world-sentosa---equarius-hotel-1000000502230?spec=22-04-2022.23-04-2022.1.1.HOTEL.1000000502230.Resorts%20World%20Sentosa%20-%20Equarius%20Hotel.2,,Christaline S.,25-Dec-21,"1. Self-service check-in is not at all user-friendly, even their staff started arguing among themselves while trying to assist.  2. Booking of check-in time and pool prior to checking in to the hotel could be easily missed/ overlooked. By the time when I heard from a friend who has recently stayed at the same hotel, that I need to pre-book the use of the pool before checking-in, the only available timeslot was at 11am the following day and check out time was 11am. Most hotels are granting late check out at 3 pm onward for staycation.  3. We were so looking forward to the hotel breakfast and we got the worst shock of our life when we saw the breakfast menu. If the hotel cannot serve a buffet breakfast, they should at least serve a decent a la carte buffet breakfast. The Chinese set breakfast was a disgrace. Bland white porridge with a few pcs of cuttlefish, 2 pcs of shrimps, and crabsticks for hotel standard seafood porridge. We had staycation experience in other hotels and so far, this is our worst experience. Glad that we only stayed one night. For more than $600 per room per night for this kind of experience really sucks!"
19,1650540346-19,https://www.traveloka.com/id-id/hotel/singapore/resorts-world-sentosa---equarius-hotel-1000000502230?spec=22-04-2022.23-04-2022.1.1.HOTEL.1000000502230.Resorts%20World%20Sentosa%20-%20Equarius%20Hotel.2,,Leow L. L. C.,21-Dec-21,The room is spacious and clean.
20,1650540346-20,https://www.traveloka.com/id-id/hotel/singapore/resorts-world-sentosa---equarius-hotel-1000000502230?spec=22-04-2022.23-04-2022.1.1.HOTEL.1000000502230.Resorts%20World%20Sentosa%20-%20Equarius%20Hotel.2,,Gwendolin g.,16-Dec-21,Love the room. Its super spacious and the toilet is awesomely huge as well. The view is super awesome. But check in procedures were too long. I reached at 1plus and room was only ready at 5.30pm! Didn't have a coffee machine so quite dissappointing for a 5 star hotel.
21,1650540346-21,https://www.traveloka.com/id-id/hotel/singapore/resorts-world-sentosa---equarius-hotel-1000000502230?spec=22-04-2022.23-04-2022.1.1.HOTEL.1000000502230.Resorts%20World%20Sentosa%20-%20Equarius%20Hotel.2,,Yeo H. S.,12-Dec-21,Staffs were helpful and polite. Only that unable to get connecting rooms.
22,1650540346-22,https://www.traveloka.com/id-id/hotel/singapore/resorts-world-sentosa---equarius-hotel-1000000502230?spec=22-04-2022.23-04-2022.1.1.HOTEL.1000000502230.Resorts%20World%20Sentosa%20-%20Equarius%20Hotel.2,,Celine,14-Nov-21,"1) We arranged for early check in and bed arrangement months before check in. Upon arrival at the hotel, however, we were informed that the rooms were not ready and we had to inform the staff again on our bed arrangement. We also requested for rooms on high floor but in the end, I believe we were given rooms on low floor as those were the only ones that were available after at least a 30 minutes at the check in process. 2) Our request for special arrangement for my dad's birthday was not delivered to the front desk as well. In the end, we only got a card and a few Ferraro Rochers (which seems like a last minute work) when we were expecting more from a 5-star hotel. 3) We also made prior pool reservation but when we checked with the staff working at the pool, our reservation was not recorded. 4) Towels and water were not provided for the third person staying in the room after housekeeping on the second day. All these made our stay at the hotel unpleasant. We were hoping for more from a 5-star hotel."
23,1650540346-23,https://www.traveloka.com/id-id/hotel/singapore/resorts-world-sentosa---equarius-hotel-1000000502230?spec=22-04-2022.23-04-2022.1.1.HOTEL.1000000502230.Resorts%20World%20Sentosa%20-%20Equarius%20Hotel.2,,Chng S. B.,7-Nov-21,"The room is very big, spacious and comfy, we enjoyed the stay there regardless the delayed check in time. We will not hesitate to stay at Equarius Hotel again for our next staycation. Cheers!"
24,1650540346-24,https://www.traveloka.com/id-id/hotel/singapore/resorts-world-sentosa---equarius-hotel-1000000502230?spec=22-04-2022.23-04-2022.1.1.HOTEL.1000000502230.Resorts%20World%20Sentosa%20-%20Equarius%20Hotel.2,,Song K. w.,3-Nov-21,"Equarius has a spacious room. We felt so cosy staying in it. The balcony overlooking nature and the trees was love at first sight. We went during the halloween period and we can see a lot of places with halloween themed decorations. Service staff was great and served with a smile and light hearted jokes. Definitely would return to visit, so far the best hotel we've been in, in Sentosa"
25,1650540346-25,https://www.traveloka.com/id-id/hotel/singapore/resorts-world-sentosa---equarius-hotel-1000000502230?spec=22-04-2022.23-04-2022.1.1.HOTEL.1000000502230.Resorts%20World%20Sentosa%20-%20Equarius%20Hotel.2,,Lin J.,30-Oct-21,"The room looks so spacious, comfortable and grand. It makes one want to stay in the room all day. Perfect for families or a couple getaway! PSA: Bring Bubble Bath! Shuttle service are available every 15 minutes to bring you to hotel Michael! Or you can take a stroll along the outdoor path which is about close to 10 minutes too."
26,1650540346-26,https://www.traveloka.com/id-id/hotel/singapore/resorts-world-sentosa---equarius-hotel-1000000502230?spec=22-04-2022.23-04-2022.1.1.HOTEL.1000000502230.Resorts%20World%20Sentosa%20-%20Equarius%20Hotel.2,,Triana R. B. R.,30-Oct-21,"Check I/O could have been a better process. We were coming from the carpark so when we entered the lobby there was no specific instructions or a line to show us the way for check in. People seen sitting on the sofas some were lining up at the front desk. The machine to check in wasn't able to detect booking either So the staff had to eventually help me out manually. But can I say that the staff were extremely patient and so kind despite the busy peak hours. Very polite and whenever we called for assistance from the room, the service came within 5 minutes. The room was so big as well! Amazing view facing Harbourfront! Breakfast isn't buffet style but there ' s a menu for you to choose the mains. Keep in mind that the restaurant is not in Equarius OK! You gotta take the cute buggy at the entrance and they'll bring you to the other hotel. Love the ride, I think its super worth it. Highly highly recommend! Especially for family, would definitely come again. A huge shout out to the staff for making the stay fabulous 👍🏽."
27,1650540346-27,https://www.traveloka.com/id-id/hotel/singapore/resorts-world-sentosa---equarius-hotel-1000000502230?spec=22-04-2022.23-04-2022.1.1.HOTEL.1000000502230.Resorts%20World%20Sentosa%20-%20Equarius%20Hotel.2,,Foo M. Y.,23-Oct-21,The staff there are very helpful regardless check in or check out! We check out going to sea aquarium first and they helped to send the luggage to hotel Michael so we don't have to come back here to collect. They also drew a birthday card for my dad as it was his birthday and also my sis came after her wedding and they drew her a very cute card with blessing with chocolate. The rooms are very comfy and the tub is very big! Enjoyed our stay very much.
28,1650540346-28,https://www.traveloka.com/id-id/hotel/singapore/resorts-world-sentosa---equarius-hotel-1000000502230?spec=22-04-2022.23-04-2022.1.1.HOTEL.1000000502230.Resorts%20World%20Sentosa%20-%20Equarius%20Hotel.2,,Foo M. K.,22-Oct-21,Very comfortable and customer service was great. Will definitely come and stay again!
29,1650540346-29,https://www.traveloka.com/id-id/hotel/singapore/resorts-world-sentosa---equarius-hotel-1000000502230?spec=22-04-2022.23-04-2022.1.1.HOTEL.1000000502230.Resorts%20World%20Sentosa%20-%20Equarius%20Hotel.2,,Rin E. b. R.,19-Oct-21,"All the staff were amazing and patient, rooms were super huge! Fantastic service. The only downside was during check-in, their check-in machines could not detect our booking as it was from the agent app, hence the wait was slightly longer. But again the staff made up for it, hence wonderful stay!"
30,1650540346-30,https://www.traveloka.com/id-id/hotel/singapore/resorts-world-sentosa---equarius-hotel-1000000502230?spec=22-04-2022.23-04-2022.1.1.HOTEL.1000000502230.Resorts%20World%20Sentosa%20-%20Equarius%20Hotel.2,,Tay B. K. R.,12-Oct-21,"Check in was terrible. Self check in fail, have to take queue to check in counter. And only 1 check in counter. The SDA serving the self checking also blur. Only the hotel staff Kevin is helpful. As for room, dusty, even behind the TV also full of dust. If you have stay in Shangri-La Sentosa, you will definitely disappointed with equarius hotel."
31,1650540346-31,https://www.traveloka.com/id-id/hotel/singapore/resorts-world-sentosa---equarius-hotel-1000000502230?spec=22-04-2022.23-04-2022.1.1.HOTEL.1000000502230.Resorts%20World%20Sentosa%20-%20Equarius%20Hotel.2,,Kedia N. S.,3-Oct-21,"The hotel doesn't have breakfast facility which is a bit of a challenge. We were on a one plus one deal and the first day our rooms we got were not interconnected, upon request we did get the interconnected rooms on our second night, which was more cleaner and hygienic then the first one."
32,1650540346-32,https://www.traveloka.com/id-id/hotel/singapore/resorts-world-sentosa---equarius-hotel-1000000502230?spec=22-04-2022.23-04-2022.1.1.HOTEL.1000000502230.Resorts%20World%20Sentosa%20-%20Equarius%20Hotel.2,,Lee T. C.,24-Sep-21,"Took 1hr 45mins for checking into my room. There are 4 self check in kiosks. However, these machines don't work well and there isn't any hotel staff standing nearby to provide support. Went to join the Q for check in. However, still have to wait 30 mins. Finally managed to get one hotel staff to assist me on self kiosk check in. However, room still not ready. I have to wait around 45 mins to check into the room."
33,1650540346-33,https://www.traveloka.com/id-id/hotel/singapore/resorts-world-sentosa---equarius-hotel-1000000502230?spec=22-04-2022.23-04-2022.1.1.HOTEL.1000000502230.Resorts%20World%20Sentosa%20-%20Equarius%20Hotel.2,,Lin Y.,23-Sep-21,"Rooms are big, bathtub and peaceful environment, balcony is a plus."
35,1650540346-35,https://www.traveloka.com/id-id/hotel/singapore/resorts-world-sentosa---equarius-hotel-1000000502230?spec=22-04-2022.23-04-2022.1.1.HOTEL.1000000502230.Resorts%20World%20Sentosa%20-%20Equarius%20Hotel.2,,Tay H. W. E.,13-Sep-21,The check in process is really bad. Staff service wasn't very helpful and little information is shared with you (like pool booking) when checking in. Opted for early check in when making the booking and wasn't contacted by the hotel that it was not available. Ended up waiting for 2 hours at Starbucks to wait for the room to be ready. Please call them to confirm if your early check in is confirmed.
36,1650540346-36,https://www.traveloka.com/id-id/hotel/singapore/resorts-world-sentosa---equarius-hotel-1000000502230?spec=22-04-2022.23-04-2022.1.1.HOTEL.1000000502230.Resorts%20World%20Sentosa%20-%20Equarius%20Hotel.2,,Low K. G.,11-Sep-21,Room was only ready at 5pm so we didn't manage to make full use of the room (and the check out was at 11am).
37,1650540346-37,https://www.traveloka.com/id-id/hotel/singapore/resorts-world-sentosa---equarius-hotel-1000000502230?spec=22-04-2022.23-04-2022.1.1.HOTEL.1000000502230.Resorts%20World%20Sentosa%20-%20Equarius%20Hotel.2,,Mohammad E. H.,8-Sep-21,This hotel is awesome for family getaway. Free transport (buggy) available from hotel to main attraction point.
38,1650540346-38,https://www.traveloka.com/id-id/hotel/singapore/resorts-world-sentosa---equarius-hotel-1000000502230?spec=22-04-2022.23-04-2022.1.1.HOTEL.1000000502230.Resorts%20World%20Sentosa%20-%20Equarius%20Hotel.2,,Ong G. R.,23-Aug-21,"Power hotel service, did not process late check out request. Bathroom sink choked, water flow low."
39,1650540346-39,https://www.traveloka.com/id-id/hotel/singapore/resorts-world-sentosa---equarius-hotel-1000000502230?spec=22-04-2022.23-04-2022.1.1.HOTEL.1000000502230.Resorts%20World%20Sentosa%20-%20Equarius%20Hotel.2,,Jannah B. J.,17-Aug-21,"Aside from the check in experience, the hotel experience overall was worth it. Pool is big, although there is no kids pool. The room itself os also big with the bathtub being able to fit two adults. Room space can comfortably fit two baby cots. As for the check in, need to press on them. Came in 2.30pm, checked in to hotel room only at close to 4.30pm."
40,1650540346-40,https://www.traveloka.com/id-id/hotel/singapore/resorts-world-sentosa---equarius-hotel-1000000502230?spec=22-04-2022.23-04-2022.1.1.HOTEL.1000000502230.Resorts%20World%20Sentosa%20-%20Equarius%20Hotel.2,,Cheong C. M. V.,15-Aug-21,"Super nice clean spacious rooms, staff all very friendly. Enjoyed our stay."
41,1650540346-41,https://www.traveloka.com/id-id/hotel/singapore/resorts-world-sentosa---equarius-hotel-1000000502230?spec=22-04-2022.23-04-2022.1.1.HOTEL.1000000502230.Resorts%20World%20Sentosa%20-%20Equarius%20Hotel.2,,Andrade A.,6-Aug-21,"My 3D2N staycation was truly awesome and fuss-free. We were offered a high level twin bed room with adventure cove/cable car view. The service team was very welcoming and attentive from the get-go. There is a free buggy shuttle to bring you to and for from Hotel Michael Lobby. The booking of facilities was smooth and done in a minute. I highly recommend Equarius hotel for couples, families with kids & friends. Hope to come back for another round of staycation with connecting rooms."
42,1650540346-42,https://www.traveloka.com/id-id/hotel/singapore/resorts-world-sentosa---equarius-hotel-1000000502230?spec=22-04-2022.23-04-2022.1.1.HOTEL.1000000502230.Resorts%20World%20Sentosa%20-%20Equarius%20Hotel.2,,Wei C. T.,29-Jul-21,"The stay was awesome although everytime we leave our room, we had to show our photo id. There is free buggy service to casino area. Check in was relatively fast for weekdays but had to wait awhile to go into our room."
43,1650540346-43,https://www.traveloka.com/id-id/hotel/singapore/resorts-world-sentosa---equarius-hotel-1000000502230?spec=22-04-2022.23-04-2022.1.1.HOTEL.1000000502230.Resorts%20World%20Sentosa%20-%20Equarius%20Hotel.2,,Lim W. S.,28-Jul-21,"Had to wait till 6 pm to check in to the hotel, no seats avaliable at reception and was standing waiting for 3 hours together with my pregnant wife and 2 year old baby."
44,1650540346-44,https://www.traveloka.com/id-id/hotel/singapore/resorts-world-sentosa---equarius-hotel-1000000502230?spec=22-04-2022.23-04-2022.1.1.HOTEL.1000000502230.Resorts%20World%20Sentosa%20-%20Equarius%20Hotel.2,,Ong S. G.,23-Jul-21,"Overall satisfactory stay on a weekday. Booked a deluxe room and the room was really spacious and quite clean. Bed was quite comfortable. Needed to book a slot for the swimming pool with not much hassle. Downside is that check in was abit late, could only check in close to 3.45pm although we have arrived at our timeslot of 2pm to 3pm. Hence had to skip some of our plans. Also to our disappointment, not much restaurants were open at RWS on a weekday (this was before phase 2HA when dining in was still possible). Breakfast at Hotel Michael was acceptable."
45,1650540346-45,https://www.traveloka.com/id-id/hotel/singapore/resorts-world-sentosa---equarius-hotel-1000000502230?spec=22-04-2022.23-04-2022.1.1.HOTEL.1000000502230.Resorts%20World%20Sentosa%20-%20Equarius%20Hotel.2,,Lim H. L. J.,23-Jul-21,"Room was super spacious, so was the bathroom! Swimming pool was real nice as well. Reception check in was a bit bumpy because the guy didn't register my requests which I sent in months back. Otherwise, great stay? Recommend."
47,1650540346-47,https://www.traveloka.com/id-id/hotel/singapore/resorts-world-sentosa---equarius-hotel-1000000502230?spec=22-04-2022.23-04-2022.1.1.HOTEL.1000000502230.Resorts%20World%20Sentosa%20-%20Equarius%20Hotel.2,,Lim T.,10-Jul-21,"Had stayed at Equarius Hotel on numerous occasions. The large room, the large bathroom with the big bathtub. The quiet surroundings is always a plus for a relaxing staycation."
48,1650540346-48,https://www.traveloka.com/id-id/hotel/singapore/resorts-world-sentosa---equarius-hotel-1000000502230?spec=22-04-2022.23-04-2022.1.1.HOTEL.1000000502230.Resorts%20World%20Sentosa%20-%20Equarius%20Hotel.2,,Muhammad A. B. M.,8-Jul-21,"Spacious room that comes with a bathtub, balcony, high quality amenity kits and TWG branded tea in room. Free parking, free buggy ride around RWS, pool and gym. Worth it."
49,1650540346-49,https://www.traveloka.com/id-id/hotel/singapore/resorts-world-sentosa---equarius-hotel-1000000502230?spec=22-04-2022.23-04-2022.1.1.HOTEL.1000000502230.Resorts%20World%20Sentosa%20-%20Equarius%20Hotel.2,,Eugene M.,6-Jul-21,A wonderful stay that's different from the usual staycation. Gives you a Bali vibe
50,1650540346-50,https://www.traveloka.com/id-id/hotel/singapore/resorts-world-sentosa---equarius-hotel-1000000502230?spec=22-04-2022.23-04-2022.1.1.HOTEL.1000000502230.Resorts%20World%20Sentosa%20-%20Equarius%20Hotel.2,,Yeo L. K.,6-Jul-21,"The service/replies from the customer service officer at check in could be improved. Moreover, they are unable to prepare any form of celebration for birthday."
51,1650540346-51,https://www.traveloka.com/id-id/hotel/singapore/resorts-world-sentosa---equarius-hotel-1000000502230?spec=22-04-2022.23-04-2022.1.1.HOTEL.1000000502230.Resorts%20World%20Sentosa%20-%20Equarius%20Hotel.2,,Chloe Z.,3-Jul-21,Love the pool! Can do laps in it!
52,1650540346-52,https://www.traveloka.com/id-id/hotel/singapore/resorts-world-sentosa---equarius-hotel-1000000502230?spec=22-04-2022.23-04-2022.1.1.HOTEL.1000000502230.Resorts%20World%20Sentosa%20-%20Equarius%20Hotel.2,,Ng Wei S.,3-Jul-21,Check in at 3pm and check out time at 11am means total 20 hours of stay for the price may not be worth it. Hotel has heightened security. All occupant and guests have to be registered in order to pass through the security by showing ID to go to room/lift everytime on top of safe entry. Quite dampening of the whole experience actually. Room is huge for lead in category. Pool at Beach Villa has tranquility but need to book in advance.
