DELIMITER SEPARATION,web-scraper-order,web-scraper-start-url,pagination,user,date,review
90,1650540346-90,https://www.traveloka.com/id-id/hotel/singapore/resorts-world-sentosa---equarius-hotel-1000000502230?spec=22-04-2022.23-04-2022.1.1.HOTEL.1000000502230.Resorts%20World%20Sentosa%20-%20Equarius%20Hotel.2,,Yee F. L.,8-May-21,Check-in was overall smooth although with some hiccup. Room was big and service was good. Have to walk quite a-bit from hotel lobby to the lift though. The fridge has a weird smell and we did not use at all. Buggy frequency ok but the staff over at hotel Michael side needs to ensure proper queuing of guests using the rides. Went during weekdays and most of the shops and restaurants were closed.
92,1650540346-92,https://www.traveloka.com/id-id/hotel/singapore/resorts-world-sentosa---equarius-hotel-1000000502230?spec=22-04-2022.23-04-2022.1.1.HOTEL.1000000502230.Resorts%20World%20Sentosa%20-%20Equarius%20Hotel.2,,Chantal D. S.,7-May-21,"Wasn’t able to check in early, went in at usual check in time 3PM but was told the room was not ready yet. The check in area was very crowded, looks like early check in wasn’t possible. After one hour of waiting, we went back to ask and was told the room is still not ready. But by then most of the guests were cleared. Pretty unfair that we were held back for so long, we asked when would it be ready and the staff couldn’t answer us, said latest by 5PM. Usually check out time for most hotels is 12pm but this hotel was 11am. 4 hours to prepare rooms were not enough on a weekday? End up need 6 hours? On previous staycations there were times we were denied late checkout in order to prepare for the next guest’s room, where was this preparation? They told us 1PM was the latest checkout they could give, which was essentially giving us back the 2 hours they took from us. We couldn’t put our bags down and go explore sentosa in 2hours. Even if we could, they couldn’t tell us only after 1.5h when our room will be ready. Giving us back the time they took from us was not enough, it should have been a given since it was their error. When we asked if there was more that could be done for us like dining credits or upgrade or later checkout, they said no. That is really bad service when it’s my friend and mine’s special day to celebrate my graduation but instead my day of planned activities were thoroughly ruined. Giving us 2 hours more of hotel wouldn’t have remedied our compromised plans. After we checked into our room we called the guest service to ask again if something could be done and they said they would call us back. They in fact never called back. Furthermore, we asked for a knife to cut some fruit but were told there were no sharp items as part of their policy. Seriously? There was also no conditioner and laundry bags which I thought was a given. I used to bring those until 5 hotels I’ve been to provided them. This is a small matter but still we were somewhat inconvenienced. The room was great, but what horrified us was that there were dead flies found on the bathtub overnight. The tub was big and spacious which we enjoyed but finding flies on it the next day was gross. They also didn’t bother to cover the mattress. When we asked for more tea, they gave them to us in a trash bag. Overall very disappointing service, which we expected more since it’s a sentosa staycation. Undeniably the room was big and nice except for the lack of some stuff provided and the dead flies. Poor service and lack of preparation really ruined our staycation experience. We expected more since it’s sentosa and meant to be more ‘atas’. Also instructions to get here were not accurate, we spent an hour walking around trying to find the place until we were told you can’t even walk there and need to take another shuttle service that is not advertised or shown publicly. The directions given on the website are not good enough. What was very apparent was that the staff didn’t care about us. We are relieved our 2 hours were given back to us, but the coldness towards us when we asked for more were not appreciated (they initially wanted to give us 1 hour back only). We felt like we didn’t ask for much, we just wanted a gesture or token for the severe inconvenience and unhappiness they caused us. It’s a staycation meant for us to relax but we were kept stalled and idling when we had a whole day planned for us (I.e. go to the beach then have dinner - instead just have dinner cause no time to go to the beach else too late to have dinner, and then it rained the next day so can’t go to the beach) Felt like it was a waste of the SRV voucher, without the app deal to cover some of the costs, we would be way more infuriated. Still, $131 was a waste of money, I can definitely get better service and experiences from other 5 star hotels with the same money with SRV and app deals. Though the room is spacious and nice, our experience is screaming otherwise especially with the flies. Both my friend’s skin and mine broke out the next day, making us question the cleanliness of the place or the sheets since our room took that long to get ready. The shortage of staff probably was so that the rooms were not even thoroughly cleaned. Not sure if this is typical of Sentosa hotels but most likely not coming back here again. Seriously, I expect this kind of experience or service from a 2 star hotel, or even 3 star hotel staff service. The staff were not even apologetic. The safe distancing ambassadors and shuttle staff were even friendlier than the hotel staff"
93,1650540346-93,https://www.traveloka.com/id-id/hotel/singapore/resorts-world-sentosa---equarius-hotel-1000000502230?spec=22-04-2022.23-04-2022.1.1.HOTEL.1000000502230.Resorts%20World%20Sentosa%20-%20Equarius%20Hotel.2,,Chee J. Y.,7-May-21,"Had a hard time looking for directions to Equarius as no information was provided, even their signboards at RWS was not updated with 'Equarius'. Thankfully we managed to find St Michael's Hotel and took a buggy from there. Arrived at the hotel after a long wait for the buggy (buggy timing intervals can be improved). Sadly, there was no staff to greet nor direct us to the check in counter (disappointing for a 5 star hotel), we had to look around for staff only to see SDAs, which was very confusing as they seemed to be managing the check in queue instead of uniformed staff. Got a number from an SDA (not a hotel uniformed staff, confusing) and the queue was horrendously long. Thankfully I walked around the hotel while waiting and then noticed there was a self check in counter which had a short queue and managed to check in smoothly without having to wait in the queue. Would have appreciated if the SDAs since there was barely any other staff around, had the initiative to direct us to the self check in machine instead of just directing us to join the queue; this will not only improve your guests waiting time but also your hotel productivity (that's the point of your machine right?). Room was huge, clean and was overall great. But not so satisfied when the TV was not in working condition, the toilet bowl area had a strong sewage smell and one of the power point was not working. Disappointing in these aspects. Also pretty disappointed that it was our anniversary (had notify the hotel), but all we got was a card that was not signed off by any staff and a sad looking single red balloon, not impressive at all. Had higher expectations as I saw multiple reviews that other guests when celebrated their anniversary at Equarius received teddy bears, signed cards by staffs, complimentary room upgrade etc...All we got was a card and balloon. Other 5 stars hotel would at least fold towels into swan shapes and place it on the bed or put some petals around the room.. Not impressed for our special occasion. :( Would give this experience a 2.5/5, may not be back again as the experience didn't WOW me at all and the hotel isn't exactly located conveniently anyway. :("
94,1650540346-94,https://www.traveloka.com/id-id/hotel/singapore/resorts-world-sentosa---equarius-hotel-1000000502230?spec=22-04-2022.23-04-2022.1.1.HOTEL.1000000502230.Resorts%20World%20Sentosa%20-%20Equarius%20Hotel.2,,Catherine T.,5-May-21,"Hotel room is fine and facilities good. But staff was not efficient due to miscommunication or overworked I suppose. Waited for about 2 hours to check in; staff said one of our rooms had no bathtub which was incorrect. There are bathtubs for our 2 rooms. Requested for adjoining rooms, got them but one door linking our rooms was faulty and could not be opened at all. We did not bother to report anyway. My children were locked out of their rooms after their swim on the 2nd day as they thought they had checked out which was ridiculous. They apologised and gave us an extra hour to check out though. On the whole, just felt that the service fell short of our expectations given that the hotel is reputed to be one of the best in RWS."
95,1650540346-95,https://www.traveloka.com/id-id/hotel/singapore/resorts-world-sentosa---equarius-hotel-1000000502230?spec=22-04-2022.23-04-2022.1.1.HOTEL.1000000502230.Resorts%20World%20Sentosa%20-%20Equarius%20Hotel.2,,Mok Y.,29-Apr-21,"Big rooms, big tub, excellent service, peaceful part of sentosa, our room had a great view of the cable cars"
96,1650540346-96,https://www.traveloka.com/id-id/hotel/singapore/resorts-world-sentosa---equarius-hotel-1000000502230?spec=22-04-2022.23-04-2022.1.1.HOTEL.1000000502230.Resorts%20World%20Sentosa%20-%20Equarius%20Hotel.2,,TAN S.,28-Apr-21,"Had booked a room with garden view, the scenery was awesome and beautiful. Room was spacious and clean, it was a great experience away from the city. Except had difficulties locating the hotel, it would be better if info of shuttle bus service is provided after the booking. Overall, it is a good experience^^"
97,1650540346-97,https://www.traveloka.com/id-id/hotel/singapore/resorts-world-sentosa---equarius-hotel-1000000502230?spec=22-04-2022.23-04-2022.1.1.HOTEL.1000000502230.Resorts%20World%20Sentosa%20-%20Equarius%20Hotel.2,,Go Hui C.,28-Apr-21,"The bathrooms are great (no fighting during wash up time as there are two sinks) and the room size is a plus! Furnishings are plush, well maintained, and as each room has a balcony (mine overlooks the adventure cove waterpark), it truly feels like you are “overseas” for a while as compared to a staycation in town. Breakfast (need to take a shuttle to Hotel Michael) is decent if you need to fill your stomach but ok to skip too if you like to sleep in. Check in was a little slow and the need to check nice everytime you wish to go back to the room from the lobby is quite a hassle. The shuttle service from Monday 3.30pm onwards till Fri apparently is only provided via buggy rides (so you can still get a little wet when it rains). Only on weekends do they provide the 12 seater van for shuttle service."
98,1650540346-98,https://www.traveloka.com/id-id/hotel/singapore/resorts-world-sentosa---equarius-hotel-1000000502230?spec=22-04-2022.23-04-2022.1.1.HOTEL.1000000502230.Resorts%20World%20Sentosa%20-%20Equarius%20Hotel.2,,CHEOK L. Y.,28-Apr-21,The counter staff - Su Ying is extremely Attentive and kind. The hotel room is big and very cozy. Will definitely come back. Again!!
99,1650540346-99,https://www.traveloka.com/id-id/hotel/singapore/resorts-world-sentosa---equarius-hotel-1000000502230?spec=22-04-2022.23-04-2022.1.1.HOTEL.1000000502230.Resorts%20World%20Sentosa%20-%20Equarius%20Hotel.2,,Lin W.,28-Apr-21,The ambience of the hotel is awesome. We had an enjoyable stay. The staff made us feel welcomed and were very friendly to interact with.
100,1650540346-100,https://www.traveloka.com/id-id/hotel/singapore/resorts-world-sentosa---equarius-hotel-1000000502230?spec=22-04-2022.23-04-2022.1.1.HOTEL.1000000502230.Resorts%20World%20Sentosa%20-%20Equarius%20Hotel.2,,Oh Seng L.,28-Apr-21,"Took the Island Joy deluxe room package with breakfast with dolphin. Loved the huge room with great sea view and dream bathroom. Swimming at the private villa area was great. Staff are very friendly, esp Ariel who sent us back and forth to dolphin island with a great smile. Enjoyed all the free buggy rides out to RWS. The breakfast with dolphin is super worth, esp during covid period now, you get exclusive time with them. The whole stay was a memorable experience."
101,1650540346-101,https://www.traveloka.com/id-id/hotel/singapore/resorts-world-sentosa---equarius-hotel-1000000502230?spec=22-04-2022.23-04-2022.1.1.HOTEL.1000000502230.Resorts%20World%20Sentosa%20-%20Equarius%20Hotel.2,,Fong L. M.,28-Apr-21,=- Clean and spacious room. - Thoughtful and helpful staff. - Nice view. Highly recommended. I would go back again
102,1650540346-102,https://www.traveloka.com/id-id/hotel/singapore/resorts-world-sentosa---equarius-hotel-1000000502230?spec=22-04-2022.23-04-2022.1.1.HOTEL.1000000502230.Resorts%20World%20Sentosa%20-%20Equarius%20Hotel.2,,Ng Raymond,26-Apr-21,This hotel is great. We stay for 1 night and the room is spacious. We have a super king size bed and we are given sea view. Hotel staff is friendly. The only downside is we have to take a shuttle bus to Micheal hotel for breakfast.
103,1650540346-103,https://www.traveloka.com/id-id/hotel/singapore/resorts-world-sentosa---equarius-hotel-1000000502230?spec=22-04-2022.23-04-2022.1.1.HOTEL.1000000502230.Resorts%20World%20Sentosa%20-%20Equarius%20Hotel.2,,Yeo S. L.,24-Apr-21,"The hotel room is spacious and there's a balcony with nice view. Great for family staycations. But only flaw is maybe due to covid, the breakfast is served at another hotel and it is a little far from the main attraction area. Luckily the hotel provide free rides to hotel Michael where we can get to dining and other facilities."
104,1650540346-104,https://www.traveloka.com/id-id/hotel/singapore/resorts-world-sentosa---equarius-hotel-1000000502230?spec=22-04-2022.23-04-2022.1.1.HOTEL.1000000502230.Resorts%20World%20Sentosa%20-%20Equarius%20Hotel.2,,Tan S. H.,23-Apr-21,Booked a stay for my parents at the equarius and they enjoyed their stay very much! Thank you Traveloka for the epic sale 🥰
105,1650540346-105,https://www.traveloka.com/id-id/hotel/singapore/resorts-world-sentosa---equarius-hotel-1000000502230?spec=22-04-2022.23-04-2022.1.1.HOTEL.1000000502230.Resorts%20World%20Sentosa%20-%20Equarius%20Hotel.2,,Chua S. P.,21-Apr-21,"I was given a room on the 5th floor, which doesn’t look like the photo in your website. The balcony is all concrete, whereas the photo shows otherwise."
106,1650540346-106,https://www.traveloka.com/id-id/hotel/singapore/resorts-world-sentosa---equarius-hotel-1000000502230?spec=22-04-2022.23-04-2022.1.1.HOTEL.1000000502230.Resorts%20World%20Sentosa%20-%20Equarius%20Hotel.2,,Erin L.,21-Apr-21,"The service was great, however the room I was in had issues with hot water that was intermittently unavailable. There were buses running on weekends, but it seems that the shuttle service changed to buggy on weekdays. Some queueing and waiting is expected as each buggy could only accommodate 4 to 6 pax.  But the check in services was nice to accommodate as I had queried how would a consumer know as we rely on third party agents for full information when the booking was made."
107,1650540346-107,https://www.traveloka.com/id-id/hotel/singapore/resorts-world-sentosa---equarius-hotel-1000000502230?spec=22-04-2022.23-04-2022.1.1.HOTEL.1000000502230.Resorts%20World%20Sentosa%20-%20Equarius%20Hotel.2,,Leong W. T.,21-Apr-21,"Spacious room with high ceiling with cityview. Staff are friendly & helpful, definitely will stay at this hotel again."
108,1650540346-108,https://www.traveloka.com/id-id/hotel/singapore/resorts-world-sentosa---equarius-hotel-1000000502230?spec=22-04-2022.23-04-2022.1.1.HOTEL.1000000502230.Resorts%20World%20Sentosa%20-%20Equarius%20Hotel.2,,Shaiful R.,20-Apr-21,"Room is very huge, including toilet. Nice little balcony to hang out while watching sunset/sunrise. Very quiet and peaceful, good to recharge yourself. The pool area is huge. Enjoyed swimming. Only downside is that the breakfast is located in another hotel, although there’s shuttle service, a little hassle. It’s not ala carte buffet so you can actually skip the breakfast. And there are no room service. If they have, would be great. However, you can order from the restaurant around RWS so that’s pretty good"
109,1650540346-109,https://www.traveloka.com/id-id/hotel/singapore/resorts-world-sentosa---equarius-hotel-1000000502230?spec=22-04-2022.23-04-2022.1.1.HOTEL.1000000502230.Resorts%20World%20Sentosa%20-%20Equarius%20Hotel.2,,Roger L.,20-Apr-21,"no where to find food other than out of hotel via shuttle to another hotel. minimumly should have a food outlet for takeway if claimed is too small. room was not cleaned, merely touch and go"
110,1650540346-110,https://www.traveloka.com/id-id/hotel/singapore/resorts-world-sentosa---equarius-hotel-1000000502230?spec=22-04-2022.23-04-2022.1.1.HOTEL.1000000502230.Resorts%20World%20Sentosa%20-%20Equarius%20Hotel.2,,Suzziani B. K.,18-Apr-21,"This accommodation is perfect for birthday treat for your lovesome and very suitable for families with toddlers. My boys are 5, 4 and 1 year old. We booked the staycation there to celebrate my son's birthday and it went so well. We especially loved the room is super huge and it's comfortable to stay in with big families. The balcony allows the adult to have a separate space for short period of time while the children entertained themselves with the tv, or their personal phones on the comfort of the huge bed. My baby was enjoying himself crawling around the room that is full carpet which is a bonus for us. Places are clean and service is over the top, the response very quickly to attend to your needs. The pool is wonderful. We enjoy our time there and look forward to be back there again."
111,1650540346-111,https://www.traveloka.com/id-id/hotel/singapore/resorts-world-sentosa---equarius-hotel-1000000502230?spec=22-04-2022.23-04-2022.1.1.HOTEL.1000000502230.Resorts%20World%20Sentosa%20-%20Equarius%20Hotel.2,,Gan T. C. C.,16-Apr-21,Great hotel. Gym is at Hotel Michael which was small and a little out dated. Excellent service by the staffs.
112,1650540346-112,https://www.traveloka.com/id-id/hotel/singapore/resorts-world-sentosa---equarius-hotel-1000000502230?spec=22-04-2022.23-04-2022.1.1.HOTEL.1000000502230.Resorts%20World%20Sentosa%20-%20Equarius%20Hotel.2,,tinuttha c.,16-Apr-21,"Big room and cozy but don't have any room services (Drink and snacks or foods) From direct hotel, you can order with qr code menu from other place with free delivery $30+ and this hotel isn't recommend for kids or baby. The swimming pool is L nice but have many mosquito and can't go near the villa. No kids zone no kids pool. For the gym you have to walk go to other hotel. Check in abit slow and have to book appointments for check in times."
113,1650540346-113,https://www.traveloka.com/id-id/hotel/singapore/resorts-world-sentosa---equarius-hotel-1000000502230?spec=22-04-2022.23-04-2022.1.1.HOTEL.1000000502230.Resorts%20World%20Sentosa%20-%20Equarius%20Hotel.2,,Li Minghui,15-Apr-21,"Service was great and the room was big. Due to the pandemic situation, buggy ride (with scheduled timings) was offered to and from between Equarius Hotel and Michael Hotel."
114,1650540346-114,https://www.traveloka.com/id-id/hotel/singapore/resorts-world-sentosa---equarius-hotel-1000000502230?spec=22-04-2022.23-04-2022.1.1.HOTEL.1000000502230.Resorts%20World%20Sentosa%20-%20Equarius%20Hotel.2,,Kinki T. J.,15-Apr-21,"As per hotel requirements, we reach to check in at 3pm but we only can to check in after 1 hour later. When you thought you going get your room, they told you that you can only have the room 1 hour later. It become 5pm then I am able to get the room. So I ask for late check out but only able to extend from 11am to 12noon. I checked in earlier than my friend, but she got her room first. No breakfast provided there. You need to take shuttle bus to RWS to get your breakfast fix. It is the season for cricket or some bugs. Keep flying around the balcony. It is very huge. Quite a few until I don’t even dare to see the view."
115,1650540346-115,https://www.traveloka.com/id-id/hotel/singapore/resorts-world-sentosa---equarius-hotel-1000000502230?spec=22-04-2022.23-04-2022.1.1.HOTEL.1000000502230.Resorts%20World%20Sentosa%20-%20Equarius%20Hotel.2,,Jennifer L. Y. L.,14-Apr-21,"Pros: Spacious room Nice pool Cons - base on expectation of a 5 stars hotel: 1) Check in is such a hassle; reach around 2pm and was told to wait in a waiting area with a waiting number and when your number is called, you need to wait again near the check in counter, once its your turn for check in, they register you and tell me my room is not ready and I need to check later with the concierge at 3pm to see if my room is ready. Check with concierge at 3.05pm and was told its not ready and told me to wait for another 15mins. When I go back 15mins later, I was again told it is not ready and say to wait 5mins, when I go back 5mins later I was told to queue up for my turn, 20mins in the queue did I finally get my room. 2) Weird smell on the bed sheets. Not sure what detergent the hotel use but the smell is not pleasant. 3) There is a drainage smell in the bathroom. the bathroom is very big with a bathtub and a separate shower area, the stench come from there which after some investigation, I conclude the shower area might not have been use for awhile (who will use that if there is a bathtub available), I suspect the smell come up from the shower area drainage hole. 4) Tattered hand towel, I am surprised a 5stars hotel never screen through the towel they serve. 5) Dusty at some area in the room. Some area of the rooms are not clean up properly, the study table below the table is dusty. 5) Staff nor evenly distributed to work around. There are 4-5 staff around check in area and the secondary waiting area but only 3-4 check in counters are open. There are another 2 staff to check your ID at a narrow walkway towards hotel lift, do they need 2 person there since there is only 1 laptop doing the checking? How many checking do we need, Too many checks for my leisure stay not a relaxing staycation. Overall not worth the price, I pay almost $600 for 3d2n. I have been to other hotels during this period and the check in is a breeze and I was even given early check in from hotels busier than Equarius and I also saw quite a few hotel guest complaining the same thing."
116,1650540346-116,https://www.traveloka.com/id-id/hotel/singapore/resorts-world-sentosa---equarius-hotel-1000000502230?spec=22-04-2022.23-04-2022.1.1.HOTEL.1000000502230.Resorts%20World%20Sentosa%20-%20Equarius%20Hotel.2,,Norul R.,10-Apr-21,The room was spacious and clean! Very good service overall. Highly recommended.
117,1650540346-117,https://www.traveloka.com/id-id/hotel/singapore/resorts-world-sentosa---equarius-hotel-1000000502230?spec=22-04-2022.23-04-2022.1.1.HOTEL.1000000502230.Resorts%20World%20Sentosa%20-%20Equarius%20Hotel.2,,Chong,8-Apr-21,"The room and view from the room is fantastic! However, the check in process is too long. Reached around 2.30pm and check in waiting time took almost an hr and after that room wasn't ready till 5pm. That was quite a letdown and time wasted. The location is a distance from the main Resort World area but there is free shuttle to bring us over. Only thing is the waiting time sometimes. The pool is not within the main hotel area and had to walk out of the hotel and to the nearby beach villas. Slight inconvenience but still acceptable. Was a great staycation overall and a place I would return to."
118,1650540346-118,https://www.traveloka.com/id-id/hotel/singapore/resorts-world-sentosa---equarius-hotel-1000000502230?spec=22-04-2022.23-04-2022.1.1.HOTEL.1000000502230.Resorts%20World%20Sentosa%20-%20Equarius%20Hotel.2,,Sim S. H.,5-Apr-21,"the room is great, love how spacious it is. aside from that, entire experience there was rather unpleasant. I booked 3 rooms for my family of 7. requested for connecting room as we had a baby and it would be more convenient. initially the staff declined our request because my brother in law ic is of different residential address. had to make a fuss before they gave us the connecting room. and I do not understand the 5 pax per room rule? I thought restrictions had been eased and social gathering of 8 person is allowed? anyway, they also require every single person's IC for registration which is understandable however each time we exit and go back to our hotel room, we need to present our IC again. even baby needs to have their birth cert presented. staff were extremely inflexible/unaccommodating. do not recommend visiting this hotel especially if you have a big family."
119,1650540346-119,https://www.traveloka.com/id-id/hotel/singapore/resorts-world-sentosa---equarius-hotel-1000000502230?spec=22-04-2022.23-04-2022.1.1.HOTEL.1000000502230.Resorts%20World%20Sentosa%20-%20Equarius%20Hotel.2,,Chong S. C.,5-Apr-21,"Room was spacious & big, with balcony & large bathroom, good views. Area was peaceful & quiet as well. Had to book 1 hour slots for use of swimming pool but wasn't crowded. Buggy shuttle between hotel & main RWS area was quite frequent, around 5-10 min wait."
